question,answer,contexts,ground_truth
Gói FlavorLock™ là gì?,Gói FlavorLock™ là một gói kín khí được sử dụng bởi Starbucks để bảo quản hương vị của cà phê rang tươi. Nó sử dụng loại van một chiều đặc biệt để giải phóng carbon dioxide mà không cho khí ôxy làm nhạt hương vị.,"['Gói FlavorLock™ là gì?\nCông nghệ FlavorLock™ độc đáo của chúng tôi sử dụng loại van một chiều đặc biệt cho phép carbon dioxide từ các hạt cà phê rang tươi giải phóng khỏi gói cà phê đã dán kín mà không cho khí ôxy làm nhạt hương vị lọt vào. Tất cả các loại cà phê Starbucks được bán trong gói nửa pound (225g) và một pound (450g) được dán kín trong các gói FlavorLock™ kín khí trong 2 giờ kể từ khi rang, nhờ đó nó giữ được mùi vị thơm ngon cho đến khi bạn sẵn sàng sử dụng.', 'Các món khác: \nSignature Chocolate: Signature Chocolate tại Starbucks là một món đồ uống ngọt ngào, kết hợp giữa chocolate độc quyền đậm đà và kem mịn, mang đến một trải nghiệm béo ngậy, thơm lừng và hoàn hảo cho những ai yêu thích hương vị chocolate. Món nước này có thể được tùy chỉnh nóng hoặc lạnh.', 'Dragon Drink With Mango Dragonfruit: Dragon Drink with Mango Dragonfruit Refresher tại Starbucks là món đồ uống mát lạnh kết hợp giữa hương vị của xoài và thanh long cùng với sữa dừa, tạo ra một thức uống ngọt ngào, tươi mát với hương xoài và thanh long thơm ngon. Món nước này chỉ có thể được tùy chỉnh lạnh.\nCà món trà lắc:\nStarbucks cung cấp 6 loại trà lắc cho bạn lựa chọn:']","Công nghệ FlavorLock™ độc đáo của chúng tôi sử dụng loại van một chiều đặc biệt cho phép carbon dioxide từ các hạt cà phê rang tươi giải phóng khỏi gói cà phê đã dán kín mà không cho khí ôxy làm nhạt hương vị lọt vào. Tất cả các loại cà phê Starbucks được bán trong gói nửa pound (225g) và một pound (450g) được dán kín trong các gói FlavorLock™ kín khí trong 2 giờ kể từ khi rang, nhờ đó nó giữ được mùi vị thơm ngon cho đến khi bạn sẵn sàng sử dụng."
Tôi nên sử dụng loại cà phê xay nào?,"Bắt đầu với cà phê nguyên hạt và xay mới cho mỗi ấm hoặc đem đến cửa hàng bán lẻ để được xay, tùy thuộc vào sở thích của bạn. Đối với máy pha cà phê Espresso, sử dụng bột cà phê xay mịn, 30-35 giây trong máy xay lưỡi dẹt.","['Tôi nên sử dụng loại cà phê xay nào?\nĐể có được loại cà phê có hương vị thơm ngon nhất, chúng tôi tiếp tục khuyên bạn nên bắt đầu với cà phê nguyên hạt và xay mới cho từng ấm. Hoặc nếu thích, bạn có thể đem cà phê nguyên hạt tới cửa hàng bán lẻ tại địa phương và nhờ họ xay cho bạn.', 'Những người pha cà phê phin làm tốt nhất với phương pháp xay tổng hợp có sẵn ở các loại cà phê nghiền sơ hoặc với kiểu xay dành riêng cho phin pha loại đáy bằng hoặc hình nón. Tất cả các cửa hàng của Starbucks đều có thể xay cà phê theo kỹ thuật này. Các máy pha cà phê Espresso rất nhạy với cà phê xay và đòi hỏi bột cà phê xay phải rất mịn, 30-35 giây trong máy xay lưỡi dẹt. Cà phê nhỏ giọt chậm và nhanh thường do bột cà phê xay quá mịn hoặc quá thô, hạt cà phê espresso bị đóng băng hoặc đông lạnh và chèn', 'Các món đá xay có cà phê tại Starbucks:\nJava Chip Frappuccino: Java Chip Frappuccino tại Starbucks là món đồ uống đá xay kết hợp giữa cà phê Frappuccino Roast, chocolate chip và sữa, tạo ra một thức uống ngọt ngào, béo ngậy với hương vị cà phê và chocolate đậm đà, hoàn hảo cho những ai yêu thích sự kết hợp này.']","Để có được loại cà phê có hương vị thơm ngon nhất, chúng tôi tiếp tục khuyên bạn nên bắt đầu với cà phê nguyên hạt và xay mới cho từng ấm. Hoặc nếu thích, bạn có thể đem cà phê nguyên hạt tới cửa hàng bán lẻ tại địa phương và nhờ họ xay cho bạn."
Cách bảo quản cà phê tốt nhất là gì? ,"Mua cà phê hàng tuần, bảo quản trong thùng chứa kín ở nơi mát mẻ, ít ánh sáng và chỉ xay cà phê trước khi pha.","['Câu hỏi thường gặp về Chuẩn bị Cà phê\nCách bảo quản cà phê tốt nhất là gì? \nKhi được rang, cà phê bắt đầu mất mùi khi tiếp xúc với không khí và độ ẩm lâu hơn. Chúng tôi khuyên bạn nên mua cà phê hàng tuần, bảo quản trong thùng chứa kín ở nơi mát mẻ, ít ánh sáng và chỉ xay cà phê trước khi pha. \n\nCà phê sẽ tươi trong bao lâu?\nCà phê đựng trong túi FlavorLock™ chưa mở sẽ tươi trong vài tháng.', 'Khi mua cà phê theo cách này, chúng tôi giúp nuôi dưỡng một tương lai tốt đẹp hơn cho người nông dân và một nền khí hậu ổn định hơn cho trái đất, đồng thời cũng tìm được một nguồn cung ứng lâu dài với các loại hạt cà phê có chất lượng cao mà chúng tôi đã cẩn thận pha trộn, rang và đóng gói tươi ngon trong hơn bốn mươi năm qua.', 'Tôi nên sử dụng loại cà phê xay nào?\nĐể có được loại cà phê có hương vị thơm ngon nhất, chúng tôi tiếp tục khuyên bạn nên bắt đầu với cà phê nguyên hạt và xay mới cho từng ấm. Hoặc nếu thích, bạn có thể đem cà phê nguyên hạt tới cửa hàng bán lẻ tại địa phương và nhờ họ xay cho bạn.']","Khi được rang, cà phê bắt đầu mất mùi khi tiếp xúc với không khí và độ ẩm lâu hơn. Chúng tôi khuyên bạn nên mua cà phê hàng tuần, bảo quản trong thùng chứa kín ở nơi mát mẻ, ít ánh sáng và chỉ xay cà phê trước khi pha. "
Cà phê sẽ tươi trong bao lâu?,Cà phê đựng trong túi FlavorLock™ chưa mở sẽ tươi trong vài tháng.,"['Câu hỏi thường gặp về Chuẩn bị Cà phê\nCách bảo quản cà phê tốt nhất là gì? \nKhi được rang, cà phê bắt đầu mất mùi khi tiếp xúc với không khí và độ ẩm lâu hơn. Chúng tôi khuyên bạn nên mua cà phê hàng tuần, bảo quản trong thùng chứa kín ở nơi mát mẻ, ít ánh sáng và chỉ xay cà phê trước khi pha. \n\nCà phê sẽ tươi trong bao lâu?\nCà phê đựng trong túi FlavorLock™ chưa mở sẽ tươi trong vài tháng.', 'Khi mua cà phê theo cách này, chúng tôi giúp nuôi dưỡng một tương lai tốt đẹp hơn cho người nông dân và một nền khí hậu ổn định hơn cho trái đất, đồng thời cũng tìm được một nguồn cung ứng lâu dài với các loại hạt cà phê có chất lượng cao mà chúng tôi đã cẩn thận pha trộn, rang và đóng gói tươi ngon trong hơn bốn mươi năm qua.', 'Thách thức của nhân viên pha chế là trộn sữa nóng với cà phê espresso dưới 10 giây. Sau đó, lớp bọt dày ở trên mặt cà phê mới được rót bắt đầu tan ra và hương vị thay đổi. Vì vậy, nhân viên pha chế phải định lượng thời gian chuẩn để tạo ra cốc cà phê hoàn hảo cho bạn.\n\nNhân viên Pha chế Cà phê']",Cà phê đựng trong túi FlavorLock™ chưa mở sẽ tươi trong vài tháng.
Thẻ Starbucks là gì?,Thẻ Starbucks là một thẻ nhựa vật lý mang thương hiệu Starbucks hoặc một thẻ ảo mang thương hiệu Starbucks (hoặc “Thẻ Điện Tử”) là loại thẻ quà tặng có thể tái sử dụng nhiều lần khi khách hàng nạp tiền vào thẻ và chỉ sử dụng để mua hàng tại các cửa hàng Starbucks.,"['Thẻ Starbucks là một thẻ nhựa vật lý mang thương hiệu Starbucks hoặc một thẻ ảo mang thương hiệu Starbucks (hoặc “Thẻ Điện Tử”) là loại thẻ quà tặng có thể tái sử dụng nhiều lần khi khách hàng nạp tiền vào thẻ và chỉ sử dụng để mua hàng tại các cửa hàng Starbucks. Thẻ Starbucks sẽ được nhận dạng bằng số thẻ, mã bảo mật (CSC) và mã vạch của nó. Thẻ Starbucks có giá trị sử dụng tại Việt Nam (tại tất cả cửa hàng Starbucks tại Việt Nam), và phải được kích hoạt với giá trị tối thiểu là 100.000 Đồng Việt Nam', 'Câu hỏi thường gặp chương trình Starbucks Rewards™\nPhần 1: Các câu hỏi về Thẻ Starbucks\nThẻ Starbucks là gì?\nThẻ Starbucks là một thẻ vật lý mang thương hiệu Starbucks có thể tái sử dụng nhiều lần bằng cách khách hàng có thể nạp tiền vào thẻ để sử dụng mua hàng tại các cửa hàng Starbucks.\nTôi có thể nhận Thẻ Starbucks ở đâu?\nThẻ Starbucks có sẵn tại tất cả cửa hàng Starbucks trên khắp Việt Nam.\nLàm thế nào để tôi kích hoạt Thẻ Starbucks?', 'Thẻ Starbucks chưa đăng ký có thời hạn sử dụng trong vòng ba (03) năm kể từ thời điểm giao dịch tài chính cuối cùng được thực hiện bằng cách sử dụng Thẻ Starbucks đó. Trong khi đó, Thẻ Starbucks đã đăng ký sẽ hết hạn vào ngày cuối cùng của thời hạn ba (03) năm kể từ thời điểm giao dịch tài chính cuối cùng được thực hiện bằng cách sử dụng Thẻ Starbucks đó hoặc vào ngày chấm dứt Chương trình Starbucks Rewards™ như đã thông báo cho cơ quan có thẩm quyền và công bố tại các cửa hàng Starbucks ở Việt Nam, tùy']",Thẻ Starbucks là một thẻ vật lý mang thương hiệu Starbucks có thể tái sử dụng nhiều lần bằng cách khách hàng có thể nạp tiền vào thẻ để sử dụng mua hàng tại các cửa hàng Starbucks.
Tôi có thể nhận Thẻ Starbucks ở đâu?,Thẻ Starbucks có sẵn tại tất cả cửa hàng Starbucks trên khắp Việt Nam.,"['Câu hỏi thường gặp chương trình Starbucks Rewards™\nPhần 1: Các câu hỏi về Thẻ Starbucks\nThẻ Starbucks là gì?\nThẻ Starbucks là một thẻ vật lý mang thương hiệu Starbucks có thể tái sử dụng nhiều lần bằng cách khách hàng có thể nạp tiền vào thẻ để sử dụng mua hàng tại các cửa hàng Starbucks.\nTôi có thể nhận Thẻ Starbucks ở đâu?\nThẻ Starbucks có sẵn tại tất cả cửa hàng Starbucks trên khắp Việt Nam.\nLàm thế nào để tôi kích hoạt Thẻ Starbucks?', 'Sóc Khách Hàng Starbucks Rewards™ tại (028) 7306 7676, và xác nhận chỉ dẫn của bạn, hoặc yêu cầu cấp lại Thẻ thay thế nếu bạn chỉ có một Thẻ Starbucks đã đăng ký.', 'Phần 2: Các câu hỏi về Chương trình Starbucks Rewards™\nLàm thế nào tôi có thể tham gia Chương trình Starbucks Rewards™ bằng Thẻ Starbucks của tôi?']",Thẻ Starbucks có sẵn tại tất cả cửa hàng Starbucks trên khắp Việt Nam.
Làm thế nào để tôi kích hoạt Thẻ Starbucks?,Thẻ Starbucks phải được kích hoạt với giá trị tối thiểu là 100.000 VNĐ ở lần sử dụng đầu tiên tại bất kỳ thời điểm nào.,"['Câu hỏi thường gặp chương trình Starbucks Rewards™\nPhần 1: Các câu hỏi về Thẻ Starbucks\nThẻ Starbucks là gì?\nThẻ Starbucks là một thẻ vật lý mang thương hiệu Starbucks có thể tái sử dụng nhiều lần bằng cách khách hàng có thể nạp tiền vào thẻ để sử dụng mua hàng tại các cửa hàng Starbucks.\nTôi có thể nhận Thẻ Starbucks ở đâu?\nThẻ Starbucks có sẵn tại tất cả cửa hàng Starbucks trên khắp Việt Nam.\nLàm thế nào để tôi kích hoạt Thẻ Starbucks?', 'Thẻ Starbucks có sẵn tại tất cả cửa hàng Starbucks trên khắp Việt Nam.\nLàm thế nào để tôi kích hoạt Thẻ Starbucks?\nThẻ Starbucks phải được kích hoạt với giá trị tối thiểu là 100.000 VNĐ ở lần sử dụng đầu tiên tại bất kỳ thời điểm nào.\nTôi có thể sử dụng Thẻ Starbucks của mình ở đâu?\nThẻ Starbucks được chấp nhận tại tất cả cửa hàng Starbucks trên khắp Việt Nam.\nTôi có thể sử dụng Thẻ Starbucks của mình khi tôi đi du lịch ở nước ngoài được không?', 'Bạn có thể tham gia vào Chương trình Starbucks Rewards™ và bắt đầu tích lũy Điểm Ngôi Sao bằng cách truy cập  vào https://card.starbucks.vn hoặc cài đặt ứng dụng di động và làm theo hướng dẫn để tạo một tài khoản Starbucks Rewards™ và đăng ký vào tài khoản đó tối thiểu một (1) Thẻ Starbucks đã kích hoạt . Khi đăng ký một tài khoản, bạn sẽ nhận được một email xác minh gửi đến địa chỉ email được sử dụng để đăng ký và kích hoạt tài khoản của bạn (Vui lòng liên hệ với chúng tôi nếu bạn không nhận được email']",Thẻ Starbucks phải được kích hoạt với giá trị tối thiểu là 100.000 VNĐ ở lần sử dụng đầu tiên tại bất kỳ thời điểm nào.
Tôi có thể sử dụng Thẻ Starbucks của mình ở đâu?,Thẻ Starbucks được chấp nhận tại tất cả cửa hàng Starbucks trên khắp Việt Nam.,"['Thẻ Starbucks có sẵn tại tất cả cửa hàng Starbucks trên khắp Việt Nam.\nLàm thế nào để tôi kích hoạt Thẻ Starbucks?\nThẻ Starbucks phải được kích hoạt với giá trị tối thiểu là 100.000 VNĐ ở lần sử dụng đầu tiên tại bất kỳ thời điểm nào.\nTôi có thể sử dụng Thẻ Starbucks của mình ở đâu?\nThẻ Starbucks được chấp nhận tại tất cả cửa hàng Starbucks trên khắp Việt Nam.\nTôi có thể sử dụng Thẻ Starbucks của mình khi tôi đi du lịch ở nước ngoài được không?', 'Tôi có thể sử dụng Thẻ Starbucks của mình khi tôi đi du lịch ở nước ngoài được không?\nThẻ Starbucks được kích hoạt tại Việt Nam chỉ được sử dụng để tích lũy Điểm Ngôi Sao hoặc nhận các ưu đãi tại các cửa hàng Starbucks Việt Nam.\nLàm thế nào để tôi đăng ký Thẻ Starbucks?', 'Bạn phải kích hoạt/nạp tiền vào Thẻ Starbucks bằng tiền mặt tại cửa hàng Starbucks hoặc sử dụng chức năng thanh toán trực tuyến (thông qua thẻ tín dụng/thẻ ghi nợ/thẻ ATM nội địa) do nhà cung cấp dịch vụ thanh toán của chúng tôi cung cấp, nhưng bạn không thể sử dụng Thẻ Starbucks để kích hoạt/nạp tiền cho một Thẻ Starbucks khác.']",Thẻ Starbucks được chấp nhận tại tất cả cửa hàng Starbucks trên khắp Việt Nam.
Tôi có thể sử dụng Thẻ Starbucks của mình khi tôi đi du lịch ở nước ngoài được không?,Thẻ Starbucks được kích hoạt tại Việt Nam chỉ được sử dụng để tích lũy Điểm Ngôi Sao hoặc nhận các ưu đãi tại các cửa hàng Starbucks Việt Nam.,"['Thẻ Starbucks có sẵn tại tất cả cửa hàng Starbucks trên khắp Việt Nam.\nLàm thế nào để tôi kích hoạt Thẻ Starbucks?\nThẻ Starbucks phải được kích hoạt với giá trị tối thiểu là 100.000 VNĐ ở lần sử dụng đầu tiên tại bất kỳ thời điểm nào.\nTôi có thể sử dụng Thẻ Starbucks của mình ở đâu?\nThẻ Starbucks được chấp nhận tại tất cả cửa hàng Starbucks trên khắp Việt Nam.\nTôi có thể sử dụng Thẻ Starbucks của mình khi tôi đi du lịch ở nước ngoài được không?', 'Tôi có thể sử dụng Thẻ Starbucks của mình khi tôi đi du lịch ở nước ngoài được không?\nThẻ Starbucks được kích hoạt tại Việt Nam chỉ được sử dụng để tích lũy Điểm Ngôi Sao hoặc nhận các ưu đãi tại các cửa hàng Starbucks Việt Nam.\nLàm thế nào để tôi đăng ký Thẻ Starbucks?', 'Nếu tôi nạp tiền vào Thẻ của tôi bên ngoài Việt Nam, tôi có thể sử dụng tiền để mua và nhận các ưu đã tại Việt Nam không?\nBạn chỉ có thể sử dụng Thẻ Starbucks để mua hàng cũng như nạp tiền vào Thẻ tại bất kỳ cửa hàng Starbucks ở Việt Nam. Do đó, vui lòng lưu ý rằng bạn sẽ tích lũy Điểm Ngôi Sao hoặc nhận các ưu đãi của mình chỉ tại các cửa hàng Starbucks ở Việt Nam.\nPhần 2: Các câu hỏi về Chương trình Starbucks Rewards™']",Thẻ Starbucks được kích hoạt tại Việt Nam chỉ được sử dụng để tích lũy Điểm Ngôi Sao hoặc nhận các ưu đãi tại các cửa hàng Starbucks Việt Nam.
Làm thế nào để tôi đăng ký Thẻ Starbucks?,"Bạn có thể đăng ký Thẻ Starbucks một cách dễ dàng thông qua ứng dụng di động hoặc tại website https://card.starbucks.vn. Ngoài các thông tin cá nhân cần thiết, bạn vui lòng điền số thẻ gồm 16 chữ số ở mặt trước và Mã Bảo Mật (CSC) là một số gồm 8 chữ số nằm dưới lớp tráng bạc ở mặt sau của thẻ để hoàn tất việc đăng ký Thẻ Starbucks của mình.","['Làm thế nào để tôi đăng ký Thẻ Starbucks?\nBạn có thể đăng ký Thẻ Starbucks một cách dễ dàng và chỉ mất một vài phút thông qua ứng dụng di động hoặc tại website https://card.starbucks.vn. Ngoài các thông tin cá nhân cần thiết, bạn vui lòng điền số thẻ gồm 16 chữ số ở mặt trước và Mã Bảo Mật (CSC) là một số gồm 8 chữ số nằm dưới lớp tráng bạc ở mặt sau của thẻ để hoàn tất việc đăng ký Thẻ Starbucks của mình.', 'Việc đăng ký Thẻ Starbucks là cách duy nhất để bạn có thể tham gia chương trình Starbucks Rewards™. Bằng việc đăng ký tham gia chương trình, bạn sẽ nhận được thông tin về những chào bán và ưu đãi dành riêng cho thành viên của chương trình Starbucks Rewards™. Ngoài ra, Thẻ đã đăng ký của bạn sẽ được bảo vệ số dư Điểm Ngôi Sao trong trường hợp Thẻ bị mất, bị đánh cắp hoặc bị phá hủy. Cuối cùng, bạn có thể quản lý tài khoản và (các) Thẻ đã đăng ký của bạn theo nhiều cách, bao gồm cả việc thanh toán thông qua', 'Khi bạn đăng ký Thẻ Starbucks của mình tại https://card.starbucks.vn hoặc thông qua ứng dụng di động đồng nghĩa với việc bạn chính thức tham gia Chương trình Starbucks Rewards™. Đối với Thẻ đã đăng ký, bạn có thể quản lý Thẻ và số dư của mình trực tuyến tại website hay ứng dụng điện thoại, ngoài ra, bạn có thể tích lũy Điểm Ngôi Sao và nhận các ưu đãi, chẳng hạn như đồ uống miễn phí, đối với tất cả chi tiêu tại cửa hàng. Bạn cũng có thể bảo vệ số dư của Thẻ Starbucks đã đăng ký trong trường hợp thẻ bị mất,']","Bạn có thể đăng ký Thẻ Starbucks một cách dễ dàng và chỉ mất một vài phút thông qua ứng dụng di động hoặc tại website https://card.starbucks.vn. Ngoài các thông tin cá nhân cần thiết, bạn vui lòng điền số thẻ gồm 16 chữ số ở mặt trước và Mã Bảo Mật (CSC) là một số gồm 8 chữ số nằm dưới lớp tráng bạc ở mặt sau của thẻ để hoàn tất việc đăng ký Thẻ Starbucks của mình."
Tại sao tôi cần phải đăng ký Thẻ Starbucks tại https://card.starbucks.vn hoặc thông qua ứng dụng di động?,"Để tham gia Chương trình Starbucks Rewards™ và quản lý Thẻ, tích lũy Điểm Ngôi Sao, và bảo vệ số dư trong trường hợp mất thẻ.","['Làm thế nào để tôi đăng ký Thẻ Starbucks?\nBạn có thể đăng ký Thẻ Starbucks một cách dễ dàng và chỉ mất một vài phút thông qua ứng dụng di động hoặc tại website https://card.starbucks.vn. Ngoài các thông tin cá nhân cần thiết, bạn vui lòng điền số thẻ gồm 16 chữ số ở mặt trước và Mã Bảo Mật (CSC) là một số gồm 8 chữ số nằm dưới lớp tráng bạc ở mặt sau của thẻ để hoàn tất việc đăng ký Thẻ Starbucks của mình.', 'Tại sao tôi cần phải đăng ký Thẻ Starbucks tại https://card.starbucks.vn hoặc thông qua ứng dụng di động?', 'Khi bạn đăng ký Thẻ Starbucks của mình tại https://card.starbucks.vn hoặc thông qua ứng dụng di động đồng nghĩa với việc bạn chính thức tham gia Chương trình Starbucks Rewards™. Đối với Thẻ đã đăng ký, bạn có thể quản lý Thẻ và số dư của mình trực tuyến tại website hay ứng dụng điện thoại, ngoài ra, bạn có thể tích lũy Điểm Ngôi Sao và nhận các ưu đãi, chẳng hạn như đồ uống miễn phí, đối với tất cả chi tiêu tại cửa hàng. Bạn cũng có thể bảo vệ số dư của Thẻ Starbucks đã đăng ký trong trường hợp thẻ bị mất,']","Khi bạn đăng ký Thẻ Starbucks của mình tại https://card.starbucks.vn hoặc thông qua ứng dụng di động đồng nghĩa với việc bạn chính thức tham gia Chương trình Starbucks Rewards™. Đối với Thẻ đã đăng ký, bạn có thể quản lý Thẻ và số dư của mình trực tuyến tại website hay ứng dụng điện thoại, ngoài ra, bạn có thể tích lũy Điểm Ngôi Sao và nhận các ưu đãi, chẳng hạn như đồ uống miễn phí, đối với tất cả chi tiêu tại cửa hàng. Bạn cũng có thể bảo vệ số dư của Thẻ Starbucks đã đăng ký trong trường hợp thẻ bị mất, bị đánh cắp hoặc bị phá hủy."
Tôi có thể nạp tiền vào Thẻ Starbucks của mình không?,"Có, bạn có thể nạp tiền vào Thẻ Starbucks tại các cửa hàng Starbucks ở Việt Nam bằng tiền mặt hoặc thẻ tín dụng/thẻ ghi nợ.","['Bạn phải kích hoạt/nạp tiền vào Thẻ Starbucks bằng tiền mặt tại cửa hàng Starbucks hoặc sử dụng chức năng thanh toán trực tuyến (thông qua thẻ tín dụng/thẻ ghi nợ/thẻ ATM nội địa) do nhà cung cấp dịch vụ thanh toán của chúng tôi cung cấp, nhưng bạn không thể sử dụng Thẻ Starbucks để kích hoạt/nạp tiền cho một Thẻ Starbucks khác.', 'Tôi có thể nạp tiền vào Thẻ Starbucks của mình không?\nBạn có thể nạp tiền vào Thẻ Starbucks tại các cửa hàng Starbucks ở Việt Nam bằng tiền mặt hoặc thẻ tín dụng/thẻ ghi nợ.\nLàm thế nào để thông báo khi Thẻ Starbucks bị mất hoặc bị đánh cắp?', 'Tôi có thể được hoàn tiền từ Thẻ Starbucks của tôi không?\nKhi tiền được nạp vào tài khoản, bạn không thể yêu cầu việc hoàn lại tiền.\nThẻ Starbucks có hạn sử dụng hay không?']",Bạn có thể nạp tiền vào Thẻ Starbucks tại các cửa hàng Starbucks ở Việt Nam bằng tiền mặt hoặc thẻ tín dụng/thẻ ghi nợ.
Làm thế nào để thông báo khi Thẻ Starbucks bị mất hoặc bị đánh cắp?,"Thông báo bằng cách truy cập trang web https://card.starbucks.vn, sử dụng ứng dụng di động, hoặc gọi tới Trung Tâm Chăm Sóc Khách Hàng Starbucks Rewards™ tại (028) 7306 7676 và xác nhận chỉ dẫn của bạn.","['Trong trường hợp Thẻ Starbucks của bạn bị mất, bị đánh cắp hoặc bị phá hủy, bạn có thể sẽ mất số dư tiền trong Thẻ Starbuck của bạn. Tuy nhiên, bạn có thể bảo toàn số dư và Điểm Ngôi Sao trên tài khoản Starbucks Rewards™ của bạn, nếu bạn thông báo về việc Thẻ bị mất, bị đánh cắp, phá hủy thông qua website https://card.starbucks.vn hoặc ứng dụng di động hoặc gọi tới Trung Tâm Chăm Sóc Khách Hàng Starbucks Rewards™ tại (028) 7306 7676, và xác nhận chỉ dẫn của bạn, hoặc yêu cầu cấp lại Thẻ thay thế nếu bạn', 'Nếu Thẻ Starbucks của bạn bị mất, bị đánh cắp hoặc bị phá hủy, bạn có thể sẽ mất số dư tiền trong Thẻ Starbucks của bạn. Tuy nhiên, trong trường hợp là thành viên của Chương Trình Starbucks Rewards™, bạn có thể bảo toàn số dư Điểm Ngôi Sao trên tài khoản Starbucks Rewards™ của bạn, nếu bạn thông báo về việc Thẻ bị mất, bị đánh cắp, phá hủy thông qua website https://card.starbucks.vn hoặc Ứng Dụng Di Động hoặc gọi tới Trung Tâm Chăm Sóc Khách Hàng Starbucks Rewards™ tại (028) 7306 7676, và xác nhận chỉ dẫn', 'thông qua ứng dụng di động và thông báo về Thẻ Starbucks bị mất, bị đánh cắp hoặc bị phá hủy. Giờ làm việc của chúng tôi là từ 08:30 sáng – 5:00 chiều từ Thứ Hai đến Thứ Sáu, 8:30 sáng – 12:00 trưa Thứ bảy, trừ các ngày Chủ nhật và các ngày Lễ Tết.']","Nếu Thẻ Starbucks của bạn bị mất, bị đánh cắp hoặc bị phá hủy, bạn có thể sẽ mất số dư của như điểm ngôi sao trong Thẻ Starbucks. Tuy nhiên đối với thẻ đã được đăng ký, số dư cùng điểm ngôi sao sẽ được bảo toàn. Bạn vui lòng gọi đến Trung Tâm Chăm Sóc Khách Hàng tại Việt Nam theo số điện thoại (028) 7306 7676 hoặc truy cập vào trang web của chúng tôi https://card.starbucks.vn hoặc thông qua ứng dụng di động và thông báo về Thẻ Starbucks bị mất, bị đánh cắp hoặc bị phá hủy. Giờ làm việc của chúng tôi là từ 08:30 sáng – 5:00 chiều từ Thứ Hai đến Thứ Sáu, 8:30 sáng – 12:00 trưa Thứ bảy, trừ các ngày Chủ nhật và các ngày Lễ Tết."
Có giới hạn trong việc nạp tiền vào Thẻ hay không?,"Có giới hạn trong việc nạp tiền vào Thẻ Starbucks, bạn có thể nạp từ 50.000 đồng đến 5.000.000 đồng, với giá trị nạp tối đa là 5.000.000 đồng.","['Có giới hạn trong việc nạp tiền vào Thẻ hay không?\nBạn có thể sử dụng Việt Nam Đồng để nạp vào Thẻ Starbucks với giá trị nạp từ 50.000 đồng đến 5.000.000 đồng, trong đó 5.000.000 đồng là số dư tối đa trong một thẻ tại mọi thời điểm.\nLàm thế nào để tôi có thể kiểm tra số dư trong Thẻ Starbucks của tôi?', 'Di Động nếu bạn đã đăng ký tham gia chương trình Starbucks Reward™. Khi số dư còn lại không đủ để mua hàng, bạn có thể nạp thêm tiền vào Thẻ Starbucks để tiếp tục thực hiện việc mua hàng. Đối với việc nạp tiền, bạn có thể sử dụng VNĐ nạp vào Thẻ Starbucks với giá trị nạp từ 50.000 VNĐ đến 5.000.000 VNĐ, trong đó 5.000.000 VNĐ là số tiền tối đa có trong một thẻ tại mọi thời điểm. Bạn phải kích hoạt/nạp tiền vào Thẻ Starbucks bằng tiền mặt tại cửa hàng Starbucks hoặc sử dụng chức năng thanh toán trực tuyến', 'Tôi có thể được hoàn tiền từ Thẻ Starbucks của tôi không?\nKhi tiền được nạp vào tài khoản, bạn không thể yêu cầu việc hoàn lại tiền.\nThẻ Starbucks có hạn sử dụng hay không?']","Bạn có thể sử dụng Việt Nam Đồng để nạp vào Thẻ Starbucks với giá trị nạp từ 50.000 đồng đến 5.000.000 đồng, trong đó 5.000.000 đồng là số dư tối đa trong một thẻ tại mọi thời điểm."
Làm thế nào để tôi có thể kiểm tra số dư trong Thẻ Starbucks của tôi?,"Bạn có thể kiểm tra số dư trong Thẻ Starbucks của bạn tại https://card.starbucks.vn hoặc trên ứng dụng di động, nếu có, hoặc đề nghị nhân viên pha chế tại bất kỳ cửa hàng Starbucks nào để họ kiểm tra giúp bạn.","['Làm thế nào để tôi kiểm tra số dư trong Thẻ Starbucks?\nBạn có thể đăng nhập vào tài khoản của mình và kiểm tra số dư thông qua website https://card.starbucks.vn. Ngoài ra, bạn cũng sẽ có thể tải ứng dụng di động của chúng tôi, và qua đó bạn có thể kiểm tra số dư trong Thẻ Starbcuks của mình hoặc đến tất cả cửa hàng Starbucks tại Việt Nam và yêu cầu nhân viên pha chế để họ kiểm tra giúp bạn.\nTôi có thể kiểm tra lịch sử giao dịch dù đã nhận được hóa đơn mua hàng tại cửa hàng hay không?', 'kiểm tra số dư trong Thẻ Starbucks eGift của bạn bằng cách đề nghị nhân viên pha chế tại bất kỳ cửa hàng Starbucks nào để họ kiểm tra giúp bạn, và tại https://card.starbucks.vn hoặc thông qua Ứng Dụng Di Động nếu bạn đã đăng ký tham gia Chương Trình Starbucks Rewards™.', 'Làm thế nào để tôi có thể kiểm tra số dư trong Thẻ Starbucks của tôi?\nBạn có thể kiểm tra số dư trong Thẻ Starbucks của bạn tại https://card.starbucks.vn hoặc trên ứng dụng di động, nếu có, hoặc đề nghị nhân viên pha chế tại bất kỳ cửa hàng Starbucks nào để họ kiểm tra giúp bạn.\nLàm thế nào để sử dụng Thẻ Starbucks cho việc thanh toán?\nBạn vui lòng xuất trình Thẻ Starbucks của bạn hoặc mã vạch trên ứng dụng di động cho nhân viên pha chế khi thực hiện việc thanh toán.']","Bạn có thể kiểm tra số dư trong Thẻ Starbucks của bạn tại https://card.starbucks.vn hoặc trên ứng dụng di động, nếu có, hoặc đề nghị nhân viên pha chế tại bất kỳ cửa hàng Starbucks nào để họ kiểm tra giúp bạn."
Làm thế nào để sử dụng Thẻ Starbucks cho việc thanh toán?,"Bạn có thể sử dụng Thẻ Starbucks cho việc thanh toán bằng cách nạp tiền vào nó thông qua cửa hàng, chức năng thanh toán trực tuyến hoặc chức năng thanh toán di động của đối tác chúng tôi cung cấp. Sau khi nạp tiền, bạn có thể sử dụng thẻ để mua sắm tại các cửa hàng Starbucks hoặc truy cập các ưu đãi thưởng khác.","['của bạn qua tính năng SBD có thể được hoàn thành bằng Thẻ Starbucks đã đăng ký thông qua Ứng Dụng Di Động, thẻ tín dụng/thẻ ghi nợ, hoặc ví điện tử do đối tác chúng tôi cung cấp. Nếu bạn thanh toán bằng Thẻ Starbucks, số tiền trả trước của bạn trên Thẻ Starbucks đã đăng ký đó sẽ được hệ thống của chúng tôi khấu trừ cho giao dịch mua hàng theo đơn đặt hàng đã tiến hành thanh toán của bạn. Starbucks cũng có các tiêu chuẩn bảo mật riêng cho các giao dịch khấu trừ này để đảm bảo thông tin bảo mật và an toàn.', 'Bạn phải kích hoạt/nạp tiền vào Thẻ Starbucks bằng tiền mặt tại cửa hàng Starbucks hoặc sử dụng chức năng thanh toán trực tuyến (thông qua thẻ tín dụng/thẻ ghi nợ/thẻ ATM nội địa) do nhà cung cấp dịch vụ thanh toán của chúng tôi cung cấp, nhưng bạn không thể sử dụng Thẻ Starbucks để kích hoạt/nạp tiền cho một Thẻ Starbucks khác.', 'Tôi có thể được hoàn tiền từ Thẻ Starbucks của tôi không?\nKhi tiền được nạp vào tài khoản, bạn không thể yêu cầu việc hoàn lại tiền.\nThẻ Starbucks có hạn sử dụng hay không?']",Bạn vui lòng xuất trình Thẻ Starbucks của bạn hoặc mã vạch trên ứng dụng di động cho nhân viên pha chế khi thực hiện việc thanh toán.
Tôi có thể được hoàn tiền từ Thẻ Starbucks của tôi không?,"Không, bất kỳ số tiền hoặc giá trị nào có trong Thẻ Starbucks của bạn không thể được hoàn trả.","['của bạn qua tính năng SBD có thể được hoàn thành bằng Thẻ Starbucks đã đăng ký thông qua Ứng Dụng Di Động, thẻ tín dụng/thẻ ghi nợ, hoặc ví điện tử do đối tác chúng tôi cung cấp. Nếu bạn thanh toán bằng Thẻ Starbucks, số tiền trả trước của bạn trên Thẻ Starbucks đã đăng ký đó sẽ được hệ thống của chúng tôi khấu trừ cho giao dịch mua hàng theo đơn đặt hàng đã tiến hành thanh toán của bạn. Starbucks cũng có các tiêu chuẩn bảo mật riêng cho các giao dịch khấu trừ này để đảm bảo thông tin bảo mật và an toàn.', 'Việc thanh toán cho đơn đặt hàng của bạn qua tính năng O&PU có thể được hoàn thành bằng Thẻ Starbucks đã đăng ký thông qua Ứng Dụng Di Động, thẻ tín dụng/thẻ ghi nợ, hoặc ví điện tử do đối tác của chúng tôi cung cấp. Nếu bạn thanh toán bằng Thẻ Starbucks, số tiền trả trước của bạn trên Thẻ Starbucks đã đăng ký đó sẽ được hệ thống của chúng tôi khấu trừ cho giao dịch đặt hàng này. Starbucks cũng có các tiêu chuẩn bảo mật riêng cho các giao dịch khấu trừ này để đảm bảo thông tin bảo mật và an toàn. Trong', 'Tôi có thể hoàn tiền từ Thẻ hay không?\nBất kỳ số tiền / giá trị nào có trong Thẻ của bạn không thể được hoàn trả.\nĐiểm Ngôi Sao tích lũy trong tài khoản của tôi có thể chuyển nhượng cho người khác được không?\nRất tiếc, Điểm Ngôi Sao tích lũy trong mỗi tài khoản chỉ được sử dụng bởi chính chủ tài khoản mà không thể chuyển nhượng cho bất kỳ tài khoản nào khác.\nTôi có thể chuyển nhượng tư cách thành viên chương trình Starbucks Rewards™ cho người khác được không?']","Khi tiền được nạp vào tài khoản, bạn không thể yêu cầu việc hoàn lại tiền."
Thẻ Starbucks có hạn sử dụng hay không?,"Thẻ Starbucks chưa đăng ký có thời hạn sử dụng trong vòng ba (03) năm kể từ thời điểm giao dịch tài chính cuối cùng được thực hiện bằng cách sử dụng Thẻ Starbucks đó. Trong khi đó, Thẻ Starbucks đã đăng ký sẽ hết hạn vào ngày cuối cùng của thời hạn ba (03) năm kể từ thời điểm giao dịch tài chính cuối cùng được thực hiện bằng cách sử dụng Thẻ Starbucks đó hoặc vào ngày chấm dứt Chương trình Starbucks Rewards™ như đã thông báo cho cơ quan có thẩm quyền và công bố tại các cửa hàng Starbucks ở Việt Nam, tùy theo sự lựa chọn của Starbucks.","['Thẻ Starbucks chưa đăng ký có thời hạn sử dụng trong vòng ba (03) năm kể từ thời điểm giao dịch tài chính cuối cùng được thực hiện bằng cách sử dụng Thẻ Starbucks đó. Trong khi đó, Thẻ Starbucks đã đăng ký sẽ hết hạn vào ngày cuối cùng của thời hạn ba (03) năm kể từ thời điểm giao dịch tài chính cuối cùng được thực hiện bằng cách sử dụng Thẻ Starbucks đó hoặc vào ngày chấm dứt Chương trình Starbucks Rewards™ như đã thông báo cho cơ quan có thẩm quyền và công bố tại các cửa hàng Starbucks ở Việt Nam, tùy', 'Thẻ Starbucks chưa đăng ký có thời hạn sử dụng trong vòng ba (03) năm kể từ thời điểm giao dịch tài chính cuối cùng được thực hiện bằng cách sử dụng Thẻ Starbucks đó. Trong khi đó, Thẻ Starbucks đã đăng ký sẽ hết hạn vào ngày cuối cùng của thời hạn ba (03) năm kể từ thời điểm giao dịch tài chính cuối cùng được thực hiện bằng cách sử dụng Thẻ Starbucks đó hoặc vào ngày chấm dứt Chương trình Starbucks Rewards™ như đã thông báo cho cơ quan có thẩm quyền và công bố tại các cửa hàng Starbucks ở Việt Nam, tùy', 'Câu hỏi thường gặp chương trình Starbucks Rewards™\nPhần 1: Các câu hỏi về Thẻ Starbucks\nThẻ Starbucks là gì?\nThẻ Starbucks là một thẻ vật lý mang thương hiệu Starbucks có thể tái sử dụng nhiều lần bằng cách khách hàng có thể nạp tiền vào thẻ để sử dụng mua hàng tại các cửa hàng Starbucks.\nTôi có thể nhận Thẻ Starbucks ở đâu?\nThẻ Starbucks có sẵn tại tất cả cửa hàng Starbucks trên khắp Việt Nam.\nLàm thế nào để tôi kích hoạt Thẻ Starbucks?']","Thẻ Starbucks chưa đăng ký có thời hạn sử dụng trong vòng ba (03) năm kể từ thời điểm giao dịch tài chính cuối cùng được thực hiện bằng cách sử dụng Thẻ Starbucks đó. Trong khi đó, Thẻ Starbucks đã đăng ký sẽ hết hạn vào ngày cuối cùng của thời hạn ba (03) năm kể từ thời điểm giao dịch tài chính cuối cùng được thực hiện bằng cách sử dụng Thẻ Starbucks đó hoặc vào ngày chấm dứt Chương trình Starbucks Rewards™ như đã thông báo cho cơ quan có thẩm quyền và công bố tại các cửa hàng Starbucks ở Việt Nam, tùy thuộc vào thời điểm nào sớm hơn. Trong phạm vi các Điều khoản Sử dụng này, ""Giao dịch tài chính"" được hiểu là một trong các hành động sau đây: Kích hoạt thẻ, Nạp tiền vào thẻ, Sử dụng Ưu Đãi đối với Thẻ Starbucks đã đăng ký, Giao dịch mua hàng, Chuyển tiền (như được định nghĩa dưới đây) giữa các Thẻ Starbucks đã đăng ký trong cùng một tài khoản."
"Nếu tôi nạp tiền vào Thẻ của tôi bên ngoài Việt Nam, tôi có thể sử dụng tiền để mua và nhận các ưu đã tại Việt Nam không?",Không.,"['Nếu tôi nạp tiền vào Thẻ của tôi bên ngoài Việt Nam, tôi có thể sử dụng tiền để mua và nhận các ưu đã tại Việt Nam không?\nBạn chỉ có thể sử dụng Thẻ Starbucks để mua hàng cũng như nạp tiền vào Thẻ tại bất kỳ cửa hàng Starbucks ở Việt Nam. Do đó, vui lòng lưu ý rằng bạn sẽ tích lũy Điểm Ngôi Sao hoặc nhận các ưu đãi của mình chỉ tại các cửa hàng Starbucks ở Việt Nam.\nPhần 2: Các câu hỏi về Chương trình Starbucks Rewards™', 'Thẻ Starbucks eGift sau khi quy đổi sẽ được sử dụng để mua hàng tại các cửa hàng Starbucks và được nạp thêm tiền vào Thẻ Starbucks eGift này. Thẻ Starbucks eGift chỉ có giá trị tại Việt Nam (tất cả cửa hàng Starbucks tại Việt Nam), và có thể được lưu trữ và sử dụng Việt Nam Đồng để nạp vào Thẻ Starbucks eGift với giá trị nạp từ 50.000 đồng đến 5.000.000 đồng, trong đó 5.000.000 đồng là số tiền tối đa có trong một thẻ tại mọi thời điểm.', 'Tôi có thể sử dụng Thẻ Starbucks của mình khi tôi đi du lịch ở nước ngoài được không?\nThẻ Starbucks được kích hoạt tại Việt Nam chỉ được sử dụng để tích lũy Điểm Ngôi Sao hoặc nhận các ưu đãi tại các cửa hàng Starbucks Việt Nam.\nLàm thế nào để tôi đăng ký Thẻ Starbucks?']","Bạn chỉ có thể sử dụng Thẻ Starbucks để mua hàng cũng như nạp tiền vào Thẻ tại bất kỳ cửa hàng Starbucks ở Việt Nam. Do đó, vui lòng lưu ý rằng bạn sẽ tích lũy Điểm Ngôi Sao hoặc nhận các ưu đãi của mình chỉ tại các cửa hàng Starbucks ở Việt Nam."
Làm thế nào tôi có thể tham gia Chương trình Starbucks Rewards™ bằng Thẻ Starbucks của tôi?,Bạn có thể tham gia Chương trình Starbucks Rewards™ bằng Thẻ Starbucks của bạn bằng cách truy cập vào https://card.starbucks.vn hoặc cài đặt ứng dụng di động và làm theo hướng dẫn để tạo một tài khoản Starbucks Rewards™ và đăng ký vào tài khoản đó tối thiểu một (1) Thẻ Starbucks đã kích hoạt.,"['Việc đăng ký Thẻ Starbucks là cách duy nhất để bạn có thể tham gia chương trình Starbucks Rewards™. Bằng việc đăng ký tham gia chương trình, bạn sẽ nhận được thông tin về những chào bán và ưu đãi dành riêng cho thành viên của chương trình Starbucks Rewards™. Ngoài ra, Thẻ đã đăng ký của bạn sẽ được bảo vệ số dư Điểm Ngôi Sao trong trường hợp Thẻ bị mất, bị đánh cắp hoặc bị phá hủy. Cuối cùng, bạn có thể quản lý tài khoản và (các) Thẻ đã đăng ký của bạn theo nhiều cách, bao gồm cả việc thanh toán thông qua', 'Bạn có thể tham gia vào Chương trình Starbucks Rewards™ và bắt đầu tích lũy Điểm Ngôi Sao bằng cách truy cập  vào https://card.starbucks.vn hoặc cài đặt ứng dụng di động và làm theo hướng dẫn để tạo một tài khoản Starbucks Rewards™ và đăng ký vào tài khoản đó tối thiểu một (1) Thẻ Starbucks đã kích hoạt . Khi đăng ký một tài khoản, bạn sẽ nhận được một email xác minh gửi đến địa chỉ email được sử dụng để đăng ký và kích hoạt tài khoản của bạn (Vui lòng liên hệ với chúng tôi nếu bạn không nhận được email', 'Phần 2: Các câu hỏi về Chương trình Starbucks Rewards™\nLàm thế nào tôi có thể tham gia Chương trình Starbucks Rewards™ bằng Thẻ Starbucks của tôi?']","Bạn có thể tham gia vào Chương trình Starbucks Rewards™ và bắt đầu tích lũy Điểm Ngôi Sao bằng cách truy cập  vào https://card.starbucks.vn hoặc cài đặt ứng dụng di động và làm theo hướng dẫn để tạo một tài khoản Starbucks Rewards™ và đăng ký vào tài khoản đó tối thiểu một (1) Thẻ Starbucks đã kích hoạt . Khi đăng ký một tài khoản, bạn sẽ nhận được một email xác minh gửi đến địa chỉ email được sử dụng để đăng ký và kích hoạt tài khoản của bạn (Vui lòng liên hệ với chúng tôi nếu bạn không nhận được email xác minh việc đăng ký trong vòng 24 giờ)."
Tôi có thể sở hữu bao nhiêu tài khoản Starbucks Rewards™ tại bất cứ thời điểm nào?,Bạn chỉ có thể có duy nhất một (1) tài khoản Starbucks Rewards™.,"['Tôi có thể sở hữu bao nhiêu tài khoản Starbucks Rewards™ tại bất cứ thời điểm nào?', 'Bạn chỉ có thể có duy nhất một (1) tài khoản Starbucks Rewards™. Nếu bạn có nhiều hơn một (1) tài khoản Starbucks Rewards™, Starbucks có toàn quyền quyết định rằng bạn đã vi phạm các Điều Khoản Sử Dụng này. Theo quyết định riêng của mình, Starbucks có thể tạm dừng, hủy bỏ hoặc kết hợp các tài khoản trùng lặp. Trong trường hợp việc tham gia Chương trình Starbucks Rewards™ của bạn bị chấm dứt, tất cả các ưu đãi và Điểm Ngôi Sao đã tích lũy trong tài khoản của bạn đều bị vô hiệu.', 'Tôi có thể đăng ký/thêm vào tài khoản Starbucks Rewards™ của mình bao nhiêu Thẻ Starbucks?\nBạn có thể đăng ký/thêm vào tối đa hai mươi (20) thẻ Starbucks đã kích hoạt vào tài khoản Starbucks Rewards™ của bạn.\nTôi có thể chuyển số dư giữa các Thẻ Starbucks đã đăng ký của mình không?']","Bạn chỉ có thể có duy nhất một (1) tài khoản Starbucks Rewards™. Nếu bạn có nhiều hơn một (1) tài khoản Starbucks Rewards™, Starbucks có toàn quyền quyết định rằng bạn đã vi phạm các Điều khoản Sử dụng này. Theo quyết định riêng của mình, Starbucks có thể tạm dừng, hủy bỏ hoặc kết hợp các tài khoản trùng lặp. Trong trường hợp việc tham gia Chương trình Starbucks Rewards™ của bạn bị chấm dứt, tất cả các ưu đãi và Điểm Ngôi Sao đã tích lũy trong tài khoản của bạn đều bị vô hiệu."
Tôi có thể đăng ký/thêm vào tài khoản Starbucks Rewards™ của mình bao nhiêu Thẻ Starbucks?,Bạn có thể đăng ký/thêm vào tối đa hai mươi (20) thẻ Starbucks đã kích hoạt vào tài khoản Starbucks Rewards™ của bạn.,"['Tôi có thể đăng ký/thêm vào tài khoản Starbucks Rewards™ của mình bao nhiêu Thẻ Starbucks?\nBạn có thể đăng ký/thêm vào tối đa hai mươi (20) thẻ Starbucks đã kích hoạt vào tài khoản Starbucks Rewards™ của bạn.\nTôi có thể chuyển số dư giữa các Thẻ Starbucks đã đăng ký của mình không?', 'Bạn có thể tham gia vào Chương trình Starbucks Rewards™ và bắt đầu tích lũy Điểm Ngôi Sao bằng cách truy cập  vào https://card.starbucks.vn hoặc cài đặt ứng dụng di động và làm theo hướng dẫn để tạo một tài khoản Starbucks Rewards™ và đăng ký vào tài khoản đó tối thiểu một (1) Thẻ Starbucks đã kích hoạt . Khi đăng ký một tài khoản, bạn sẽ nhận được một email xác minh gửi đến địa chỉ email được sử dụng để đăng ký và kích hoạt tài khoản của bạn (Vui lòng liên hệ với chúng tôi nếu bạn không nhận được email', 'Tôi có thể sở hữu bao nhiêu tài khoản Starbucks Rewards™ tại bất cứ thời điểm nào?']",Bạn có thể đăng ký/thêm vào tối đa hai mươi (20) thẻ Starbucks đã kích hoạt vào tài khoản Starbucks Rewards™ của bạn.
Tôi có thể chuyển số dư giữa các Thẻ Starbucks đã đăng ký của mình không?,"Có, bạn có thể chuyển toàn bộ số dư giữa các Thẻ Starbucks đã đăng ký của bạn bằng cách sử dụng Chuyển Tiền.","['Số dư trong Thẻ Starbucks đã đăng ký có thể được chuyển toàn bộ sang số dư Thẻ Starbucks đã đăng ký khác trong cùng một tài khoản, nhưng việc chuyển một phần số dư là không được phép. Thẻ Starbucks đã chuyển tiền sẽ trở thành Thẻ không còn tiền nhưng Thẻ Starbucks này vẫn hoạt động để tiếp tục nạp tiền và sử dụng. Thẻ Starbucks không còn hiệu lực được xác định là không thể tích lũy Điểm Ngôi Sao. Việc chuyển tiền giữa các Thẻ Starbucks chỉ được thực hiện bởi cá nhân bạn thông qua website của chúng tôi hoặc', 'Thẻ Starbucks có thể được đăng ký vào tài khoản của bạn tại bất cứ thời điểm nào. Bạn có thể đăng ký thêm tối đa hai mươi (20) Thẻ Starbucks đã kích hoạt vào tài khoản của bạn. Số dư thanh toán trong một Thẻ Starbucks đã đăng ký (Thẻ Starbucks đã chuyển tiền) có thể được chuyển toàn bộ sang một Thẻ Starbucks đã đăng ký khác trong cùng một tài khoản (Chuyển Tiền) nhưng không được phép chuyển một phần số dư. Thẻ Starbucks đã chuyển tiền sẽ trở thành Thẻ không còn tiền nhưng Thẻ Starbucks này vẫn hoạt động để', 'có thể tiếp tục sử dụng Thẻ thay thế này để nhận các ưu đãi chưa sử dụng trong thời hạn có hiệu lực của ưu đãi đó, ngược lại trong trường hợp bạn có nhiều hơn một Thẻ Starbucks đã đăng ký, số dư của Thẻ Starbucks Cards bị mất/bị đánh cắp/bị hủy hoại này sẽ được chuyển đến một trong các Thẻ Starbucks đã đăng ký khác của bạn.']","Số dư trong Thẻ Starbucks đã đăng ký có thể được chuyển toàn bộ sang số dư Thẻ Starbucks đã đăng ký khác trong cùng một tài khoản, nhưng việc chuyển một phần số dư là không được phép. Thẻ Starbucks đã chuyển tiền sẽ trở thành Thẻ không còn tiền nhưng Thẻ Starbucks này vẫn hoạt động để tiếp tục nạp tiền và sử dụng. Thẻ Starbucks không còn hiệu lực được xác định là không thể tích lũy Điểm Ngôi Sao. Việc chuyển tiền giữa các Thẻ Starbucks chỉ được thực hiện bởi cá nhân bạn thông qua website của chúng tôi hoặc ứng dụng di động."
Chương trình Starbucks Rewards™ hoạt động như thế nào?,"Chương trình Starbucks Rewards™ là một cách thức thể hiện sự nỗ lực của Starbucks để tri ân và cảm ơn khách hàng trung thành ủng hộ hoạt động kinh doanh và mua các sản phẩm Starbucks® của chúng tôi. Các thành viên có thể nhận được và tích lũy “Điểm Ngôi Sao” mà có thể được sử dụng để hưởng các lợi ích của Chương trình Starbucks Rewards™, còn được biết đến như là “Ưu Đãi”, tại các cửa hàng Starbucks® tại Việt Nam.","['Chương trình Starbucks Rewards™ hoạt động như thế nào?', 'Chương trình Starbucks Rewards™ là một cách thức thể hiện sự nỗ lực của Starbucks để tri ân và cảm ơn khách hàng trung thành ủng hộ hoạt động kinh doanh và mua các sản phẩm Starbucks® của chúng tôi. Các thành viên của Chương trình Starbucks Rewards™ có thể nhận được và tích lũy “Điểm Ngôi Sao” mà có thể được sử dụng để hưởng các lợi ích của Chương trình Starbucks Rewards™, còn được biết đến như là “Ưu Đãi”, tại các cửa hàng Starbucks® tại Việt Nam. \n\nThẻ Starbucks', 'Chương trình Starbucks Rewards™ là dành cho việc sử dụng cá nhân. Việc sử dụng cho mục đích thương mại là bị cấm. Chương trình này không nhằm tới, cũng không được dự liệu cho việc sử dụng bởi bất cứ người nào dưới 18 tuổi.']","Việc thanh toán bằng Thẻ Starbucks đã đăng ký của bạn được thực hiện dễ dàng tại bất kỳ cửa hàng Starbucks nào để tích lũy Điểm Ngôi Sao. Bạn chỉ cần xuất trình Thẻ Starbucks đã đăng ký hoặc Mã vạch trên ứng dụng di động cho nhân viên pha chế khi thanh toán mua hàng tại bất kỳ cửa hàng Starbucks nào tại Việt Nam, tổng số tiền thanh toán cho việc mua hàng sẽ được ghi nhận trong tài khoản Starbucks Rewards™ của bạn. Bạn cũng có thể tích lũy Điểm Ngôi Sao với các đơn hàng hoàn thành trên ứng dụng Grab. Với mỗi giá trị 40.000 đồng chi trả hoàn toàn bằng Thẻ Starbucks đã đăng ký, bạn sẽ tích lũy được một (1) Điểm Ngôi Sao vào tài khoản Starbucks Rewards™ của mình. Với mỗi giá trị 80.000 đồng chi trả khi hoàn thành đơn hàng đặt tại cửa hàng Starbucks trên ứng dụng Grab (sau khi đã trừ đi các khoản ưu đãi, giảm giá và không bao gồm phí giao hàng, phí cố định hay các mức phí khác do Grab quy định), bạn sẽ tích lũy được một (1) Điểm Ngôi Sao vào tài khoản Starbucks Rewards™ của mình. Tài khoản phải có ít nhất 01 giao dịch mua hàng kể từ khi đăng ký thành công để được tận hưởng các quyền lợi của Chương trình Starbucks Rewards."
Điểm Ngôi Sao được tích lũy như thế nào?,Điểm Ngôi Sao được tích lũy bằng cách thanh toán toàn bộ cho giao dịch mua hàng bằng Thẻ Starbucks đã đăng ký tại bất kỳ cửa hàng nào của Starbucks.,"['Điểm Ngôi Sao được tích lũy như thế nào?', 'định), bạn sẽ tích lũy được một Điểm Ngôi Sao. Lưu ý rằng Điểm Ngôi Sao chỉ có thể tích lũy bằng việc mua hàng tại cửa hàng và không bao gồm việc nạp tiền vào (các) Thẻ Starbucks.', 'Những ưu đãi dành riêng cho thành viên Hạng Vàng.\nĐiểm Ngôi Sao là gì và Tôi có thể tích lũy bằng cách nào?\nBạn sẽ tích lũy Điểm Ngôi Sao và nhận các lợi ích tại cửa hàng một cách dễ dàng bằng cách thanh toán toàn bộ cho giao dịch mua hàng bằng Thẻ Starbucks đã đăng ký của bạn tại bất kỳ cửa hàng Starbucks nào tại Việt Nam. Bạn có thể tra cứu Điểm Ngôi Sao của mình bằng cách đăng nhập vào tài khoản của mình tại https://card.starbucks.vn. Hoặc sử dụng ứng dụng di động.']","Với mỗi giá trị 40.000 đồng chi trả từ tài khoản Starbucks bằng cách sử dụng Thẻ Starbucks đã đăng ký hoặc ứng dụng di động tại bất cứ cửa hàng Starbucks tại Việt Nam, hoặc mỗi giá trị 80.000 đồng chi trả khi hoàn thành đơn hàng Starbucks trên ứng dụng Grab (sau khi đã trừ đi các khoản ưu đãi, giảm giá và không bao gồm phí giao hàng, phí cố định hay các mức phí khác do Grab quy định), bạn sẽ tích lũy được một Điểm Ngôi Sao. Lưu ý rằng Điểm Ngôi Sao chỉ có thể tích lũy bằng việc mua hàng tại cửa hàng và không bao gồm việc nạp tiền vào (các) Thẻ Starbucks."
Tôi có thể tích lũy Điểm Ngôi Sao khi thanh toán bằng tiền mặt hoặc thẻ tín dụng/thẻ ghi nợ thay cho Thẻ Starbucks đã đăng ký của tôi không?,"Có, bạn có thể tích lũy Điểm Ngôi Sao khi thanh toán bằng tiền mặt hoặc thẻ tín dụng/thẻ ghi nợ thay cho Thẻ Starbucks đã đăng ký.","['Tôi có thể tích lũy Điểm Ngôi Sao khi thanh toán bằng tiền mặt hoặc thẻ tín dụng/thẻ ghi nợ thay cho Thẻ Starbucks đã đăng ký của tôi không?\nBạn chỉ có thể tích lũy Điểm Ngôi Sao khi việc thanh toán được thực hiện bằng Thẻ Starbucks đã đăng ký. Bạn không thể tích lũy Điểm Ngôi Sao nếu sử dụng các phương thức thanh toán khác. Bạn có thể sử dụng thẻ tín dụng hoặc tiền mặt để nạp tiền vào Thẻ Starbucks để thanh toán.\nĐiểm Ngôi Sao của tôi có bị hết hạn không?', 'định), bạn sẽ tích lũy được một Điểm Ngôi Sao. Lưu ý rằng Điểm Ngôi Sao chỉ có thể tích lũy bằng việc mua hàng tại cửa hàng và không bao gồm việc nạp tiền vào (các) Thẻ Starbucks.', 'Việc thanh toán bằng Thẻ Starbucks đã đăng ký của bạn được thực hiện dễ dàng tại bất kỳ cửa hàng Starbucks nào để tích lũy Điểm Ngôi Sao. Bạn chỉ cần xuất trình Thẻ Starbucks đã đăng ký hoặc Mã vạch trên ứng dụng di động cho nhân viên pha chế khi thanh toán mua hàng tại bất kỳ cửa hàng Starbucks nào tại Việt Nam, tổng số tiền thanh toán cho việc mua hàng sẽ được ghi nhận trong tài khoản Starbucks Rewards™ của bạn. Bạn cũng có thể tích lũy Điểm Ngôi Sao với các đơn hàng hoàn thành trên ứng dụng Grab. Với']",Bạn chỉ có thể tích lũy Điểm Ngôi Sao khi việc thanh toán được thực hiện bằng Thẻ Starbucks đã đăng ký. Bạn không thể tích lũy Điểm Ngôi Sao nếu sử dụng các phương thức thanh toán khác. Bạn có thể sử dụng thẻ tín dụng hoặc tiền mặt để nạp tiền vào Thẻ Starbucks để thanh toán.
Điểm Ngôi Sao của tôi có bị hết hạn không?,"Không, bạn không cần phải xuất trình Thẻ Starbucks đã đăng ký để tích lũy Điểm Ngôi Sao. Bạn có thể sử dụng thẻ tín dụng hoặc tiền mặt để nạp tiền vào Thẻ Starbucks để thanh toán.","['một trăm (100) Điểm Ngôi Sao mới trong thời hạn mười hai (12) tháng kể từ ngày tham gia của bạn, bạn sẽ đủ điều kiện nâng cấp lên Hạng Vàng.', 'Tôi có thể tích lũy Điểm Ngôi Sao khi thanh toán bằng tiền mặt hoặc thẻ tín dụng/thẻ ghi nợ thay cho Thẻ Starbucks đã đăng ký của tôi không?\nBạn chỉ có thể tích lũy Điểm Ngôi Sao khi việc thanh toán được thực hiện bằng Thẻ Starbucks đã đăng ký. Bạn không thể tích lũy Điểm Ngôi Sao nếu sử dụng các phương thức thanh toán khác. Bạn có thể sử dụng thẻ tín dụng hoặc tiền mặt để nạp tiền vào Thẻ Starbucks để thanh toán.\nĐiểm Ngôi Sao của tôi có bị hết hạn không?', 'Điểm Ngôi Sao sẽ được dùng như thế nào?\nĐiểm Ngôi Sao chỉ được dùng để xét hạng thành viên và tích lũy Điểm Ngôi Sao để nhận Ưu Đãi Đồ Uống Miễn Phí. Vui lòng xem bảng thông tin dưới đây về hạng thành viên Số Điểm Ngôi Sao tích lũy trong vòng 12 tháng kể từ Ngày Kỷ Niệm hoặc từ ngày bạn được nâng cấp lên Hạng Vàng.\nSố Điểm Ngôi Sao\tHạng Thành viên\n0-99\tXanh\n100 - 100+ Vàng\nTôi có cần phải xuất trình Thẻ Starbucks đã đăng ký để tích lũy Điểm Ngôi Sao hay không?']","Có, sau khi đăng ký, bạn có 12 tháng để tích lũy một trăm (100) Điểm Ngôi Sao để được nâng lên Hạng Vàng. Để duy trì thành viên Hạng Vàng, bạn phải tái tích lũy ít nhất 100 Điểm Ngôi Sao cho 12 tháng tiếp theo và Điểm Ngôi Sao sẽ được thiết lập lại vào ngày kỷ niệm (12 tháng kể từ ngày bạn được nâng cấp lên Hạng Vàng). Để thông tin cho bạn, việc thiết lập lại tại Hạng Vàng có nghĩa là số dư Điểm Ngôi Sao sau khi chia cho 25 và không vượt quá 25 Điểm Ngôi Sao. Nếu không tích lũy đủ Điểm Ngôi Sao để duy trì Hạng Vàng, bạn sẽ bị hạ xuống Hạng Xanh của Chương trình Starbucks Rewards™ và số dư Điểm Ngôi Sao của bạn sẽ tự động thiết lập lại về giá trị không (0) vào ngày kỷ niệm của bạn. Đối với thành viên Hạng Xanh, nếu bạn không tích lũy đủ một trăm (100) Điểm Ngôi Sao trong vòng 12 tháng để nâng cấp lên thành viên Hạng Vàng, bạn vẫn tiếp tục là thành viên Hạng Xanh nhưng số dư Điểm Ngôi Sao của bạn sẽ thiết lập lại về mức không (0) vào ngày kỷ niệm của bạn."
Điểm Ngôi Sao sẽ được dùng như thế nào?,Điểm Ngôi Sao chỉ được dùng để xét hạng thành viên và tích lũy Điểm Ngôi Sao để nhận Ưu Đãi Đồ Uống Miễn Phí.,"['Điểm Ngôi Sao sẽ được dùng như thế nào?\nĐiểm Ngôi Sao chỉ được dùng để xét hạng thành viên và tích lũy Điểm Ngôi Sao để nhận Ưu Đãi Đồ Uống Miễn Phí. Vui lòng xem bảng thông tin dưới đây về hạng thành viên Số Điểm Ngôi Sao tích lũy trong vòng 12 tháng kể từ Ngày Kỷ Niệm hoặc từ ngày bạn được nâng cấp lên Hạng Vàng.\nSố Điểm Ngôi Sao\tHạng Thành viên\n0-99\tXanh\n100 - 100+ Vàng\nTôi có cần phải xuất trình Thẻ Starbucks đã đăng ký để tích lũy Điểm Ngôi Sao hay không?', 'Những ưu đãi dành riêng cho thành viên Hạng Vàng.\nĐiểm Ngôi Sao là gì và Tôi có thể tích lũy bằng cách nào?\nBạn sẽ tích lũy Điểm Ngôi Sao và nhận các lợi ích tại cửa hàng một cách dễ dàng bằng cách thanh toán toàn bộ cho giao dịch mua hàng bằng Thẻ Starbucks đã đăng ký của bạn tại bất kỳ cửa hàng Starbucks nào tại Việt Nam. Bạn có thể tra cứu Điểm Ngôi Sao của mình bằng cách đăng nhập vào tài khoản của mình tại https://card.starbucks.vn. Hoặc sử dụng ứng dụng di động.', 'Điểm Ngôi Sao được tích lũy như thế nào?']",Điểm Ngôi Sao chỉ được dùng để xét hạng thành viên và tích lũy Điểm Ngôi Sao để nhận Ưu Đãi Đồ Uống Miễn Phí. Vui lòng xem bảng thông tin dưới đây về hạng thành viên Số Điểm Ngôi Sao tích lũy trong vòng 12 tháng kể từ Ngày Kỷ Niệm hoặc từ ngày bạn được nâng cấp lên Hạng Vàng.
Tôi có cần phải xuất trình Thẻ Starbucks đã đăng ký để tích lũy Điểm Ngôi Sao hay không?,"Có, bạn cần phải xuất trình Thẻ Starbucks đã đăng ký để tích lũy Điêm Ngôi Sao.","['Hiện tại, bạn cần phải xuất trình Thẻ Starbucks đã đăng ký khi thực hiện việc thanh toán mua hàng để tích lũy Điểm Ngôi Sao. Nếu bạn đã tải ứng dụng di động về điện thoại của mình và đã đăng nhập bằng cùng email bạn đã đăng ký, bạn cũng có thể thực hiện việc thanh toán bằng việc xuất trình mã vạch trên ứng dụng điện thoại cho nhân viên pha tại cửa hàng. Để biết thêm thông tin chi tiết, vui lòng truy cập https://card.starbucks.vn.', 'Điểm Ngôi Sao sẽ được dùng như thế nào?\nĐiểm Ngôi Sao chỉ được dùng để xét hạng thành viên và tích lũy Điểm Ngôi Sao để nhận Ưu Đãi Đồ Uống Miễn Phí. Vui lòng xem bảng thông tin dưới đây về hạng thành viên Số Điểm Ngôi Sao tích lũy trong vòng 12 tháng kể từ Ngày Kỷ Niệm hoặc từ ngày bạn được nâng cấp lên Hạng Vàng.\nSố Điểm Ngôi Sao\tHạng Thành viên\n0-99\tXanh\n100 - 100+ Vàng\nTôi có cần phải xuất trình Thẻ Starbucks đã đăng ký để tích lũy Điểm Ngôi Sao hay không?', 'định), bạn sẽ tích lũy được một Điểm Ngôi Sao. Lưu ý rằng Điểm Ngôi Sao chỉ có thể tích lũy bằng việc mua hàng tại cửa hàng và không bao gồm việc nạp tiền vào (các) Thẻ Starbucks.']","Hiện tại, bạn cần phải xuất trình Thẻ Starbucks đã đăng ký khi thực hiện việc thanh toán mua hàng để tích lũy Điểm Ngôi Sao. Nếu bạn đã tải ứng dụng di động về điện thoại của mình và đã đăng nhập bằng cùng email bạn đã đăng ký, bạn cũng có thể thực hiện việc thanh toán bằng việc xuất trình mã vạch trên ứng dụng điện thoại cho nhân viên pha tại cửa hàng. Để biết thêm thông tin chi tiết, vui lòng truy cập https://card.starbucks.vn."
Trong vòng bao lâu sau khi sử dụng Thẻ Starbucks đã đăng ký của mình thì tôi có thể kiểm tra Điểm Ngôi Sao tích lũy được?,Trong vòng 48 giờ.,"['Trong vòng bao lâu sau khi sử dụng Thẻ Starbucks đã đăng ký của mình thì tôi có thể kiểm tra Điểm Ngôi Sao tích lũy được?\nĐiểm Ngôi Sao đã được tích lũy từ việc sử dụng Thẻ Starbucks của bạn sẽ được cập nhật trên tài khoản của bạn tại thời điểm sớm nhất sau khi giao dịch được thực hiện thành công hoặc trong vòng 48 tiếng.\nLàm thế nào để tôi nhận các ưu đãi?', 'Xin lưu ý rằng Điểm Ngôi Sao được tích lũy cho mỗi hạng thẻ của Chương trình Starbucks Rewards™ chỉ có giá trị trong mười hai (12) tháng kể từ ngày bạn đạt hạng thành viên cụ thể. Tuy nhiên, bất cứ Ưu Đãi nào mà bạn đã tích lũy nhưng chưa sử dụng và chưa hết hạn vẫn tiếp tục áp dụng trong tài khoản của bạn và bạn có thể sử dụng Ưu Đãi đó theo các điều kiện được quy định tại đây.', 'Điểm Ngôi Sao sẽ được dùng như thế nào?\nĐiểm Ngôi Sao chỉ được dùng để xét hạng thành viên và tích lũy Điểm Ngôi Sao để nhận Ưu Đãi Đồ Uống Miễn Phí. Vui lòng xem bảng thông tin dưới đây về hạng thành viên Số Điểm Ngôi Sao tích lũy trong vòng 12 tháng kể từ Ngày Kỷ Niệm hoặc từ ngày bạn được nâng cấp lên Hạng Vàng.\nSố Điểm Ngôi Sao\tHạng Thành viên\n0-99\tXanh\n100 - 100+ Vàng\nTôi có cần phải xuất trình Thẻ Starbucks đã đăng ký để tích lũy Điểm Ngôi Sao hay không?']",Điểm Ngôi Sao đã được tích lũy từ việc sử dụng Thẻ Starbucks của bạn sẽ được cập nhật trên tài khoản của bạn tại thời điểm sớm nhất sau khi giao dịch được thực hiện thành công hoặc trong vòng 48 tiếng.
Làm thế nào để tôi nhận các ưu đãi?,"Bạn có thể nhận các ưu đãi tại Starbucks bằng cách yêu cầu nhân viên pha chế tại bất kỳ cửa hàng nào tại Việt Nam. Bạn cũng có thể sử dụng ứng dụng di động của bạn để quét mã vạch hoặc xuất trình Thẻ Starbucks đã đăng ký của bạn. Ngoài ra, bạn phải thanh toán hoàn toàn cho giao dịch bằng Thẻ Starbucks đã đăng ký của bạn (ngoại trừ nhận các ưu đãi miễn phí) để tích lũy hoặc đổi phần thưởng.","['Làm thế nào để tôi nhận các ưu đãi?\nBạn chỉ cần yêu cầu nhân viên pha chế tại bất kỳ cửa hàng Starbucks nào tại Việt Nam mà bạn muốn nhận ưu đãi. Bạn có thể quét mã vạch trên ứng dụng di động của bạn hoặc đơn giản là xuất trình Thẻ Starbucks đã đăng ký của bạn. Ngoài ra, bạn phải thanh toán hoàn toàn cho giao dịch bằng Thẻ Starbucks đã đăng ký của bạn (ngoại trừ nhận các ưu đãi miễn phí) để tích lũy hoặc đổi phần thưởng.', 'Thông qua email\nBước 1: Bạn sẽ nhận được một (1) email thông báo về việc bạn đã mua hoặc được tặng Gói Ưu Đãi trong vòng hai mươi bốn (24) giờ kể từ thời điểm hoàn tất việc mua Gói Ưu Đãi trên Ứng Dụng Di Động. Vui lòng nhấp chọn “Redeem Now” để đổi các mã ưu đãi tương ứng với Gói Ưu Đãi đã mua. Nếu bạn không nhận được email xác nhận này trong khoảng thời gian nêu trên, vui lòng liên hệ với Trung tâm Chăm sóc Khách hàng Starbucks Rewards™ để được hỗ trợ;', 'Tính năng “Mua Gói Ưu Đãi” (“Tính năng Voucher Bundle”) trên Ứng Dụng Di Động này cho phép bạn mua để sử dụng (một hoặc nhiều) Gói Ưu Đãi bao gồm nhiều mã ưu đãi khác nhau thông qua Ứng Dụng Di Động. Bằng việc sử dụng tính năng này, bạn sẽ có được các mã ưu đãi để mua sản phẩm từ cửa hàng Starbucks với mức giá thấp hơn so với giá trị thực tế (giá gốc) của sản phẩm. Bạn có thể lựa chọn mua Gói Ưu Đãi để sử dụng cho bản thân mình và/hoặc tặng cho bất kỳ người nào khác, với điều kiện người nhận phải là thành']","Bạn chỉ cần yêu cầu nhân viên pha chế tại bất kỳ cửa hàng Starbucks nào tại Việt Nam mà bạn muốn nhận ưu đãi. Bạn có thể quét mã vạch trên ứng dụng di động của bạn hoặc đơn giản là xuất trình Thẻ Starbucks đã đăng ký của bạn. Ngoài ra, bạn phải thanh toán hoàn toàn cho giao dịch bằng Thẻ Starbucks đã đăng ký của bạn (ngoại trừ nhận các ưu đãi miễn phí) để tích lũy hoặc đổi phần thưởng."
Có giới hạn thời gian trong việc tích lũy Điểm Ngôi Sao để đạt tới hạng thành viên tiếp theo không?,"Có, có giới hạn thời gian trong việc tích lũy Điểm Ngôi Sao để đạt tới hạng thành viên tiếp theo.","['Có giới hạn thời gian trong việc tích lũy Điểm Ngôi Sao để đạt tới hạng thành viên tiếp theo không?\nĐiểm Ngôi Sao tích lũy sẽ được tính hàng năm cho mỗi giai đoạn 12 tháng kể từ Ngày Kỷ Niệm của bạn (ngày mà bạn đáp ứng điều kiện đối với hạng thành viên hiện tại) để xác định hạng thành viên mà bạn được xếp vào. Điểm Ngôi Sao tích lũy sẽ được tính riêng cho từng giai đoạn 12 tháng như thế.\nLàm thế nào để tôi duy trì Hạng Vàng?', 'Có, sau khi đăng ký, bạn có 12 tháng để tích lũy một trăm (100) Điểm Ngôi Sao để được nâng lên Hạng Vàng. Để duy trì thành viên Hạng Vàng, bạn phải tái tích lũy ít nhất 100 Điểm Ngôi Sao cho 12 tháng tiếp theo và Điểm Ngôi Sao sẽ được thiết lập lại vào ngày kỷ niệm (12 tháng kể từ ngày bạn được nâng cấp lên Hạng Vàng). Để thông tin cho bạn, việc thiết lập lại tại Hạng Vàng có nghĩa là số dư Điểm Ngôi Sao sau khi chia cho 25 và không vượt quá 25 Điểm Ngôi Sao. Nếu không tích lũy đủ Điểm Ngôi Sao để duy trì', 'một trăm (100) Điểm Ngôi Sao mới trong thời hạn mười hai (12) tháng kể từ ngày tham gia của bạn, bạn sẽ đủ điều kiện nâng cấp lên Hạng Vàng.']",Điểm Ngôi Sao tích lũy sẽ được tính hàng năm cho mỗi giai đoạn 12 tháng kể từ Ngày Kỷ Niệm của bạn (ngày mà bạn đáp ứng điều kiện đối với hạng thành viên hiện tại) để xác định hạng thành viên mà bạn được xếp vào. Điểm Ngôi Sao tích lũy sẽ được tính riêng cho từng giai đoạn 12 tháng như thế.
Làm thế nào để tôi duy trì Hạng Vàng?,"Để duy trì Hạng Vàng, bạn phải tích lũy ít nhất một trăm (100) Điểm Ngôi Sao mới trong khoảng thời gian mỗi mười hai (12) tháng liên tiếp sau ngày bạn đạt được Hạng Vàng. Tại ngày kỷ niệm của ngày đạt Hạng Vàng (12 tháng) kể từ ngày bạn được nâng cấp lên Hạng Vàng, Điểm Ngôi Sao của bạn sẽ được thiết lập lại.","['Để duy trì tất cả các lợi ích của Hạng Vàng, bạn phải tích lũy ít nhất một trăm (100) Điểm Ngôi Sao mới trong khoảng thời gian mỗi mười hai (12) tháng liên tiếp sau ngày bạn đạt được Hạng Vàng. Tại ngày kỷ niệm của ngày đạt Hạng Vàng (12 tháng) kể từ ngày bạn được nâng cấp lên Hạng Vàng, Điểm Ngôi Sao của bạn sẽ được thiết lập lại. Để thông tin cho bạn, việc thiết lập lại tại Hạng Vàng có nghĩa là số dư Điểm Ngôi Sao sau khi chia cho 25 và không vượt quá 25 Điểm Ngôi Sao. Nếu bạn không tích lũy một trăm', 'Có, sau khi đăng ký, bạn có 12 tháng để tích lũy một trăm (100) Điểm Ngôi Sao để được nâng lên Hạng Vàng. Để duy trì thành viên Hạng Vàng, bạn phải tái tích lũy ít nhất 100 Điểm Ngôi Sao cho 12 tháng tiếp theo và Điểm Ngôi Sao sẽ được thiết lập lại vào ngày kỷ niệm (12 tháng kể từ ngày bạn được nâng cấp lên Hạng Vàng). Để thông tin cho bạn, việc thiết lập lại tại Hạng Vàng có nghĩa là số dư Điểm Ngôi Sao sau khi chia cho 25 và không vượt quá 25 Điểm Ngôi Sao. Nếu không tích lũy đủ Điểm Ngôi Sao để duy trì', 'Làm thế nào để tôi duy trì Hạng Vàng?\nBạn sẽ trở thành thành viên Hạng Vàng cho toàn bộ thời gian 12 tháng tiếp theo kể từ ngày bạn được nâng lên Hạng Vàng mà đó chính là Ngày Kỷ Niệm mới của bạn. Đơn giản, với 100 Điểm Ngôi Sao tích lũy thêm được tính đến Ngày Kỷ Niệm (ngày bạn được nâng cấp lên Hạng Vàng) bạn sẽ đủ điều kiện hưởng những ưu đãi dành cho Hạng Vàng cho giai đoạn 12 tháng liên tục tiếp theo.\nCó mất phí khi tham gia chương trình Starbucks Rewards™ không?']","Bạn sẽ trở thành thành viên Hạng Vàng cho toàn bộ thời gian 12 tháng tiếp theo kể từ ngày bạn được nâng lên Hạng Vàng mà đó chính là Ngày Kỷ Niệm mới của bạn. Đơn giản, với 100 Điểm Ngôi Sao tích lũy thêm được tính đến Ngày Kỷ Niệm (ngày bạn được nâng cấp lên Hạng Vàng) bạn sẽ đủ điều kiện hưởng những ưu đãi dành cho Hạng Vàng cho giai đoạn 12 tháng liên tục tiếp theo."
Có mất phí khi tham gia chương trình Starbucks Rewards™ không?,"Không, không có mất phí khi tham gia chương trình Starbucks Rewards™. Tuy nhiên, bạn cần nạp tối thiếu 100.000 đồng để kích hoạt Thẻ Starbucks của bạn.","['Có mất phí khi tham gia chương trình Starbucks Rewards™ không?\nBạn không phải trả phí thành viên cho việc tham gia chương trình Starbucks Rewards™, nhưng khi đăng ký tài khoản Starbucks Rewards™, bạn cần nạp tối thiếu 100.000 đồng để kích hoạt Thẻ Starbucks của bạn.\nTôi có thể xem lịch sử giao dịch của mình không?\nBạn có thể xem lịch sử giao dịch của mình trên website https://card.starbucks.vn hoặc thông qua Mục “Lịch sử Giao Dịch” trong ứng dụng di động.\nTôi có thể kiểm tra các ưu đãi của mình không?', 'Bạn không phải trả phí thành viên cho việc tham gia Chương trình Starbucks Rewards™, và có thể đăng ký trực tuyến tài khoản Starbucks Rewards™ trên Ứng Dụng Di Động để tham gia Chương trình Starbucks Rewards™ với một (1) Thẻ Điện Tử giá trị 0 VNĐ của bạn được đăng ký vào tài khoản sau khi việc đăng ký tài khoản thành công. Tuy nhiên, bạn chỉ có thể sử dụng tính năng O&PU và/hoặc tính năng SBD và/hoặc tính năng Voucher Bundle khi bạn có Thẻ Starbucks đã kích hoạt và đã nạp tiền đủ để thanh toán trong tài', 'Chương trình Starbucks Rewards™ hoạt động như thế nào?']","Bạn không phải trả phí thành viên cho việc tham gia chương trình Starbucks Rewards™, nhưng khi đăng ký tài khoản Starbucks Rewards™, bạn cần nạp tối thiếu 100.000 đồng để kích hoạt Thẻ Starbucks của bạn."
Tôi có thể xem lịch sử giao dịch của mình không?,"Có, bạn vẫn có thể kiểm tra tất cả bản ghi giao dịch của Thẻ Starbucks đã đăng ký của mình thông qua ứng dụng di động (mục Lịch sử giao dịch) hoặc thông qua mục Thẻ Của Tôi trên website của chúng tôi. Thông tin giao dịch sẽ giống với thông tin trên hóa đơn mà bạn nhận được.","['Tôi có thể kiểm tra lịch sử giao dịch dù đã nhận được hóa đơn mua hàng tại cửa hàng hay không?\nCó, bạn vẫn có thể kiểm tra tất cả bản ghi giao dịch của Thẻ Starbucks đã đăng ký của mình thông qua ứng dụng di động (mục Lịch sử giao dịch) hoặc thông qua mục Thẻ Của Tôi trên website của chúng tôi. Thông tin giao dịch sẽ giống với thông tin trên hóa đơn mà bạn nhận được.\nTôi cần làm gì nếu bị mất Thẻ Starbucks Rewards™?', 'Thông Tin Về Giao Dịch Mua– Chúng tôi có thể thu thập thông tin về các giao dịch của bạn tại các cửa hàng của chúng tôi hoặc trên các trang web của chúng tôi hoặc ứng dụng di động của chúng tôi bao gồm những sản phẩm bạn mua, mức độ thường xuyên bạn mua các sản phẩm, bất kỳ quà tặng hoặc khuyến mại liên quan đến giao dịch mua và các sản phẩm bạn đã đưa vào ""danh sách muốn mua"" trong thời gian tới.', 'Làm thế nào để tôi kiểm tra số dư trong Thẻ Starbucks?\nBạn có thể đăng nhập vào tài khoản của mình và kiểm tra số dư thông qua website https://card.starbucks.vn. Ngoài ra, bạn cũng sẽ có thể tải ứng dụng di động của chúng tôi, và qua đó bạn có thể kiểm tra số dư trong Thẻ Starbcuks của mình hoặc đến tất cả cửa hàng Starbucks tại Việt Nam và yêu cầu nhân viên pha chế để họ kiểm tra giúp bạn.\nTôi có thể kiểm tra lịch sử giao dịch dù đã nhận được hóa đơn mua hàng tại cửa hàng hay không?']",Bạn có thể xem lịch sử giao dịch của mình trên website https://card.starbucks.vn hoặc thông qua Mục “Lịch sử Giao Dịch” trong ứng dụng di động.
Tôi có thể kiểm tra các ưu đãi của mình không?,"Có, bạn có thể kiểm tra các ưu đãi của mình tại website https://card.starbucks.vn hoặc tải ứng dụng di động của chúng tôi.","['Sau khi kích hoạt thành công, bạn có thể kiểm tra thông tin của (các) Gói Ưu Đãi mà bạn đã mua hoặc được tặng. Cụ thể, bạn có thể kiểm tra thông tin về giá tiền và số lượng Gói Ưu Đãi đã mua tại mục “Lịch sử giao dịch”, và thông tin người nhận và trạng thái của Gói Ưu Đãi đã mua tại phần “Đã mua” trong mục “Gói Ưu Đãi Starbucks”.', 'Tôi có thể kiểm tra các ưu đãi của mình không?\nBạn có thể xem danh sách các ưu đãi của mình tại website https://card.starbucks.vn hoặc tải ứng dụng di động của chúng tôi và qua đó bạn có thể kiểm tra danh sách ưu đãi của mình.\nLàm thế nào để tôi kiểm tra số dư trong Thẻ Starbucks?', 'Bạn có thể xem hoặc theo dõi số dư Điểm Ngôi Sao và Ưu Đãi hiện có của bạn tại https://card.starbucks.vn hoặc Ứng Dụng Di Động. Starbucks bảo lưu quyền thay đổi số lượng mức lợi ích và thay đổi những lợi ích và Ưu Đãi có liên quan đến mỗi mức lợi ích theo quyết định chỉ riêng của Starbucks tại bất cứ thời điểm nào. \n\nHạng Xanh']",Bạn có thể xem danh sách các ưu đãi của mình tại website https://card.starbucks.vn hoặc tải ứng dụng di động của chúng tôi và qua đó bạn có thể kiểm tra danh sách ưu đãi của mình.
Làm thế nào để tôi kiểm tra số dư trong Thẻ Starbucks?,"Bạn có thể kiểm tra số dư trong Thẻ Starbucks của bạn tại https://card.starbucks.vn hoặc trên ứng dụng di động, nếu có, hoặc đề nghị nhân viên pha chế tại bất kỳ cửa hàng Starbucks nào để họ kiểm tra giúp bạn.","['Làm thế nào để tôi kiểm tra số dư trong Thẻ Starbucks?\nBạn có thể đăng nhập vào tài khoản của mình và kiểm tra số dư thông qua website https://card.starbucks.vn. Ngoài ra, bạn cũng sẽ có thể tải ứng dụng di động của chúng tôi, và qua đó bạn có thể kiểm tra số dư trong Thẻ Starbcuks của mình hoặc đến tất cả cửa hàng Starbucks tại Việt Nam và yêu cầu nhân viên pha chế để họ kiểm tra giúp bạn.\nTôi có thể kiểm tra lịch sử giao dịch dù đã nhận được hóa đơn mua hàng tại cửa hàng hay không?', 'kiểm tra số dư trong Thẻ Starbucks eGift của bạn bằng cách đề nghị nhân viên pha chế tại bất kỳ cửa hàng Starbucks nào để họ kiểm tra giúp bạn, và tại https://card.starbucks.vn hoặc thông qua Ứng Dụng Di Động nếu bạn đã đăng ký tham gia Chương Trình Starbucks Rewards™.', 'Làm thế nào để tôi có thể kiểm tra số dư trong Thẻ Starbucks của tôi?\nBạn có thể kiểm tra số dư trong Thẻ Starbucks của bạn tại https://card.starbucks.vn hoặc trên ứng dụng di động, nếu có, hoặc đề nghị nhân viên pha chế tại bất kỳ cửa hàng Starbucks nào để họ kiểm tra giúp bạn.\nLàm thế nào để sử dụng Thẻ Starbucks cho việc thanh toán?\nBạn vui lòng xuất trình Thẻ Starbucks của bạn hoặc mã vạch trên ứng dụng di động cho nhân viên pha chế khi thực hiện việc thanh toán.']","Bạn có thể đăng nhập vào tài khoản của mình và kiểm tra số dư thông qua website https://card.starbucks.vn. Ngoài ra, bạn cũng sẽ có thể tải ứng dụng di động của chúng tôi, và qua đó bạn có thể kiểm tra số dư trong Thẻ Starbcuks của mình hoặc đến tất cả cửa hàng Starbucks tại Việt Nam và yêu cầu nhân viên pha chế để họ kiểm tra giúp bạn."
Tôi có thể kiểm tra lịch sử giao dịch dù đã nhận được hóa đơn mua hàng tại cửa hàng hay không?,"Có, bạn vẫn có thể kiểm tra tất cả bản ghi giao dịch của Thẻ Starbucks đã đăng ký của mình thông qua ứng dụng di động (mục Lịch sử giao dịch) hoặc thông qua mục Thẻ Của Tôi trên website của chúng tôi. Thông tin giao dịch sẽ giống với thông tin trên hóa đơn mà bạn nhận được.","['Tôi có thể kiểm tra lịch sử giao dịch dù đã nhận được hóa đơn mua hàng tại cửa hàng hay không?\nCó, bạn vẫn có thể kiểm tra tất cả bản ghi giao dịch của Thẻ Starbucks đã đăng ký của mình thông qua ứng dụng di động (mục Lịch sử giao dịch) hoặc thông qua mục Thẻ Của Tôi trên website của chúng tôi. Thông tin giao dịch sẽ giống với thông tin trên hóa đơn mà bạn nhận được.\nTôi cần làm gì nếu bị mất Thẻ Starbucks Rewards™?', 'Làm thế nào để tôi kiểm tra số dư trong Thẻ Starbucks?\nBạn có thể đăng nhập vào tài khoản của mình và kiểm tra số dư thông qua website https://card.starbucks.vn. Ngoài ra, bạn cũng sẽ có thể tải ứng dụng di động của chúng tôi, và qua đó bạn có thể kiểm tra số dư trong Thẻ Starbcuks của mình hoặc đến tất cả cửa hàng Starbucks tại Việt Nam và yêu cầu nhân viên pha chế để họ kiểm tra giúp bạn.\nTôi có thể kiểm tra lịch sử giao dịch dù đã nhận được hóa đơn mua hàng tại cửa hàng hay không?', 'Thông Tin Về Giao Dịch Mua– Chúng tôi có thể thu thập thông tin về các giao dịch của bạn tại các cửa hàng của chúng tôi hoặc trên các trang web của chúng tôi hoặc ứng dụng di động của chúng tôi bao gồm những sản phẩm bạn mua, mức độ thường xuyên bạn mua các sản phẩm, bất kỳ quà tặng hoặc khuyến mại liên quan đến giao dịch mua và các sản phẩm bạn đã đưa vào ""danh sách muốn mua"" trong thời gian tới.']","Có, bạn vẫn có thể kiểm tra tất cả bản ghi giao dịch của Thẻ Starbucks đã đăng ký của mình thông qua ứng dụng di động (mục Lịch sử giao dịch) hoặc thông qua mục Thẻ Của Tôi trên website của chúng tôi. Thông tin giao dịch sẽ giống với thông tin trên hóa đơn mà bạn nhận được."
Tôi cần làm gì nếu bị mất Thẻ Starbucks Rewards™?,"Bạn nên thông báo về việc Thẻ bị mất, bị đánh cắp hoặc phá hủy qua website https://card.starbucks.vn hoặc Ứng Dụng Di Động hoặc gọi tới Trung Tâm Chăm Sóc Khách Hàng Starbucks Rewards™ tại (028) 7306 7676 và xác nhận chỉ dẫn.","['Nếu Thẻ Starbucks của bạn bị mất, bị đánh cắp hoặc bị phá hủy, bạn có thể sẽ mất số dư tiền trong Thẻ Starbucks của bạn. Tuy nhiên, trong trường hợp là thành viên của Chương Trình Starbucks Rewards™, bạn có thể bảo toàn số dư Điểm Ngôi Sao trên tài khoản Starbucks Rewards™ của bạn, nếu bạn thông báo về việc Thẻ bị mất, bị đánh cắp, phá hủy thông qua website https://card.starbucks.vn hoặc Ứng Dụng Di Động hoặc gọi tới Trung Tâm Chăm Sóc Khách Hàng Starbucks Rewards™ tại (028) 7306 7676, và xác nhận chỉ dẫn', 'Việc đăng ký Thẻ Starbucks là cách duy nhất để bạn có thể tham gia chương trình Starbucks Rewards™. Bằng việc đăng ký tham gia chương trình, bạn sẽ nhận được thông tin về những chào bán và ưu đãi dành riêng cho thành viên của chương trình Starbucks Rewards™. Ngoài ra, Thẻ đã đăng ký của bạn sẽ được bảo vệ số dư Điểm Ngôi Sao trong trường hợp Thẻ bị mất, bị đánh cắp hoặc bị phá hủy. Cuối cùng, bạn có thể quản lý tài khoản và (các) Thẻ đã đăng ký của bạn theo nhiều cách, bao gồm cả việc thanh toán thông qua', 'Phần 2: Các câu hỏi về Chương trình Starbucks Rewards™\nLàm thế nào tôi có thể tham gia Chương trình Starbucks Rewards™ bằng Thẻ Starbucks của tôi?']","Trong trường hợp Thẻ Starbucks của bạn bị mất, bị đánh cắp hoặc bị phá hủy, bạn có thể sẽ mất số dư tiền trong Thẻ Starbuck của bạn. Tuy nhiên, bạn có thể bảo toàn số dư và Điểm Ngôi Sao trên tài khoản Starbucks Rewards™ của bạn, nếu bạn thông báo về việc Thẻ bị mất, bị đánh cắp, phá hủy thông qua website https://card.starbucks.vn hoặc ứng dụng di động hoặc gọi tới Trung Tâm Chăm Sóc Khách Hàng Starbucks Rewards™ tại (028) 7306 7676, và xác nhận chỉ dẫn của bạn, hoặc yêu cầu cấp lại Thẻ thay thế nếu bạn chỉ có một Thẻ Starbucks đã đăng ký."
Điều gì xảy ra trong trường hợp số dư Điểm Ngôi Sao của tôi không chính xác? Tôi có thể liên lạc với ai?,Bạn có thể liên hệ với Trung Tâm Chăm Sóc Khách Hàng tại (028) 7306 7676 để được hỗ trợ về vấn đề này.,"['Điều gì xảy ra trong trường hợp số dư Điểm Ngôi Sao của tôi không chính xác? Tôi có thể liên lạc với ai?', 'Chúng tôi luôn mong muốn đảm bảo số dư Điểm Ngôi Sao trên tài khoản của bạn phản ánh giao dịch mua hàng của bạn một cách chính xác. Trong trường hợp tổng số Điểm Ngôi Sao thể hiện trong tài khoản bạn không đúng, bạn có thể liên hệ với chúng tôi qua Trung Tâm Chăm Sóc Khách Hàng tại (028) 7306 7676. Bạn nên chắc chắn có sẵn số Thẻ Starbucks gồm 16 chữ số cho mục đích xác minh. Vui lòng lưu ý rằng Điểm Ngôi Sao và lịch sử giao dịch sẽ được cập nhật trong mỗi 48 giờ.', 'Nếu Thẻ Starbucks của bạn bị mất, bị đánh cắp hoặc bị phá hủy, bạn có thể sẽ mất số dư tiền trong Thẻ Starbucks của bạn. Tuy nhiên, trong trường hợp là thành viên của Chương Trình Starbucks Rewards™, bạn có thể bảo toàn số dư Điểm Ngôi Sao trên tài khoản Starbucks Rewards™ của bạn, nếu bạn thông báo về việc Thẻ bị mất, bị đánh cắp, phá hủy thông qua website https://card.starbucks.vn hoặc Ứng Dụng Di Động hoặc gọi tới Trung Tâm Chăm Sóc Khách Hàng Starbucks Rewards™ tại (028) 7306 7676, và xác nhận chỉ dẫn']","Chúng tôi luôn mong muốn đảm bảo số dư Điểm Ngôi Sao trên tài khoản của bạn phản ánh giao dịch mua hàng của bạn một cách chính xác. Trong trường hợp tổng số Điểm Ngôi Sao thể hiện trong tài khoản bạn không đúng, bạn có thể liên hệ với chúng tôi qua Trung Tâm Chăm Sóc Khách Hàng tại (028) 7306 7676. Bạn nên chắc chắn có sẵn số Thẻ Starbucks gồm 16 chữ số cho mục đích xác minh. Vui lòng lưu ý rằng Điểm Ngôi Sao và lịch sử giao dịch sẽ được cập nhật trong mỗi 48 giờ."
Tại sao phải đăng ký thẻ để được tham gia chương trình?,"Để nhận thông tin về chào bán và ưu đãi dành riêng cho thành viên, bảo vệ số dư Điểm Ngôi Sao trong trường hợp Thẻ bị mất hoặc phá hủy, quản lý tài khoản và Thẻ đã đăng ký của bạn theo nhiều cách, và truy cập lịch sử giao dịch trên website hoặc ứng dụng di động.","['Tại sao phải đăng ký thẻ để được tham gia chương trình?', 'Việc đăng ký Thẻ Starbucks là cách duy nhất để bạn có thể tham gia chương trình Starbucks Rewards™. Bằng việc đăng ký tham gia chương trình, bạn sẽ nhận được thông tin về những chào bán và ưu đãi dành riêng cho thành viên của chương trình Starbucks Rewards™. Ngoài ra, Thẻ đã đăng ký của bạn sẽ được bảo vệ số dư Điểm Ngôi Sao trong trường hợp Thẻ bị mất, bị đánh cắp hoặc bị phá hủy. Cuối cùng, bạn có thể quản lý tài khoản và (các) Thẻ đã đăng ký của bạn theo nhiều cách, bao gồm cả việc thanh toán thông qua', 'Có mất phí khi tham gia chương trình Starbucks Rewards™ không?\nBạn không phải trả phí thành viên cho việc tham gia chương trình Starbucks Rewards™, nhưng khi đăng ký tài khoản Starbucks Rewards™, bạn cần nạp tối thiếu 100.000 đồng để kích hoạt Thẻ Starbucks của bạn.\nTôi có thể xem lịch sử giao dịch của mình không?\nBạn có thể xem lịch sử giao dịch của mình trên website https://card.starbucks.vn hoặc thông qua Mục “Lịch sử Giao Dịch” trong ứng dụng di động.\nTôi có thể kiểm tra các ưu đãi của mình không?']","Việc đăng ký Thẻ Starbucks là cách duy nhất để bạn có thể tham gia chương trình Starbucks Rewards™. Bằng việc đăng ký tham gia chương trình, bạn sẽ nhận được thông tin về những chào bán và ưu đãi dành riêng cho thành viên của chương trình Starbucks Rewards™. Ngoài ra, Thẻ đã đăng ký của bạn sẽ được bảo vệ số dư Điểm Ngôi Sao trong trường hợp Thẻ bị mất, bị đánh cắp hoặc bị phá hủy. Cuối cùng, bạn có thể quản lý tài khoản và (các) Thẻ đã đăng ký của bạn theo nhiều cách, bao gồm cả việc thanh toán thông qua ứng dụng di động. Cuối cùng, xin lưu ý rằng địa chỉ email, địa chỉ gửi thư hiện hữu, ngày tháng năm sinh và số điện thoại di động là những thông tin cá nhân bắt buộc khi đăng ký thành viên."
Tôi có thể hoàn tiền từ Thẻ hay không?,"Không, bất kỳ số tiền hoặc giá trị nào trong Thẻ Starbucks của bạn không thể được hoàn trả.","['Tôi có thể hoàn tiền từ Thẻ hay không?\nBất kỳ số tiền / giá trị nào có trong Thẻ của bạn không thể được hoàn trả.\nĐiểm Ngôi Sao tích lũy trong tài khoản của tôi có thể chuyển nhượng cho người khác được không?\nRất tiếc, Điểm Ngôi Sao tích lũy trong mỗi tài khoản chỉ được sử dụng bởi chính chủ tài khoản mà không thể chuyển nhượng cho bất kỳ tài khoản nào khác.\nTôi có thể chuyển nhượng tư cách thành viên chương trình Starbucks Rewards™ cho người khác được không?', 'Tôi có thể được hoàn tiền từ Thẻ Starbucks của tôi không?\nKhi tiền được nạp vào tài khoản, bạn không thể yêu cầu việc hoàn lại tiền.\nThẻ Starbucks có hạn sử dụng hay không?', 'của bạn qua tính năng SBD có thể được hoàn thành bằng Thẻ Starbucks đã đăng ký thông qua Ứng Dụng Di Động, thẻ tín dụng/thẻ ghi nợ, hoặc ví điện tử do đối tác chúng tôi cung cấp. Nếu bạn thanh toán bằng Thẻ Starbucks, số tiền trả trước của bạn trên Thẻ Starbucks đã đăng ký đó sẽ được hệ thống của chúng tôi khấu trừ cho giao dịch mua hàng theo đơn đặt hàng đã tiến hành thanh toán của bạn. Starbucks cũng có các tiêu chuẩn bảo mật riêng cho các giao dịch khấu trừ này để đảm bảo thông tin bảo mật và an toàn.']",Bất kỳ số tiền / giá trị nào có trong Thẻ của bạn không thể được hoàn trả.
Điểm Ngôi Sao tích lũy trong tài khoản của tôi có thể chuyển nhượng cho người khác được không?,"Rất tiếc, Điểm Ngôi Sao tích lũy trong mỗi tài khoản chỉ được sử dụng bởi chính chủ tài khoản và không thể chuyển nhượng cho bất kỳ tài khoản nào khác.","['Tôi có thể hoàn tiền từ Thẻ hay không?\nBất kỳ số tiền / giá trị nào có trong Thẻ của bạn không thể được hoàn trả.\nĐiểm Ngôi Sao tích lũy trong tài khoản của tôi có thể chuyển nhượng cho người khác được không?\nRất tiếc, Điểm Ngôi Sao tích lũy trong mỗi tài khoản chỉ được sử dụng bởi chính chủ tài khoản mà không thể chuyển nhượng cho bất kỳ tài khoản nào khác.\nTôi có thể chuyển nhượng tư cách thành viên chương trình Starbucks Rewards™ cho người khác được không?', 'Số dư trong Thẻ Starbucks đã đăng ký có thể được chuyển toàn bộ sang số dư Thẻ Starbucks đã đăng ký khác trong cùng một tài khoản, nhưng việc chuyển một phần số dư là không được phép. Thẻ Starbucks đã chuyển tiền sẽ trở thành Thẻ không còn tiền nhưng Thẻ Starbucks này vẫn hoạt động để tiếp tục nạp tiền và sử dụng. Thẻ Starbucks không còn hiệu lực được xác định là không thể tích lũy Điểm Ngôi Sao. Việc chuyển tiền giữa các Thẻ Starbucks chỉ được thực hiện bởi cá nhân bạn thông qua website của chúng tôi hoặc', 'Tôi có thể tích lũy Điểm Ngôi Sao khi thanh toán bằng tiền mặt hoặc thẻ tín dụng/thẻ ghi nợ thay cho Thẻ Starbucks đã đăng ký của tôi không?\nBạn chỉ có thể tích lũy Điểm Ngôi Sao khi việc thanh toán được thực hiện bằng Thẻ Starbucks đã đăng ký. Bạn không thể tích lũy Điểm Ngôi Sao nếu sử dụng các phương thức thanh toán khác. Bạn có thể sử dụng thẻ tín dụng hoặc tiền mặt để nạp tiền vào Thẻ Starbucks để thanh toán.\nĐiểm Ngôi Sao của tôi có bị hết hạn không?']","Rất tiếc, Điểm Ngôi Sao tích lũy trong mỗi tài khoản chỉ được sử dụng bởi chính chủ tài khoản mà không thể chuyển nhượng cho bất kỳ tài khoản nào khác."
Tôi có thể chuyển nhượng tư cách thành viên chương trình Starbucks Rewards™ cho người khác được không?,"Không, tư cách thành viên không được phép chuyển nhượng cũng như không thể chia sẻ với các thành viên gia đình hoặc bạn bè.","['Tôi có thể chuyển nhượng tư cách thành viên chương trình Starbucks Rewards™ cho người khác được không?\nRất tiếc, tư cách thành viên không được phép chuyển nhượng cũng như không thể chia sẻ với các thành viên gia đình hoặc bạn bè.\nBằng cách nào Starbucks có thể bảo mật những thông tin cá nhân của tôi sau khi tôi đăng ký Thẻ Starbucks của tôi?\nVui lòng tham khảo Chính Sách Quyền Riêng Tư của chúng tôi để biết thêm chi tiết.\nLiệu những thông tin cá nhân của tôi có bị cung cấp cho những công ty khác không?', 'Tôi có thể hoàn tiền từ Thẻ hay không?\nBất kỳ số tiền / giá trị nào có trong Thẻ của bạn không thể được hoàn trả.\nĐiểm Ngôi Sao tích lũy trong tài khoản của tôi có thể chuyển nhượng cho người khác được không?\nRất tiếc, Điểm Ngôi Sao tích lũy trong mỗi tài khoản chỉ được sử dụng bởi chính chủ tài khoản mà không thể chuyển nhượng cho bất kỳ tài khoản nào khác.\nTôi có thể chuyển nhượng tư cách thành viên chương trình Starbucks Rewards™ cho người khác được không?', 'Starbucks có thể giới thiệu các chương trình khuyến mại liên quan đến Chương trình Starbucks Rewards™ theo đó các Điều Khoản Sử Dụng này có thể được thay đổi để áp dụng cho các chương trình đó.']","Rất tiếc, tư cách thành viên không được phép chuyển nhượng cũng như không thể chia sẻ với các thành viên gia đình hoặc bạn bè."
Bằng cách nào Starbucks có thể bảo mật những thông tin cá nhân của tôi sau khi tôi đăng ký Thẻ Starbucks của tôi?,"Starbucks bảo mật thông tin cá nhân của bạn bằng cách mã hóa dữ liệu của bạn bằng công nghệ mã hóa đầu cuối. Ngoài ra, họ cũng sử dụng các biện pháp an ninh mạng để bảo vệ dữ liệu của bạn khỏi truy cập trái phép và tuân theo các quy định bảo vệ dữ liệu nghiêm ngặt.","['Việc đăng ký Thẻ Starbucks là cách duy nhất để bạn có thể tham gia chương trình Starbucks Rewards™. Bằng việc đăng ký tham gia chương trình, bạn sẽ nhận được thông tin về những chào bán và ưu đãi dành riêng cho thành viên của chương trình Starbucks Rewards™. Ngoài ra, Thẻ đã đăng ký của bạn sẽ được bảo vệ số dư Điểm Ngôi Sao trong trường hợp Thẻ bị mất, bị đánh cắp hoặc bị phá hủy. Cuối cùng, bạn có thể quản lý tài khoản và (các) Thẻ đã đăng ký của bạn theo nhiều cách, bao gồm cả việc thanh toán thông qua', 'Làm thế nào để tôi đăng ký Thẻ Starbucks?\nBạn có thể đăng ký Thẻ Starbucks một cách dễ dàng và chỉ mất một vài phút thông qua ứng dụng di động hoặc tại website https://card.starbucks.vn. Ngoài các thông tin cá nhân cần thiết, bạn vui lòng điền số thẻ gồm 16 chữ số ở mặt trước và Mã Bảo Mật (CSC) là một số gồm 8 chữ số nằm dưới lớp tráng bạc ở mặt sau của thẻ để hoàn tất việc đăng ký Thẻ Starbucks của mình.', 'đối với tất cả chi tiêu tại cửa hàng. Bạn cũng có thể bảo vệ số dư của Thẻ Starbucks đã đăng ký trong trường hợp thẻ bị mất, bị đánh cắp hoặc bị phá hủy.']",Vui lòng tham khảo Chính Sách Quyền Riêng Tư của chúng tôi để biết thêm chi tiết.
Liệu những thông tin cá nhân của tôi có bị cung cấp cho những công ty khác không?,"Vâng, những thông tin cá nhân của bạn có thể được chia sẻ với các mục đích và trong phạm vi như được quy định trong Chính Sách Quyền Riêng Tư của Starbucks. Vui lòng tham khảo Chính Sách Quyền Riêng Tư của chúng tôi để biết thêm chi tiết.","['Liệu những thông tin cá nhân của tôi có bị cung cấp cho những công ty khác không?\nNhững thông tin do bạn cung cấp chỉ được dùng để chúng tôi liên lạc với bạn và chúng tôi có thể chia sẻ thông tin cá nhân của bạn cho các mục đích và trong phạm vi như được quy định trong Chính Sách Quyền Riêng Tư của chúng tôi. Vui lòng tham khảo Chính Sách Quyền Riêng Tư của chúng tôi để biết thêm chi tiết.', 'thông tin cá nhân của bạn bởi các các công ty khác đó, mà bạn phải tự chịu trách nhiệm đối với việc truy cập của bạn theo các đường dẫn đó.', 'Tôi có thể chuyển nhượng tư cách thành viên chương trình Starbucks Rewards™ cho người khác được không?\nRất tiếc, tư cách thành viên không được phép chuyển nhượng cũng như không thể chia sẻ với các thành viên gia đình hoặc bạn bè.\nBằng cách nào Starbucks có thể bảo mật những thông tin cá nhân của tôi sau khi tôi đăng ký Thẻ Starbucks của tôi?\nVui lòng tham khảo Chính Sách Quyền Riêng Tư của chúng tôi để biết thêm chi tiết.\nLiệu những thông tin cá nhân của tôi có bị cung cấp cho những công ty khác không?']",Những thông tin do bạn cung cấp chỉ được dùng để chúng tôi liên lạc với bạn và chúng tôi có thể chia sẻ thông tin cá nhân của bạn cho các mục đích và trong phạm vi như được quy định trong Chính Sách Quyền Riêng Tư của chúng tôi. Vui lòng tham khảo Chính Sách Quyền Riêng Tư của chúng tôi để biết thêm chi tiết.
Có phải tất cả những Thẻ Starbucks đều đáp ứng điều kiện để nhận được các lợi ích từ chương trình Starbucks Rewards™ này?,Tất cả những Thẻ Starbucks đã đăng ký đều đủ điều kiện để nhận các lợi ích từ chương trình.,"['Có phải tất cả những Thẻ Starbucks đều đáp ứng điều kiện để nhận được các lợi ích từ chương trình Starbucks Rewards™ này?\nTất cả những Thẻ Starbucks đã đăng ký đều đủ điều kiện để nhận các lợi ích từ chương trình. Những Thẻ được mua hoặc đăng ký ngoài phạm vi lãnh thổ Việt Nam sẽ không được chấp nhận như là hình thức phục vụ của chương trình, cũng như không thể tích lũy Điểm Ngôi Sao hoặc hưởng những lợi ích của chương trình Starbucks Rewards™.', 'Quyền Lợi của Các Hạng Thẻ của Chương trình Starbucks Rewards™', 'Phần 2: Các câu hỏi về Chương trình Starbucks Rewards™\nLàm thế nào tôi có thể tham gia Chương trình Starbucks Rewards™ bằng Thẻ Starbucks của tôi?']","Tất cả những Thẻ Starbucks đã đăng ký đều đủ điều kiện để nhận các lợi ích từ chương trình. Những Thẻ được mua hoặc đăng ký ngoài phạm vi lãnh thổ Việt Nam sẽ không được chấp nhận như là hình thức phục vụ của chương trình, cũng như không thể tích lũy Điểm Ngôi Sao hoặc hưởng những lợi ích của chương trình Starbucks Rewards™."
Tại sao tôi không thể cập nhật Ứng dụng di động lên phiên bản mới nhất trên điện thoại thông minh của mình?,"Bạn có thể gặp phải vấn đề khi cập nhật ứng dụng Di Động Starbucks lên phiên bản mới nhất trên điện thoại thông minh do hạn chế về hệ điều hành hoặc không đủ dung lượng lưu trữ. Để giải quyết vấn đề này, bạn có thể thử xóa và sau đó tải xuống phiên bản mới nhất từ cửa hàng ứng dụng App Store / Google Play Store. Ngoài ra, đảm bảo thiết bị của bạn được cập nhật với các bản vá lỗi và phần mềm mới nhất, và dịch vụ định vị được bật để truy cập tính năng Đặt hàng & Lấy hàng.","['Tại sao tôi không thể cập nhật Ứng dụng di động lên phiên bản mới nhất trên điện thoại thông minh của mình?\nNếu bạn đang sử dụng ứng dụng Di động (trên hệ điều hành iOS / Android) và bạn không thể cập nhật ứng dụng lên phiên bản mới nhất, bạn chỉ cần gỡ cài đặt ứng dụng hiện có và tải xuống phiên bản mới nhất từ cửa hàng ứng dụng App Store / Google Play Store để trải nghiệm những tính năng mới nhất của ứng dụng.', 'mà không cần xếp hàng hay trả thêm phí dịch vụ cho việc sử dụng tính năng này. Tính năng này chỉ được tích hợp vào Ứng Dụng Di Động và áp dụng cho (các) thành viên của Chương trình Starbucks Rewards™. Bạn được yêu cầu bật dịch vụ định vị trên thiết bị của mình và đảm bảo cập nhật mới nhất cho Ứng Dụng Di Động để khám phá chức năng mới này.', 'Truy cập phiên bản mới nhất của Ứng Dụng Di Động và đăng nhập vào tài khoản của bạn.\nChọn thẻ “Đặt món” từ thanh menu:Dịch vụ định vị trên thiết bị của bạn được yêu cầu bật lên để bắt đầu sử dụng tính năng này.\nChọn tính năng Order & Pick-up\nChọn cửa hàng để nhận hàng: Các món trong thực đơn cũng sẽ được cập nhật dựa trên tình trạng sẵn có sau khi cửa hàng Starbucks được chọn.']","Nếu bạn đang sử dụng ứng dụng Di động (trên hệ điều hành iOS / Android) và bạn không thể cập nhật ứng dụng lên phiên bản mới nhất, bạn chỉ cần gỡ cài đặt ứng dụng hiện có và tải xuống phiên bản mới nhất từ cửa hàng ứng dụng App Store / Google Play Store để trải nghiệm những tính năng mới nhất của ứng dụng."
Món nước nào có nhiều cafeine nhất?,Cold Brew sau đó là Flat White.,"['Món nước có nhiều cafeine nhất là Cold Brew sau đó là Flat White.\nCó ưu đãi gì khi mang bình cá nhân theo không?\nKhi mang theo bình/ly cá nhân đến mua bất kỳ đồ uống nào tại Starbucks bạn sẽ được giảm 10.000 đồng cho món nước đó.\nHiện tại Starbucks có chương trình ưu đãi gì cho thẻ tín dụng không?\nCó, nếu bạn sử dụng thẻ VISA Contactless (VISA thanh toán chạm) của bất cứ ngân hàng nào thì khi bạn mua đồ uống bất kỳ sẽ được upsize miễn phí cho món nước đó.', 'Các lựa chọn topping:\nBột matcha (thêm 10.000 nghìn đồng)\nChocolate viên (thêm 10.000 nghìn đồng)\nTrong trường hợp món nước của bạn đã có các topping nêu trên thì tùy chỉnh thêm các topping đó sẽ không tính phí.\nCác câu hỏi thường gặp khi đặt món tại Starbucks:\nMón nước nào có nhiều cafeine nhất?\nMón nước có nhiều cafeine nhất là Cold Brew sau đó là Flat White.\nCó ưu đãi gì khi mang bình cá nhân theo không?', 'Các món nước liên quan tới trà xanh tại Starbucks là gì?\nStarbucks phục vụ các món nước có nguyên liệu trà xanh từ: Pure Matcha Latte, Pure Matcha Espresso Fusion, Green Tea Cream \nCác món nước liên quan tới chocolate tại Starbucks là gì?\nStarbucks phục vụ các món nước có nguyên liệu chocolate từ: Signature Chocolate, Mocha, Java Chip Frappuccino, Chocolate Chip Cream Frappuccino.\nMón cà phê đậm đặc nhất tại Starbucks là gì?']",Món nước có nhiều cafeine nhất là Cold Brew sau đó là Flat White.
Có ưu đãi gì khi mang bình cá nhân theo không?,Có ưu đãi khi mang bình cá nhân theo. Bạn sẽ được giảm 10.000 đồng cho món nước đó.,"['Món nước có nhiều cafeine nhất là Cold Brew sau đó là Flat White.\nCó ưu đãi gì khi mang bình cá nhân theo không?\nKhi mang theo bình/ly cá nhân đến mua bất kỳ đồ uống nào tại Starbucks bạn sẽ được giảm 10.000 đồng cho món nước đó.\nHiện tại Starbucks có chương trình ưu đãi gì cho thẻ tín dụng không?\nCó, nếu bạn sử dụng thẻ VISA Contactless (VISA thanh toán chạm) của bất cứ ngân hàng nào thì khi bạn mua đồ uống bất kỳ sẽ được upsize miễn phí cho món nước đó.', 'Các lựa chọn topping:\nBột matcha (thêm 10.000 nghìn đồng)\nChocolate viên (thêm 10.000 nghìn đồng)\nTrong trường hợp món nước của bạn đã có các topping nêu trên thì tùy chỉnh thêm các topping đó sẽ không tính phí.\nCác câu hỏi thường gặp khi đặt món tại Starbucks:\nMón nước nào có nhiều cafeine nhất?\nMón nước có nhiều cafeine nhất là Cold Brew sau đó là Flat White.\nCó ưu đãi gì khi mang bình cá nhân theo không?', 'Ưu Đãi Mua-Một-Tặng-Một (“Ưu Đãi BOGO”). Bạn sẽ nhận được một (1) ưu đãi Mua-Một-Tặng-Một khi mua suất đồ uống pha chế cỡ vừa (tall) hoặc cỡ lớn hơn, như mô tả dưới đây:']",Khi mang theo bình/ly cá nhân đến mua bất kỳ đồ uống nào tại Starbucks bạn sẽ được giảm 10.000 đồng cho món nước đó.
Hiện tại Starbucks có chương trình ưu đãi gì cho thẻ tín dụng không?,"Có, nếu bạn sử dụng thẻ VISA Contactless (VISA thanh toán chạm) của bất cứ ngân hàng nào thì khi bạn mua đồ uống bất kỳ sẽ được upsize miễn phí cho món nước đó.","['Món nước có nhiều cafeine nhất là Cold Brew sau đó là Flat White.\nCó ưu đãi gì khi mang bình cá nhân theo không?\nKhi mang theo bình/ly cá nhân đến mua bất kỳ đồ uống nào tại Starbucks bạn sẽ được giảm 10.000 đồng cho món nước đó.\nHiện tại Starbucks có chương trình ưu đãi gì cho thẻ tín dụng không?\nCó, nếu bạn sử dụng thẻ VISA Contactless (VISA thanh toán chạm) của bất cứ ngân hàng nào thì khi bạn mua đồ uống bất kỳ sẽ được upsize miễn phí cho món nước đó.', 'Chương trình Starbucks Rewards™ hoạt động như thế nào?', 'Quyền Lợi của Các Hạng Thẻ của Chương trình Starbucks Rewards™']","Có, nếu bạn sử dụng thẻ VISA Contactless (VISA thanh toán chạm) của bất cứ ngân hàng nào thì khi bạn mua đồ uống bất kỳ sẽ được upsize miễn phí cho món nước đó."
Có thể yêu cầu ít sữa hoặc không sữa trong đồ uống không?,"Có, bạn có thể yêu cầu giảm lượng sữa trong đồ uống của mình nếu bạn có nhu cầu.","['Có thể yêu cầu ít sữa hoặc không sữa trong đồ uống không?\nCó, bạn có thể yêu cầu các bạn nhân viên giảm lượng sữa trong đồ uống của mình nếu bạn có nhu cầu.\nCó thể yêu cầu ít nước hoặc không nước trong đồ uống không?\nCó, bạn có thể yêu cầu giảm nước hoặc không nước các món có nước trong công thức. Ví dụ: Bạn có thể yêu cầu Americano không nước để thành một ly cà phê đen đá.  \nTôi có thể yêu cầu giảm độ mạnh của cà phê không?', 'Thêm giảm cà phê:\nBạn có thể yêu cầu thêm một hoặc nhiều shot espresso hoặc decaf espresso với giá 15.000 đồng/shot    \nThay đổi loại sữa:\nStarbucks cung cấp 6 loại sữa mà bạn có thể tùy chỉnh cho món nước của mình, bao gồm: Sữa tươi nguyên chất, Sữa half & half, Sữa ít béo, Sữa đậu nành, Sữa hạnh nhân, Sữa yến mạch. \nĐối với sữa hạnh nhân và sữa yến mạch thì bạn cần phải trả thêm 5.000 đồng khi thay đổi các loại sữa này cho món nước của mình.\nĐiều chỉnh độ ngọt:', 'Có thể yêu cầu Cappuccino nhiều bọt sữa hơn không?\nCó, bạn có thể yêu cầu các bạn nhân viên đánh thêm bọt vào ly Cappuccino của mình.\nStarbucks có phục vụ đồ uống theo kiểu siêu ngọt không?\nCó, bạn có thể tùy chỉnh thêm đường hầu hết tất cả các món nước mà không tính phí, hãy tìm độ ngọt phù hợp cho mình nhé.\nCác loại topping mà tôi có thể thêm vào món nước của mình là gì?']","Có, bạn có thể yêu cầu các bạn nhân viên giảm lượng sữa trong đồ uống của mình nếu bạn có nhu cầu."
Có thể yêu cầu ít nước hoặc không nước trong đồ uống không?,"Có, bạn có thể yêu cầu giảm nước hoặc không nước các món có nước trong công thức. Ví dụ: Bạn có thể yêu cầu Americano không nước để thành một ly cà phê đen đá.","['Có thể yêu cầu ít sữa hoặc không sữa trong đồ uống không?\nCó, bạn có thể yêu cầu các bạn nhân viên giảm lượng sữa trong đồ uống của mình nếu bạn có nhu cầu.\nCó thể yêu cầu ít nước hoặc không nước trong đồ uống không?\nCó, bạn có thể yêu cầu giảm nước hoặc không nước các món có nước trong công thức. Ví dụ: Bạn có thể yêu cầu Americano không nước để thành một ly cà phê đen đá.  \nTôi có thể yêu cầu giảm độ mạnh của cà phê không?', 'Tôi có thể yêu cầu giảm độ mạnh của cà phê không?\nCó, bạn có thể yêu cầu các bạn nhân viên giảm số lượng shot espresso hoặc chuyển thành hạt decaf để giảm độ mạnh của cà phê.\nStarbucks có phục vụ đồ uống theo kiểu cà phê đen không?\nCó, bạn sẽ cần yêu cần một ly Americano không nước để có được một ly cà phê đen theo kiểu Việt Nam.\nCó thể yêu cầu đồ uống không có caffeine hoàn toàn không?\nBạn có thể yêu cần chuyển sang hạt decaf để món nước của bạn không có cafeine.', 'Hầu hết tất cả đồ ăn và thức uống Starbucks yêu thích của bạn đều được cung cấp thông qua tính năng O&PU ngoại trừ đồ uống có cồn, nước đóng chai/lon sẵn, hàng hóa lưu niệm, cà phê hạt. Thực đơn cho lựa chọn của bạn sẽ liệt kê tất cả các đồ ăn và thức uống có thể cung cấp với cùng một mức giá tại cửa hàng Starbucks được chọn. Với một vài thao tác trên thiết bị của bạn, bạn có thể tùy chỉnh đồ uống yêu thích của bạn và lựa chọn để được phục vụ đồ ăn được làm nóng, như thể bạn có thể yêu cầu tại cửa hàng.']","Có, bạn có thể yêu cầu giảm nước hoặc không nước các món có nước trong công thức. Ví dụ: Bạn có thể yêu cầu Americano không nước để thành một ly cà phê đen đá.  "
Tôi có thể yêu cầu giảm độ mạnh của cà phê không?,"Có, bạn có thể yêu cầu các bạn nhân viên giảm số lượng shot espresso hoặc chuyển thành hạt decaf để giảm độ mạnh của cà phê.","['Tôi có thể yêu cầu giảm độ mạnh của cà phê không?\nCó, bạn có thể yêu cầu các bạn nhân viên giảm số lượng shot espresso hoặc chuyển thành hạt decaf để giảm độ mạnh của cà phê.\nStarbucks có phục vụ đồ uống theo kiểu cà phê đen không?\nCó, bạn sẽ cần yêu cần một ly Americano không nước để có được một ly cà phê đen theo kiểu Việt Nam.\nCó thể yêu cầu đồ uống không có caffeine hoàn toàn không?\nBạn có thể yêu cần chuyển sang hạt decaf để món nước của bạn không có cafeine.', 'Tall (dung tích 12oz hay 354ml)\nGrande (dung tích 16oz hay 473ml) \nVenti (dung tích 20oz hay 591ml) \nTuy nhiên kích cỡ Short chỉ dành cho các món nước nóng\nĐiều chỉnh mức độ cafeine:\nNếu bạn có nhu cầu giảm lượng cafeine nhưng vẫn muốn thưởng thức hương vị cà phê thì bạn có thể yêu cầu các bạn nhân viên thay đổi thành hạt cà phê decaf (là loại cà phê không cafeine) cho món nước của mình.\nThêm giảm cà phê:\nBạn có thể yêu cầu thêm một hoặc nhiều shot espresso hoặc decaf espresso với giá 15.000 đồng/shot', 'Thêm giảm cà phê:\nBạn có thể yêu cầu thêm một hoặc nhiều shot espresso hoặc decaf espresso với giá 15.000 đồng/shot    \nThay đổi loại sữa:\nStarbucks cung cấp 6 loại sữa mà bạn có thể tùy chỉnh cho món nước của mình, bao gồm: Sữa tươi nguyên chất, Sữa half & half, Sữa ít béo, Sữa đậu nành, Sữa hạnh nhân, Sữa yến mạch. \nĐối với sữa hạnh nhân và sữa yến mạch thì bạn cần phải trả thêm 5.000 đồng khi thay đổi các loại sữa này cho món nước của mình.\nĐiều chỉnh độ ngọt:']","Có, bạn có thể yêu cầu các bạn nhân viên giảm số lượng shot espresso hoặc chuyển thành hạt decaf để giảm độ mạnh của cà phê."
Starbucks có phục vụ đồ uống theo kiểu cà phê đen không?,"Có, bạn sẽ cần yêu cần một ly Americano không nước để có được một ly cà phê đen theo kiểu Việt Nam.","['Starbucks có cà phê sữa đá không?\nCó, cà phê sữa đá Việt Nam tại Starbucks là món Dolce Espresso.\nStarbucks có cà phê đen đá không?\nCó, bạn có thể yêu cầu món Americano không nước để thành một ly cà phê đen đá theo kiểu Việt Nam.  \nStarbucks có cà phê muối không?\nCó, cà phê muối Việt Nam tại Starbucks là món Salted Caramel Cold Foam Dolce Espresso.\nStarbucks có trà trái cây không?', 'Tôi có thể yêu cầu giảm độ mạnh của cà phê không?\nCó, bạn có thể yêu cầu các bạn nhân viên giảm số lượng shot espresso hoặc chuyển thành hạt decaf để giảm độ mạnh của cà phê.\nStarbucks có phục vụ đồ uống theo kiểu cà phê đen không?\nCó, bạn sẽ cần yêu cần một ly Americano không nước để có được một ly cà phê đen theo kiểu Việt Nam.\nCó thể yêu cầu đồ uống không có caffeine hoàn toàn không?\nBạn có thể yêu cần chuyển sang hạt decaf để món nước của bạn không có cafeine.', 'Earl Grey: Trà túi lọc Earl Grey tại Starbucks là trà đen hảo hạng, pha với hương tinh dầu cam bergamot, tạo nên vị trà đậm đà, thơm mát và thanh lịch, rất thích hợp để thư giãn và thưởng thức. Món nước này có thể được tùy chỉnh nóng hoặc lạnh.\nEnglish Breakfast: Trà túi lọc English Breakfast tại Starbucks là loại trà đen truyền thống, có hương vị đậm đà và mạnh mẽ, lý tưởng để thưởng thức vào buổi sáng hoặc kết hợp với sữa để thêm phần béo ngậy. Món nước này có thể được tùy chỉnh nóng hoặc lạnh.']","Có, bạn sẽ cần yêu cần một ly Americano không nước để có được một ly cà phê đen theo kiểu Việt Nam."
Có thể yêu cầu đồ uống không có caffeine hoàn toàn không?,"Có, bạn sẽ cần yêu cần chuyển sang hạt decaf để món nước của bạn không có cafeine.","['Tôi có thể yêu cầu giảm độ mạnh của cà phê không?\nCó, bạn có thể yêu cầu các bạn nhân viên giảm số lượng shot espresso hoặc chuyển thành hạt decaf để giảm độ mạnh của cà phê.\nStarbucks có phục vụ đồ uống theo kiểu cà phê đen không?\nCó, bạn sẽ cần yêu cần một ly Americano không nước để có được một ly cà phê đen theo kiểu Việt Nam.\nCó thể yêu cầu đồ uống không có caffeine hoàn toàn không?\nBạn có thể yêu cần chuyển sang hạt decaf để món nước của bạn không có cafeine.', 'Hầu hết tất cả đồ ăn và thức uống Starbucks yêu thích của bạn đều được cung cấp thông qua tính năng O&PU ngoại trừ đồ uống có cồn, nước đóng chai/lon sẵn, hàng hóa lưu niệm, cà phê hạt. Thực đơn cho lựa chọn của bạn sẽ liệt kê tất cả các đồ ăn và thức uống có thể cung cấp với cùng một mức giá tại cửa hàng Starbucks được chọn. Với một vài thao tác trên thiết bị của bạn, bạn có thể tùy chỉnh đồ uống yêu thích của bạn và lựa chọn để được phục vụ đồ ăn được làm nóng, như thể bạn có thể yêu cầu tại cửa hàng.', 'Hầu hết tất cả đồ ăn và thức uống Starbucks yêu thích của bạn đều được cung cấp thông qua tính năng SBD ngoại trừ đồ uống có cồn, nước đóng chai/lon sẵn, hàng hóa lưu niệm, cà phê hạt. Thực đơn cho lựa chọn của bạn sẽ liệt kê tất cả các đồ ăn và thức uống có thể cung cấp với cùng một mức giá tại cửa hàng Starbucks được chọn. Với một vài thao tác trên thiết bị của bạn, bạn có thể tùy chỉnh đồ uống yêu thích của bạn và lựa chọn để được phục vụ đồ ăn được làm nóng, như thể bạn có thể yêu cầu tại cửa hàng. Xin']",Bạn có thể yêu cần chuyển sang hạt decaf để món nước của bạn không có cafeine.
Có thể yêu cầu cắt giảm đá hoặc thêm đá không?,"Có, bạn có thể yêu cầu các bạn nhân viên thêm hoặc bớt đá trong đồ uống của mình theo sở thích cá nhân.","['Các tùy chỉnh đối với món nước lạnh:\nThêm đá\nÍt đá\nKhông đá\nCác tùy chỉnh đối với món nước nóng:\nThêm nóng\nÍt nóng\nTùy chỉnh Whipped cream và topping:\nThêm/giảm whipped cream: \nĐối với các món có sẵn whipped cream trong công thức thì tùy chỉnh thêm whipped cream sẽ không tính phí.\nĐối với các món không có sẵn whipped cream thì tùy chỉnh thêm whipped cream sẽ cần phải trả thêm 10.000 đồng. \nCác lựa chọn topping:\nBột matcha (thêm 10.000 nghìn đồng)\nChocolate viên (thêm 10.000 nghìn đồng)', 'Có thể yêu cầu ít sữa hoặc không sữa trong đồ uống không?\nCó, bạn có thể yêu cầu các bạn nhân viên giảm lượng sữa trong đồ uống của mình nếu bạn có nhu cầu.\nCó thể yêu cầu ít nước hoặc không nước trong đồ uống không?\nCó, bạn có thể yêu cầu giảm nước hoặc không nước các món có nước trong công thức. Ví dụ: Bạn có thể yêu cầu Americano không nước để thành một ly cà phê đen đá.  \nTôi có thể yêu cầu giảm độ mạnh của cà phê không?', 'Tôi có thể yêu cầu giảm độ mạnh của cà phê không?\nCó, bạn có thể yêu cầu các bạn nhân viên giảm số lượng shot espresso hoặc chuyển thành hạt decaf để giảm độ mạnh của cà phê.\nStarbucks có phục vụ đồ uống theo kiểu cà phê đen không?\nCó, bạn sẽ cần yêu cần một ly Americano không nước để có được một ly cà phê đen theo kiểu Việt Nam.\nCó thể yêu cầu đồ uống không có caffeine hoàn toàn không?\nBạn có thể yêu cần chuyển sang hạt decaf để món nước của bạn không có cafeine.']","Có, bạn có thể yêu cầu các bạn nhân viên thêm, giảm, hoặc không bỏ đá vào món nước của mình."
Một sao điểm thưởng là bao nhiêu tiền?,Một sao điểm thưởng có giá trị 40.000 đồng cho thanh toán 100% bằng thẻ Starbucks tại cửa hàng và 80.000 đồng cho các đơn hàng hoàn thành trên ứng dụng Grab.,"['Bạn có thể yêu cần chuyển sang hạt decaf để món nước của bạn không có cafeine.\nCó thể yêu cầu cắt giảm đá hoặc thêm đá không?\nCó, bạn có thể yêu cầu các bạn nhân viên thêm, giảm, hoặc không bỏ đá vào món nước của mình.\nMột sao điểm thưởng là bao nhiêu tiền?\nĐối với trường hợp thanh toán 100% bằng thẻ Starbucks tại cửa hàng thì mỗi sao điểm thưởng sẽ có giá trị là 40.000 đồng. Còn đối với trường hợp đặt hàng qua các ứng dụng như Grab, Shoppe Food thì một sao điểm thưởng sẽ tương ứng với 80.000 đồng.', 'khoản Starbucks Rewards™ của bạn. Bạn cũng có thể tích lũy Điểm Ngôi Sao với các đơn hàng hoàn thành trên ứng dụng Grab. Với mỗi giá trị 40.000 đồng chi trả hoàn toàn bằng Thẻ Starbucks đã đăng ký, bạn sẽ tích lũy được một (1) Điểm Ngôi Sao vào tài khoản Starbucks Rewards™ của mình. Với mỗi giá trị 80.000 đồng chi trả khi hoàn thành đơn hàng đặt tại cửa hàng Starbucks trên ứng dụng Grab (sau khi đã trừ đi các khoản ưu đãi, giảm giá và không bao gồm phí giao hàng, phí cố định hay các mức phí khác do Grab', 'định), bạn sẽ tích lũy được một Điểm Ngôi Sao. Lưu ý rằng Điểm Ngôi Sao chỉ có thể tích lũy bằng việc mua hàng tại cửa hàng và không bao gồm việc nạp tiền vào (các) Thẻ Starbucks.']","Đối với trường hợp thanh toán 100% bằng thẻ Starbucks tại cửa hàng thì mỗi sao điểm thưởng sẽ có giá trị là 40.000 đồng. Còn đối với trường hợp đặt hàng qua các ứng dụng như Grab, Shoppe Food thì một sao điểm thưởng sẽ tương ứng với 80.000 đồng."
Có thể yêu cầu Cappuccino nhiều bọt sữa hơn không?,"Có, bạn có thể yêu cầu các bạn nhân viên đánh thêm bọt vào ly Cappuccino của mình.","['Có thể yêu cầu Cappuccino nhiều bọt sữa hơn không?\nCó, bạn có thể yêu cầu các bạn nhân viên đánh thêm bọt vào ly Cappuccino của mình.\nStarbucks có phục vụ đồ uống theo kiểu siêu ngọt không?\nCó, bạn có thể tùy chỉnh thêm đường hầu hết tất cả các món nước mà không tính phí, hãy tìm độ ngọt phù hợp cho mình nhé.\nCác loại topping mà tôi có thể thêm vào món nước của mình là gì?', 'Cappuccino: Caffe Cappuccino là sự kết hợp cân bằng giữa espresso, sữa tươi và một lớp bọt sữa dày ở trên, tạo nên hương vị đậm đà với kết câu mịn màng, bông xốp. Đây là lựa chọn lý tưởng cho những ai thích cà phê mạnh cùng cảm giác béo ngậy của bọt sữa. Món nước có thể được tùy chọn nóng hoặc lạnh.', 'Và hạt cà phê espresso của chúng tôi luôn được tìm nguồn cung ứng một cách có đạo đức và 100% được chứng nhận của Fairtrade. Vì vậy, chúng không chỉ có vị ngon – mà bản chất thực sự ngon.\n\nTuy nhiên, hạt cà phê espresso mới chỉ là sự bắt đầu. Một cốc cà phê espresso ngon cần có sữa ngon. Cần có kỹ năng và thời gian để đun sôi sữa thành bọt bong bóng nhỏ màu sẫm. Đây là bọt siêu nhỏ có vị ngọt nhất và nhiều kem nhất.']","Có, bạn có thể yêu cầu các bạn nhân viên đánh thêm bọt vào ly Cappuccino của mình."
Starbucks có phục vụ đồ uống theo kiểu siêu ngọt không?,"Có, bạn có thể tùy chỉnh thêm đường hầu hết tất cả các món nước mà không tính phí, hãy tìm độ ngọt phù hợp cho mình nhé.","['Có thể yêu cầu Cappuccino nhiều bọt sữa hơn không?\nCó, bạn có thể yêu cầu các bạn nhân viên đánh thêm bọt vào ly Cappuccino của mình.\nStarbucks có phục vụ đồ uống theo kiểu siêu ngọt không?\nCó, bạn có thể tùy chỉnh thêm đường hầu hết tất cả các món nước mà không tính phí, hãy tìm độ ngọt phù hợp cho mình nhé.\nCác loại topping mà tôi có thể thêm vào món nước của mình là gì?', 'Vanilla Sweet Cream Cold Brew: Vanilla Sweet Cream Cold Brew là cà phê cold brew đậm đà kết hợp với syrup vanilla và lớp kem ngọt mịn ở trên. Món này mang đến hương vị cà phê mát lạnh, ngọt dịu và béo nhẹ, hoàn hảo cho những ai thích cà phê vừa đậm vừa êm dịu. Món nước này chỉ có thể được tùy chỉnh lạnh.\nCác món trà túi lọc:\nStarbucks cung cấp 7 loại trà túi lọc cho bạn lựa chọn:', 'Starbucks có cà phê sữa đá không?\nCó, cà phê sữa đá Việt Nam tại Starbucks là món Dolce Espresso.\nStarbucks có cà phê đen đá không?\nCó, bạn có thể yêu cầu món Americano không nước để thành một ly cà phê đen đá theo kiểu Việt Nam.  \nStarbucks có cà phê muối không?\nCó, cà phê muối Việt Nam tại Starbucks là món Salted Caramel Cold Foam Dolce Espresso.\nStarbucks có trà trái cây không?']","Có, bạn có thể tùy chỉnh thêm đường hầu hết tất cả các món nước mà không tính phí, hãy tìm độ ngọt phù hợp cho mình nhé."
Các loại topping mà tôi có thể thêm vào món nước của mình là gì?,"Bột chocolate, bột quế, sốt caramel, sốt Mocha, bột matcha, và chocolate hạt. Trong đó sốt caramel, sốt mocha, bột matcha và chocolate hạt bạn sẽ phải thanh toán thêm 10.000 đồng để thêm vào món nước của mình.","['Các loại topping mà tôi có thể thêm vào món nước của mình là gì?\nCác loại topping mà Starbucks cung cấp hiện tại là bột chocolate, bột quế, sốt caramel, sốt Mocha, bột matcha, chocolate hạt. Trong đó sốt caramel, sốt mocha, bột matcha và chocolate hạt bạn sẽ phải thanh toán thêm 10.000 đồng để thêm vào món nước của mình.\nStarbucks sử dụng loại hạt nào cho các ly cà phê của họ?', 'Các lựa chọn topping:\nBột matcha (thêm 10.000 nghìn đồng)\nChocolate viên (thêm 10.000 nghìn đồng)\nTrong trường hợp món nước của bạn đã có các topping nêu trên thì tùy chỉnh thêm các topping đó sẽ không tính phí.\nCác câu hỏi thường gặp khi đặt món tại Starbucks:\nMón nước nào có nhiều cafeine nhất?\nMón nước có nhiều cafeine nhất là Cold Brew sau đó là Flat White.\nCó ưu đãi gì khi mang bình cá nhân theo không?', 'Có thể yêu cầu Cappuccino nhiều bọt sữa hơn không?\nCó, bạn có thể yêu cầu các bạn nhân viên đánh thêm bọt vào ly Cappuccino của mình.\nStarbucks có phục vụ đồ uống theo kiểu siêu ngọt không?\nCó, bạn có thể tùy chỉnh thêm đường hầu hết tất cả các món nước mà không tính phí, hãy tìm độ ngọt phù hợp cho mình nhé.\nCác loại topping mà tôi có thể thêm vào món nước của mình là gì?']","Các loại topping mà Starbucks cung cấp hiện tại là bột chocolate, bột quế, sốt caramel, sốt Mocha, bột matcha, chocolate hạt. Trong đó sốt caramel, sốt mocha, bột matcha và chocolate hạt bạn sẽ phải thanh toán thêm 10.000 đồng để thêm vào món nước của mình."
Starbucks sử dụng loại hạt nào cho các ly cà phê của họ?,Starbucks sử dụng loại hạt Espresso Roast cho các ly cà phê mà họ làm ra hằng ngày.,"['Starbucks sử dụng loại hạt nào cho các ly cà phê của họ?\nCác cửa hàng Starbucks đều sử dụng loại hạt Espresso Roast cho các ly cà phê mà họ làm ra hằng ngày. Starbucks còn cung cấp các loại hạt Espresso Choice nếu bạn có nhu cầu đổi hạt cà phê cho món nước của mình.\nStarbucks có cà phê bạc xỉu không?\nCó, món Asian Dolce Latte là món nước tương tư với cà phê bạc xỉu Việt Nam nhưng với một lớp kem tươi ở trên.\nStarbucks có cà phê sữa đá không?\nCó, cà phê sữa đá Việt Nam tại Starbucks là món Dolce Espresso.', 'Christmas Blend Espresso Roast\nStarbucks Christmas Blend Espresso Roast là sự kết hợp của hai loại hạt cà phê rất đặc trưng của Starbucks: Starbucks Christmas Blend và Starbucks Espresso Roast. Loại hạt cà phê nàybao gồm hạt cà phê có xuất xứ từ vùng Sumatra, kết hợp với hạt cà phê từ vùng Latin America và được rang một cách hoàn hảo đem lại hương vị không thể quên.', 'Hạt cà phê Anniversary của Starbucks rất đặc trưng. Đây là hạt cà phê rất đậm đà mà chúng tôi rất tự tin nói là hạt cà phê này càng ngày càng ngon. Bí mật của hạt cà phê này là gì? Chúng bao gồm các hạt cà phê được trồng rất nhiều năm ở Indonesia. Bạn thấy đấy, các hạt cà phê lâu năm có được các đặc điểm rất độc đáo. Cách rang riêng của chúng tôi đem lại chất lượng nổi bật cho hạt. Và kết quả là một tách cà phê rất mượt mà với một chút vị của các gia vị, vị nếm cũng rất đậm đặc. Chúng tôi tạo ra hạt cà phê']",Các cửa hàng Starbucks đều sử dụng loại hạt Espresso Roast cho các ly cà phê mà họ làm ra hằng ngày. Starbucks còn cung cấp các loại hạt Espresso Choice nếu bạn có nhu cầu đổi hạt cà phê cho món nước của mình.
Starbucks có cà phê bạc xỉu không?,"Có, cà phê bạc xỉu Việt Nam tại Starbucks là món Asian Dolce Latte với một lớp kem tươi ở trên.","['Starbucks sử dụng loại hạt nào cho các ly cà phê của họ?\nCác cửa hàng Starbucks đều sử dụng loại hạt Espresso Roast cho các ly cà phê mà họ làm ra hằng ngày. Starbucks còn cung cấp các loại hạt Espresso Choice nếu bạn có nhu cầu đổi hạt cà phê cho món nước của mình.\nStarbucks có cà phê bạc xỉu không?\nCó, món Asian Dolce Latte là món nước tương tư với cà phê bạc xỉu Việt Nam nhưng với một lớp kem tươi ở trên.\nStarbucks có cà phê sữa đá không?\nCó, cà phê sữa đá Việt Nam tại Starbucks là món Dolce Espresso.', 'Có, cà phê muối Việt Nam tại Starbucks là món Salted Caramel Cold Foam Dolce Espresso.\nStarbucks có trà trái cây không?\nCó, Starbucks cung cấp 3 loại trà trái cây: Trà bưởi (Ruby Grapefruits And Honey Black Tea), Trà dâu (Strawberry Green Tea With Lemonade), Trà lựu (Iced Pomagranate Pearls Hibiscus) \nStarbucks có sinh tố không?', 'Starbucks có cà phê sữa đá không?\nCó, cà phê sữa đá Việt Nam tại Starbucks là món Dolce Espresso.\nStarbucks có cà phê đen đá không?\nCó, bạn có thể yêu cầu món Americano không nước để thành một ly cà phê đen đá theo kiểu Việt Nam.  \nStarbucks có cà phê muối không?\nCó, cà phê muối Việt Nam tại Starbucks là món Salted Caramel Cold Foam Dolce Espresso.\nStarbucks có trà trái cây không?']","Có, món Asian Dolce Latte là món nước tương tư với cà phê bạc xỉu Việt Nam nhưng với một lớp kem tươi ở trên."
Starbucks có cà phê sữa đá không?,"Có, cà phê sữa đá Việt Nam tại Starbucks là món Dolce Espresso.","['Starbucks có cà phê sữa đá không?\nCó, cà phê sữa đá Việt Nam tại Starbucks là món Dolce Espresso.\nStarbucks có cà phê đen đá không?\nCó, bạn có thể yêu cầu món Americano không nước để thành một ly cà phê đen đá theo kiểu Việt Nam.  \nStarbucks có cà phê muối không?\nCó, cà phê muối Việt Nam tại Starbucks là món Salted Caramel Cold Foam Dolce Espresso.\nStarbucks có trà trái cây không?', 'Starbucks sử dụng loại hạt nào cho các ly cà phê của họ?\nCác cửa hàng Starbucks đều sử dụng loại hạt Espresso Roast cho các ly cà phê mà họ làm ra hằng ngày. Starbucks còn cung cấp các loại hạt Espresso Choice nếu bạn có nhu cầu đổi hạt cà phê cho món nước của mình.\nStarbucks có cà phê bạc xỉu không?\nCó, món Asian Dolce Latte là món nước tương tư với cà phê bạc xỉu Việt Nam nhưng với một lớp kem tươi ở trên.\nStarbucks có cà phê sữa đá không?\nCó, cà phê sữa đá Việt Nam tại Starbucks là món Dolce Espresso.', 'Các món đá xay có cà phê tại Starbucks:\nJava Chip Frappuccino: Java Chip Frappuccino tại Starbucks là món đồ uống đá xay kết hợp giữa cà phê Frappuccino Roast, chocolate chip và sữa, tạo ra một thức uống ngọt ngào, béo ngậy với hương vị cà phê và chocolate đậm đà, hoàn hảo cho những ai yêu thích sự kết hợp này.']","Có, cà phê sữa đá Việt Nam tại Starbucks là món Dolce Espresso."
Starbucks có cà phê đen đá không?,"Có, bạn có thể yêu cầu Americano không nước để thành một ly cà phê đen đá theo kiểu Việt Nam.","['Starbucks có cà phê sữa đá không?\nCó, cà phê sữa đá Việt Nam tại Starbucks là món Dolce Espresso.\nStarbucks có cà phê đen đá không?\nCó, bạn có thể yêu cầu món Americano không nước để thành một ly cà phê đen đá theo kiểu Việt Nam.  \nStarbucks có cà phê muối không?\nCó, cà phê muối Việt Nam tại Starbucks là món Salted Caramel Cold Foam Dolce Espresso.\nStarbucks có trà trái cây không?', 'Các món đá xay không cà phê tại Starbucks: \nCaramel Cream Frappuccino: Caramel Cream Frappuccino tại Starbucks là món đồ uống đá xay kết hợp giữa sữa và syrup caramel ngọt ngào, tạo ra một thức uống mát lạnh, béo ngậy với hương vị caramel thơm lừng, hoàn hảo cho những ai yêu thích sự ngọt ngào và sảng khoái.', 'Các món đá xay có cà phê tại Starbucks:\nJava Chip Frappuccino: Java Chip Frappuccino tại Starbucks là món đồ uống đá xay kết hợp giữa cà phê Frappuccino Roast, chocolate chip và sữa, tạo ra một thức uống ngọt ngào, béo ngậy với hương vị cà phê và chocolate đậm đà, hoàn hảo cho những ai yêu thích sự kết hợp này.']","Có, bạn có thể yêu cầu món Americano không nước để thành một ly cà phê đen đá theo kiểu Việt Nam.  "
Starbucks có cà phê muối không?,"Có, cà phê muối Việt Nam tại Starbucks là món Salted Caramel Cold Foam Dolce Espresso.","['Có, cà phê muối Việt Nam tại Starbucks là món Salted Caramel Cold Foam Dolce Espresso.\nStarbucks có trà trái cây không?\nCó, Starbucks cung cấp 3 loại trà trái cây: Trà bưởi (Ruby Grapefruits And Honey Black Tea), Trà dâu (Strawberry Green Tea With Lemonade), Trà lựu (Iced Pomagranate Pearls Hibiscus) \nStarbucks có sinh tố không?', 'Starbucks có cà phê sữa đá không?\nCó, cà phê sữa đá Việt Nam tại Starbucks là món Dolce Espresso.\nStarbucks có cà phê đen đá không?\nCó, bạn có thể yêu cầu món Americano không nước để thành một ly cà phê đen đá theo kiểu Việt Nam.  \nStarbucks có cà phê muối không?\nCó, cà phê muối Việt Nam tại Starbucks là món Salted Caramel Cold Foam Dolce Espresso.\nStarbucks có trà trái cây không?', 'Starbucks có sinh tố không?\nHiện tại Starbucks chưa phục vụ các món sinh tố, nhưng khách hàng vẫn có thể đặt 2 món trái cây đá xay: Xoài chanh dây đá xay (Mango Passion Fruit), Phúc bồn tử đá xay (Raspberry Black Currant)\nCác loại trà túi lọc không có caffeine là gì?\nCác loại trà túi lọc không caffeine mà Starbucks phục vụ có thể kể đến là: Trà Hibiscus, Trà Chamomile\nCác món nước liên quan tới trà xanh tại Starbucks là gì?']","Có, cà phê muối Việt Nam tại Starbucks là món Salted Caramel Cold Foam Dolce Espresso."
Starbucks có trà trái cây không?,"Có, Starbucks cung cấp 3 loại trà trái cây: Trà bưởi (Ruby Grapefruits And Honey Black Tea), Trà dâu (Strawberry Green Tea With Lemonade), Trà lựu (Iced Pomagranate Pearls Hibiscus).","['Có, cà phê muối Việt Nam tại Starbucks là món Salted Caramel Cold Foam Dolce Espresso.\nStarbucks có trà trái cây không?\nCó, Starbucks cung cấp 3 loại trà trái cây: Trà bưởi (Ruby Grapefruits And Honey Black Tea), Trà dâu (Strawberry Green Tea With Lemonade), Trà lựu (Iced Pomagranate Pearls Hibiscus) \nStarbucks có sinh tố không?', 'Strawberry Green Tea With Lemonade: Strawberry Green Tea with Lemonade tại Starbucks là sự kết hợp giữa trà xanh nhẹ nhàng, nước chanh tươi và dâu tây ngọt ngào, tạo ra một thức uống mát lạnh, tươi mới và sảng khoái. Món nước này chỉ có thể được tùy chỉnh lạnh.\nCác món đá xay có cà phê tại Starbucks:', 'Starbucks có sinh tố không?\nHiện tại Starbucks chưa phục vụ các món sinh tố, nhưng khách hàng vẫn có thể đặt 2 món trái cây đá xay: Xoài chanh dây đá xay (Mango Passion Fruit), Phúc bồn tử đá xay (Raspberry Black Currant)\nCác loại trà túi lọc không có caffeine là gì?\nCác loại trà túi lọc không caffeine mà Starbucks phục vụ có thể kể đến là: Trà Hibiscus, Trà Chamomile\nCác món nước liên quan tới trà xanh tại Starbucks là gì?']","Có, Starbucks cung cấp 3 loại trà trái cây: Trà bưởi (Ruby Grapefruits And Honey Black Tea), Trà dâu (Strawberry Green Tea With Lemonade), Trà lựu (Iced Pomagranate Pearls Hibiscus) "
Starbucks có sinh tố không?,Không,"['Starbucks có sinh tố không?\nHiện tại Starbucks chưa phục vụ các món sinh tố, nhưng khách hàng vẫn có thể đặt 2 món trái cây đá xay: Xoài chanh dây đá xay (Mango Passion Fruit), Phúc bồn tử đá xay (Raspberry Black Currant)\nCác loại trà túi lọc không có caffeine là gì?\nCác loại trà túi lọc không caffeine mà Starbucks phục vụ có thể kể đến là: Trà Hibiscus, Trà Chamomile\nCác món nước liên quan tới trà xanh tại Starbucks là gì?', 'Có, cà phê muối Việt Nam tại Starbucks là món Salted Caramel Cold Foam Dolce Espresso.\nStarbucks có trà trái cây không?\nCó, Starbucks cung cấp 3 loại trà trái cây: Trà bưởi (Ruby Grapefruits And Honey Black Tea), Trà dâu (Strawberry Green Tea With Lemonade), Trà lựu (Iced Pomagranate Pearls Hibiscus) \nStarbucks có sinh tố không?', 'Các shot espresso của Starbucks được chiết suất từ 18 tới 21 giây. Là tiêu chuẩn của tất cả các cửa hàng Starbucks.\nStarbucks có bao nhiêu loại sữa?\nHiện tại Starbucks cung cấp 6 loại sữa mà bạn có thể tùy chỉnh cho món nước của mình, bao gồm: Sữa tươi nguyên chất, Sữa half & half, Sữa ít béo, Sữa đậu nành, Sữa hạnh nhân, Sữa yến mạch.  \nStarbucks có bao nhiêu loại syrup?\nHiện tại Starbucks cung cấp 6 loại syrup: Vanilla syrup, Caramel syrup, Hazelnut syrup, Brown Sugar syrup, sốt Asian Dolce, sốt Mocha']","Hiện tại Starbucks chưa phục vụ các món sinh tố, nhưng khách hàng vẫn có thể đặt 2 món trái cây đá xay: Xoài chanh dây đá xay (Mango Passion Fruit), Phúc bồn tử đá xay (Raspberry Black Currant)"
Các loại trà túi lọc không có caffeine là gì?,"Trà Hibiscus, Trà Chamomile","['Hibiscus: Trà túi lọc Hibiscus tại Starbucks là loại trà thảo mộc có màu đỏ tươi, hương vị chua nhẹ và thơm mát, được làm từ hoa dâm bụt. Đây là lựa chọn sảng khoái và không chứa caffeine, hoàn hảo để giải khát. Món nước này có thể được tùy chỉnh nóng hoặc lạnh.', 'Chamomile: Trà túi lọc Chamomile tại Starbucks là loại trà thảo mộc dịu nhẹ, không có cafeine, có hương thơm hoa cúc, mang đến cảm giác thư giãn và dễ ngủ, lý tưởng cho những ai muốn thư giãn sau một ngày dài. Món nước này có thể được tùy chỉnh nóng hoặc lạnh.\nStarbucks Refreshers:', 'Starbucks có sinh tố không?\nHiện tại Starbucks chưa phục vụ các món sinh tố, nhưng khách hàng vẫn có thể đặt 2 món trái cây đá xay: Xoài chanh dây đá xay (Mango Passion Fruit), Phúc bồn tử đá xay (Raspberry Black Currant)\nCác loại trà túi lọc không có caffeine là gì?\nCác loại trà túi lọc không caffeine mà Starbucks phục vụ có thể kể đến là: Trà Hibiscus, Trà Chamomile\nCác món nước liên quan tới trà xanh tại Starbucks là gì?']","Các loại trà túi lọc không caffeine mà Starbucks phục vụ có thể kể đến là: Trà Hibiscus, Trà Chamomile"
Các món nước liên quan tới trà xanh tại Starbucks là gì?,"Pure Matcha Latte, Pure Matcha Espresso Fusion, Green Tea Cream  Frappuccino.","['Các món nước liên quan tới trà xanh tại Starbucks là gì?\nStarbucks phục vụ các món nước có nguyên liệu trà xanh từ: Pure Matcha Latte, Pure Matcha Espresso Fusion, Green Tea Cream \nCác món nước liên quan tới chocolate tại Starbucks là gì?\nStarbucks phục vụ các món nước có nguyên liệu chocolate từ: Signature Chocolate, Mocha, Java Chip Frappuccino, Chocolate Chip Cream Frappuccino.\nMón cà phê đậm đặc nhất tại Starbucks là gì?', 'Strawberry Green Tea With Lemonade: Strawberry Green Tea with Lemonade tại Starbucks là sự kết hợp giữa trà xanh nhẹ nhàng, nước chanh tươi và dâu tây ngọt ngào, tạo ra một thức uống mát lạnh, tươi mới và sảng khoái. Món nước này chỉ có thể được tùy chỉnh lạnh.\nCác món đá xay có cà phê tại Starbucks:', 'Starbucks có sinh tố không?\nHiện tại Starbucks chưa phục vụ các món sinh tố, nhưng khách hàng vẫn có thể đặt 2 món trái cây đá xay: Xoài chanh dây đá xay (Mango Passion Fruit), Phúc bồn tử đá xay (Raspberry Black Currant)\nCác loại trà túi lọc không có caffeine là gì?\nCác loại trà túi lọc không caffeine mà Starbucks phục vụ có thể kể đến là: Trà Hibiscus, Trà Chamomile\nCác món nước liên quan tới trà xanh tại Starbucks là gì?']","Starbucks phục vụ các món nước có nguyên liệu trà xanh từ: Pure Matcha Latte, Pure Matcha Espresso Fusion, Green Tea Cream "
Các món nước liên quan tới chocolate tại Starbucks là gì?,"Chocolate Chip Frappuccino, Signature Chocolate, Mocha.","['Các món nước liên quan tới trà xanh tại Starbucks là gì?\nStarbucks phục vụ các món nước có nguyên liệu trà xanh từ: Pure Matcha Latte, Pure Matcha Espresso Fusion, Green Tea Cream \nCác món nước liên quan tới chocolate tại Starbucks là gì?\nStarbucks phục vụ các món nước có nguyên liệu chocolate từ: Signature Chocolate, Mocha, Java Chip Frappuccino, Chocolate Chip Cream Frappuccino.\nMón cà phê đậm đặc nhất tại Starbucks là gì?', 'Các món khác: \nSignature Chocolate: Signature Chocolate tại Starbucks là một món đồ uống ngọt ngào, kết hợp giữa chocolate độc quyền đậm đà và kem mịn, mang đến một trải nghiệm béo ngậy, thơm lừng và hoàn hảo cho những ai yêu thích hương vị chocolate. Món nước này có thể được tùy chỉnh nóng hoặc lạnh.', 'Các loại topping mà tôi có thể thêm vào món nước của mình là gì?\nCác loại topping mà Starbucks cung cấp hiện tại là bột chocolate, bột quế, sốt caramel, sốt Mocha, bột matcha, chocolate hạt. Trong đó sốt caramel, sốt mocha, bột matcha và chocolate hạt bạn sẽ phải thanh toán thêm 10.000 đồng để thêm vào món nước của mình.\nStarbucks sử dụng loại hạt nào cho các ly cà phê của họ?']","Starbucks phục vụ các món nước có nguyên liệu chocolate từ: Signature Chocolate, Mocha, Java Chip Frappuccino, Chocolate Chip Cream Frappuccino."
Món cà phê đậm đặc nhất tại Starbucks là gì?,Cold Brew,"['Món cà phê đậm đặc nhất tại Starbucks là gì?\nHiện tại món cà phê đậm đặc nhất tại Starbucks là món Cold Brew, nếu bạn thích cà phê có sữa thì Flat White sẽ là sự lựa chọn hoàn hảo.\nGiờ hoạt động của các cửa hàng Starbucks là gì?\nHầu hết các cửa hàng Starbucks mở cửa vào 7h00 và đóng cửa vào 22h00 hằng ngày.\nLoại sữa tươi Starbucks sử dụng là gì?\nLoại sữa tươi hiện tại đang được sử dụng tại các cửa hàng Starbucks là Dalat Milk. \nLoại sữa ít béo Starbucks sử dụng là gì?', 'French Roast\nĐây là cốc cà phê tỏa khói, sản phẩm đậm đặc nhất, sẫm màu nhất của chúng tôi.\n\nĐể đánh giá hương vị thực sự của loại cà phê này, bạn phải có sở thích mạo hiểm. Thực tế thì French Roast là một loại cà phê mà mọi người dường như thích hoặc không thích. Ở đây không có sự nửa vời.', 'Các món đá xay có cà phê tại Starbucks:\nJava Chip Frappuccino: Java Chip Frappuccino tại Starbucks là món đồ uống đá xay kết hợp giữa cà phê Frappuccino Roast, chocolate chip và sữa, tạo ra một thức uống ngọt ngào, béo ngậy với hương vị cà phê và chocolate đậm đà, hoàn hảo cho những ai yêu thích sự kết hợp này.']","Hiện tại món cà phê đậm đặc nhất tại Starbucks là món Cold Brew, nếu bạn thích cà phê có sữa thì Flat White sẽ là sự lựa chọn hoàn hảo cho bạn."
Giờ hoạt động của các cửa hàng Starbucks là gì?,Hầu hết các cửa hàng Starbucks mở cửa vào 7h00 và đóng cửa vào 22h00 hằng ngày.,"['thông qua ứng dụng di động và thông báo về Thẻ Starbucks bị mất, bị đánh cắp hoặc bị phá hủy. Giờ làm việc của chúng tôi là từ 08:30 sáng – 5:00 chiều từ Thứ Hai đến Thứ Sáu, 8:30 sáng – 12:00 trưa Thứ bảy, trừ các ngày Chủ nhật và các ngày Lễ Tết.', 'Món cà phê đậm đặc nhất tại Starbucks là gì?\nHiện tại món cà phê đậm đặc nhất tại Starbucks là món Cold Brew, nếu bạn thích cà phê có sữa thì Flat White sẽ là sự lựa chọn hoàn hảo.\nGiờ hoạt động của các cửa hàng Starbucks là gì?\nHầu hết các cửa hàng Starbucks mở cửa vào 7h00 và đóng cửa vào 22h00 hằng ngày.\nLoại sữa tươi Starbucks sử dụng là gì?\nLoại sữa tươi hiện tại đang được sử dụng tại các cửa hàng Starbucks là Dalat Milk. \nLoại sữa ít béo Starbucks sử dụng là gì?', 'Nếu bạn có bất cứ thắc mắc liên quan đến Chương trình Starbucks Rewards™, xin vui lòng liên hệ tới Công ty TNHH Thực phẩm & Nước giải khát Ý Tưởng Việt, bằng cách gửi thư tới Tầng 14, Tòa nhà Phượng Long 2, 16 Nguyễn Trường Tộ, Phường 13, Quận 4, Thành phố Hồ Chí Minh hoặc thông qua Trung tâm Chăm sóc Khách hàng Starbucks Rewards™ số (028) 7306 7676. Xin lưu ý rằng, thời gian làm việc của Trung tâm Chăm sóc Khách hàng Starbucks Rewards™ là từ Thứ 2 – Thứ 6 (8h30 - 17h) và Thứ 7 (8h30 - 12h).']",Hầu hết các cửa hàng Starbucks mở cửa vào 7h00 và đóng cửa vào 22h00 hằng ngày.
Loại sữa tươi Starbucks sử dụng là gì?,Dalat Milk,"['Loại sữa tươi hiện tại đang được sử dụng tại các cửa hàng Starbucks là Dalat Milk. \nLoại sữa ít béo Starbucks sử dụng là gì?\nLoại sữa ít béo hiện tại đang được sử dụng tại các cửa hàng Starbucks là Anchor Low Fat Milk. \nLoại sữa đậu nành Starbucks sử dụng là gì?\nLoại sữa đậu nành hiện tại đang được sử dụng tại các cửa hàng Starbucks là Gold Soy. \nLoại sữa yến mạch Starbucks sử dụng là gì?\nLoại sữa yến mạch hiện tại đang được sử dụng tại các cửa hàng Starbucks là Oatly.', 'Món cà phê đậm đặc nhất tại Starbucks là gì?\nHiện tại món cà phê đậm đặc nhất tại Starbucks là món Cold Brew, nếu bạn thích cà phê có sữa thì Flat White sẽ là sự lựa chọn hoàn hảo.\nGiờ hoạt động của các cửa hàng Starbucks là gì?\nHầu hết các cửa hàng Starbucks mở cửa vào 7h00 và đóng cửa vào 22h00 hằng ngày.\nLoại sữa tươi Starbucks sử dụng là gì?\nLoại sữa tươi hiện tại đang được sử dụng tại các cửa hàng Starbucks là Dalat Milk. \nLoại sữa ít béo Starbucks sử dụng là gì?', 'Loại sữa yến mạch Starbucks sử dụng là gì?\nLoại sữa yến mạch hiện tại đang được sử dụng tại các cửa hàng Starbucks là Oatly. \nLoại sữa hạnh nhân Starbucks sử dụng là gì?\nLoại sữa hạnh nhân hiện tại đang được sử dụng tại các cửa hàng Starbucks là loại sữa được nhập khẩu độc quyền dành riêng cho Starbucks.\nCà phê Espresso của Starbucks được chiết suất trong bao lâu?\nCác shot espresso của Starbucks được chiết suất từ 18 tới 21 giây. Là tiêu chuẩn của tất cả các cửa hàng Starbucks.']",Loại sữa tươi hiện tại đang được sử dụng tại các cửa hàng Starbucks là Dalat Milk. 
Loại sữa ít béo Starbucks sử dụng là gì?,Anchor Low Fat Milk.,"['Loại sữa tươi hiện tại đang được sử dụng tại các cửa hàng Starbucks là Dalat Milk. \nLoại sữa ít béo Starbucks sử dụng là gì?\nLoại sữa ít béo hiện tại đang được sử dụng tại các cửa hàng Starbucks là Anchor Low Fat Milk. \nLoại sữa đậu nành Starbucks sử dụng là gì?\nLoại sữa đậu nành hiện tại đang được sử dụng tại các cửa hàng Starbucks là Gold Soy. \nLoại sữa yến mạch Starbucks sử dụng là gì?\nLoại sữa yến mạch hiện tại đang được sử dụng tại các cửa hàng Starbucks là Oatly.', 'Loại sữa yến mạch Starbucks sử dụng là gì?\nLoại sữa yến mạch hiện tại đang được sử dụng tại các cửa hàng Starbucks là Oatly. \nLoại sữa hạnh nhân Starbucks sử dụng là gì?\nLoại sữa hạnh nhân hiện tại đang được sử dụng tại các cửa hàng Starbucks là loại sữa được nhập khẩu độc quyền dành riêng cho Starbucks.\nCà phê Espresso của Starbucks được chiết suất trong bao lâu?\nCác shot espresso của Starbucks được chiết suất từ 18 tới 21 giây. Là tiêu chuẩn của tất cả các cửa hàng Starbucks.', 'Món cà phê đậm đặc nhất tại Starbucks là gì?\nHiện tại món cà phê đậm đặc nhất tại Starbucks là món Cold Brew, nếu bạn thích cà phê có sữa thì Flat White sẽ là sự lựa chọn hoàn hảo.\nGiờ hoạt động của các cửa hàng Starbucks là gì?\nHầu hết các cửa hàng Starbucks mở cửa vào 7h00 và đóng cửa vào 22h00 hằng ngày.\nLoại sữa tươi Starbucks sử dụng là gì?\nLoại sữa tươi hiện tại đang được sử dụng tại các cửa hàng Starbucks là Dalat Milk. \nLoại sữa ít béo Starbucks sử dụng là gì?']",Loại sữa ít béo hiện tại đang được sử dụng tại các cửa hàng Starbucks là Anchor Low Fat Milk. 
Loại sữa đậu nành Starbucks sử dụng là gì?,Loại sữa đậu nành hiện tại đang được sử dụng tại các cửa hàng Starbucks là Gold Soy.,"['Loại sữa tươi hiện tại đang được sử dụng tại các cửa hàng Starbucks là Dalat Milk. \nLoại sữa ít béo Starbucks sử dụng là gì?\nLoại sữa ít béo hiện tại đang được sử dụng tại các cửa hàng Starbucks là Anchor Low Fat Milk. \nLoại sữa đậu nành Starbucks sử dụng là gì?\nLoại sữa đậu nành hiện tại đang được sử dụng tại các cửa hàng Starbucks là Gold Soy. \nLoại sữa yến mạch Starbucks sử dụng là gì?\nLoại sữa yến mạch hiện tại đang được sử dụng tại các cửa hàng Starbucks là Oatly.', 'Loại sữa yến mạch Starbucks sử dụng là gì?\nLoại sữa yến mạch hiện tại đang được sử dụng tại các cửa hàng Starbucks là Oatly. \nLoại sữa hạnh nhân Starbucks sử dụng là gì?\nLoại sữa hạnh nhân hiện tại đang được sử dụng tại các cửa hàng Starbucks là loại sữa được nhập khẩu độc quyền dành riêng cho Starbucks.\nCà phê Espresso của Starbucks được chiết suất trong bao lâu?\nCác shot espresso của Starbucks được chiết suất từ 18 tới 21 giây. Là tiêu chuẩn của tất cả các cửa hàng Starbucks.', 'Starbucks sử dụng loại hạt nào cho các ly cà phê của họ?\nCác cửa hàng Starbucks đều sử dụng loại hạt Espresso Roast cho các ly cà phê mà họ làm ra hằng ngày. Starbucks còn cung cấp các loại hạt Espresso Choice nếu bạn có nhu cầu đổi hạt cà phê cho món nước của mình.\nStarbucks có cà phê bạc xỉu không?\nCó, món Asian Dolce Latte là món nước tương tư với cà phê bạc xỉu Việt Nam nhưng với một lớp kem tươi ở trên.\nStarbucks có cà phê sữa đá không?\nCó, cà phê sữa đá Việt Nam tại Starbucks là món Dolce Espresso.']",Loại sữa đậu nành hiện tại đang được sử dụng tại các cửa hàng Starbucks là Gold Soy. 
Loại sữa yến mạch Starbucks sử dụng là gì?,Oatly,"['Loại sữa yến mạch Starbucks sử dụng là gì?\nLoại sữa yến mạch hiện tại đang được sử dụng tại các cửa hàng Starbucks là Oatly. \nLoại sữa hạnh nhân Starbucks sử dụng là gì?\nLoại sữa hạnh nhân hiện tại đang được sử dụng tại các cửa hàng Starbucks là loại sữa được nhập khẩu độc quyền dành riêng cho Starbucks.\nCà phê Espresso của Starbucks được chiết suất trong bao lâu?\nCác shot espresso của Starbucks được chiết suất từ 18 tới 21 giây. Là tiêu chuẩn của tất cả các cửa hàng Starbucks.', 'Loại sữa tươi hiện tại đang được sử dụng tại các cửa hàng Starbucks là Dalat Milk. \nLoại sữa ít béo Starbucks sử dụng là gì?\nLoại sữa ít béo hiện tại đang được sử dụng tại các cửa hàng Starbucks là Anchor Low Fat Milk. \nLoại sữa đậu nành Starbucks sử dụng là gì?\nLoại sữa đậu nành hiện tại đang được sử dụng tại các cửa hàng Starbucks là Gold Soy. \nLoại sữa yến mạch Starbucks sử dụng là gì?\nLoại sữa yến mạch hiện tại đang được sử dụng tại các cửa hàng Starbucks là Oatly.', 'Brown Sugar Cocoa Oatmilk Cream Frappuccino: Brown Sugar Cocoa Oatmilk Cream Frappuccino tại Starbucks là món đồ uống đá xay kết hợp giữa sữa yến mạch, syrup đường nâu, bột cacao, chocolate và đá, tạo ra một thức uống ngọt ngào, béo nhẹ với hương vị đường nâu và chocolate, hoàn hảo cho những ai yêu thích sự kết hợp giữa ngọt và thơm.']",Loại sữa yến mạch hiện tại đang được sử dụng tại các cửa hàng Starbucks là Oatly. 
Loại sữa hạnh nhân Starbucks sử dụng là gì?,Loại sữa hạnh nhân Starbucks sử dụng là loại sữa được nhập khẩu độc quyền dành riêng cho Starbucks.,"['Loại sữa yến mạch Starbucks sử dụng là gì?\nLoại sữa yến mạch hiện tại đang được sử dụng tại các cửa hàng Starbucks là Oatly. \nLoại sữa hạnh nhân Starbucks sử dụng là gì?\nLoại sữa hạnh nhân hiện tại đang được sử dụng tại các cửa hàng Starbucks là loại sữa được nhập khẩu độc quyền dành riêng cho Starbucks.\nCà phê Espresso của Starbucks được chiết suất trong bao lâu?\nCác shot espresso của Starbucks được chiết suất từ 18 tới 21 giây. Là tiêu chuẩn của tất cả các cửa hàng Starbucks.', 'Almondmilk Hazelnut Cream Frappuccino: Almondmilk Hazelnut Cream Frappuccino tại Starbucks là món đồ uống đá xay kết hợp giữa sữa hạnh nhân, syrup hạt phỉ ngọt ngào và đá, tạo ra một thức uống mát lạnh, béo nhẹ với hương vị hạt phỉ thơm ngon, hoàn hảo cho những ai yêu thích sự ngọt ngào và nhẹ nhàng của hạt phỉ.', 'Almondmilk Hazelnut Frappuccino: Almondmilk Hazelnut Frappuccino tại Starbucks là món đồ uống đá xay kết hợp giữa cà phê Frappuccino Roast, sữa hạnh nhân, syrup hạt phỉ ngọt ngào và đá, tạo ra một thức uống mát lạnh, béo nhẹ với hương vị hạt phỉ đặc trưng, hoàn hảo cho những ai yêu thích sự ngọt ngào và thơm ngon của hạt phỉ.']",Loại sữa hạnh nhân hiện tại đang được sử dụng tại các cửa hàng Starbucks là loại sữa được nhập khẩu độc quyền dành riêng cho Starbucks.
Cà phê Espresso của Starbucks được chiết suất trong bao lâu?,Các shot espresso của Starbucks được chiết suất từ 18 tới 21 giây. Là tiêu chuẩn của tất cả các cửa hàng Starbucks.,"['Loại sữa yến mạch Starbucks sử dụng là gì?\nLoại sữa yến mạch hiện tại đang được sử dụng tại các cửa hàng Starbucks là Oatly. \nLoại sữa hạnh nhân Starbucks sử dụng là gì?\nLoại sữa hạnh nhân hiện tại đang được sử dụng tại các cửa hàng Starbucks là loại sữa được nhập khẩu độc quyền dành riêng cho Starbucks.\nCà phê Espresso của Starbucks được chiết suất trong bao lâu?\nCác shot espresso của Starbucks được chiết suất từ 18 tới 21 giây. Là tiêu chuẩn của tất cả các cửa hàng Starbucks.', 'Các shot espresso của Starbucks được chiết suất từ 18 tới 21 giây. Là tiêu chuẩn của tất cả các cửa hàng Starbucks.\nStarbucks có bao nhiêu loại sữa?\nHiện tại Starbucks cung cấp 6 loại sữa mà bạn có thể tùy chỉnh cho món nước của mình, bao gồm: Sữa tươi nguyên chất, Sữa half & half, Sữa ít béo, Sữa đậu nành, Sữa hạnh nhân, Sữa yến mạch.  \nStarbucks có bao nhiêu loại syrup?\nHiện tại Starbucks cung cấp 6 loại syrup: Vanilla syrup, Caramel syrup, Hazelnut syrup, Brown Sugar syrup, sốt Asian Dolce, sốt Mocha', 'Những người pha cà phê phin làm tốt nhất với phương pháp xay tổng hợp có sẵn ở các loại cà phê nghiền sơ hoặc với kiểu xay dành riêng cho phin pha loại đáy bằng hoặc hình nón. Tất cả các cửa hàng của Starbucks đều có thể xay cà phê theo kỹ thuật này. Các máy pha cà phê Espresso rất nhạy với cà phê xay và đòi hỏi bột cà phê xay phải rất mịn, 30-35 giây trong máy xay lưỡi dẹt. Cà phê nhỏ giọt chậm và nhanh thường do bột cà phê xay quá mịn hoặc quá thô, hạt cà phê espresso bị đóng băng hoặc đông lạnh và chèn']",Các shot espresso của Starbucks được chiết suất từ 18 tới 21 giây. Là tiêu chuẩn của tất cả các cửa hàng Starbucks.
Món Espresso là gì?,"Espresso là một loại cà phê đậm đặc với hương vị mạnh mẽ, được chiết suất dưới áp suất cao. Nó nên tảng của nhiều món cà phê khác và thường được thưởng thức nguyên chất trong cốc shot nhỏ.","['Các món cà phê:\nEspresso: Espresso là loại cà phê đậm đặc với hương vị mạnh mẽ, được chiết suất dưới áp suất cao. Món espresso là nên tảng của nhiều món cà phê khác, thường được thưởng thức nguyên chất trong cốc shot nhỏ thể có thể thưởng thức được hương thơm và mùi vị của cà phê nguyên bản.', 'Matcha Espresso Fusion: Matcha Espresso Fusion tại Starbucks là món đồ uống kết hợp giữa bột matcha xanh mịn, sữa tươi và espresso đậm đà, tạo ra một thức uống độc đáo với sự hòa quyện giữa vị trà xanh nhẹ nhàng và cà phê mạnh mẽ, mang đến trải nghiệm mới mẻ và sảng khoái. Món nước này có thể được tùy chỉnh nóng hoặc lạnh.', 'Đây là dữ kiện thú vị: Cà phê Espresso được sáng chế ở Ý bởi một người dám nghĩ dám làm. Ông đã tìm cách chuẩn bị cà phê trong thời gian ngắn hơn để phục vụ những người đi làm đang vội vã bắt tàu. Khi nghĩ về điều này, bạn sẽ thấy nó có phần nào châm biếm bởi những người yêu thích cà phê ở Ý (và tất cả những người yêu thích cà phê trên thế giới) giờ đây lại thích thưởng thức cà phê espresso theo cách nhâm nhi từng ngụm chậm rãi.']","Espresso là loại cà phê đậm đặc với hương vị mạnh mẽ, được chiết suất dưới áp suất cao. Món espresso là nên tảng của nhiều món cà phê khác, thường được thưởng thức nguyên chất trong cốc shot nhỏ thể có thể thưởng thức được hương thơm và mùi vị của cà phê nguyên bản. "
Món Con Panna là gì?,"Con Panna là sự kết hợp giữa một shot espresso đậm đà với lớp kem tươi (whipped cream) ở trên, tạo nên một món uống có hương vị mạnh mẽ của cà phê và ngọt dịu của kem tươi. Phù hợp cho những ai muốn một chút ngọt ngào cùng cà phê.","['Con Panna: Espresso Con Panna là sự kết hợp giữa một shot espresso đậm đà với lớp kem tươi (whipped cream) ở trên. Sự pha trộn này tạo nên một món uống có hương vị mạnh mẽ của cà phê và ngọt dịu của kem tươi. Phù hợp cho những ai muốn một chút ngọt ngào cùng cà phê.   \nMacchiato: Espresso Macchiato là sự kết hợp giữa hương vị cà phê và được đánh dâu bằng một chút bọt sữa mịn ở trên. Mang lại hương vị cân bằng tinh chế.', 'Caffè Verona® là sự pha trộn đầy hấp dẫn giữa các hạt cà phê từ Mỹ Latinh và Indonesia, với một chút đậm đà, hương thơm và vị ngọt vay mượn từ Italian Roast.\n\nVì kết hợp thú vị này rất phù hợp khi dùng với sôcôla nên nó trở thành sản phẩm yêu thích của Ngày lễ Tình nhân – và là loại cà phê chúng tôi kết hợp nhiều nhất với sự lãng mạn. Bella, Bella!', 'Mocha: Caffe Mocha là sự kết hợp giữa espresso, sữa tươi và syrup chocolate, tạo ra một món cà phê ngọt ngào, đậm đà với hương vị chocolate thơm lừng. Món này thường được thưởng thức với một lớp kem tươi (whipped cream) ở trên. Món nước này có thể được tùy chỉnh nóng hoặc lạnh.']",Espresso Con Panna là sự kết hợp giữa một shot espresso đậm đà với lớp kem tươi (whipped cream) ở trên. Sự pha trộn này tạo nên một món uống có hương vị mạnh mẽ của cà phê và ngọt dịu của kem tươi. Phù hợp cho những ai muốn một chút ngọt ngào cùng cà phê.
Món Macchiato là gì?,"Espresso Macchiato là sự kết hợp giữa espresso và được đánh dâu bằng một chút bọt sữa mịn ở trên, tạo ra hương vị cân bằng tinh tế.","['Caramel Macchiato: Caramel Macchiato là sự kết hợp giữa espresso, sữa tươi và syrup vanilla hòa quyện cùng với một lớp caramel đặc ở trên, tạo nên một hương vị cà phê cân bằng giữa cà phê mạnh đắng và caramel ngọt ngào. Món nước này có thể được tùy chỉnh nóng hoặc lạnh.', 'Con Panna: Espresso Con Panna là sự kết hợp giữa một shot espresso đậm đà với lớp kem tươi (whipped cream) ở trên. Sự pha trộn này tạo nên một món uống có hương vị mạnh mẽ của cà phê và ngọt dịu của kem tươi. Phù hợp cho những ai muốn một chút ngọt ngào cùng cà phê.   \nMacchiato: Espresso Macchiato là sự kết hợp giữa hương vị cà phê và được đánh dâu bằng một chút bọt sữa mịn ở trên. Mang lại hương vị cân bằng tinh chế.', 'Mocha: Caffe Mocha là sự kết hợp giữa espresso, sữa tươi và syrup chocolate, tạo ra một món cà phê ngọt ngào, đậm đà với hương vị chocolate thơm lừng. Món này thường được thưởng thức với một lớp kem tươi (whipped cream) ở trên. Món nước này có thể được tùy chỉnh nóng hoặc lạnh.']",Espresso Macchiato là sự kết hợp giữa hương vị cà phê và được đánh dâu bằng một chút bọt sữa mịn ở trên. Mang lại hương vị cân bằng tinh chế.
Món Latte là gì?,"Latte là sự pha trộn mượt mà giữa espresso và sữa tươi, tạo nên hương vị nhẹ nhàng, béo ngậy. Là lựa chọn hoàn hảo cho những ai thích cà phê dịu nhẹ, dễ uống. Món nước có thể được tùy chỉnh nóng hoặc lạnh.","['Latte: Caffe Latte là sự pha trộn mượt mà giữa espresso và sữa tươi, tạo nên hương vị nhẹ nhàng, béo ngậy. Là sự lựa chọn hoàn hảo cho những ai thích cà phê dịu nhẹ, dễ uống. Món nước có thể được tùy chọn nóng hoặc lạnh.', 'Asian Dolce Latte: Asian Dolce Latte là sự kết hợp giữa espresso, sữa ít béo và syrup asian dolce (hương vị giống với sữa đặc) tạo ra một món cà phê quen thuộc tương tự như món cà phê bạc xỉu Việt Nam, món Asian Dolce Latte được thưởng thức với một lớp kem tươi ở trên. Món nước này có thể được tùy chỉnh nóng hoặc lạnh.', 'Almondmilk Hazelnut Latte: Almondmilk Hazelnut Latte là sự kết hợp giữa espresso, sữa hạnh nhân và syrup hạt phỉ, tạo ra hương vị cà phê đậm đà, ngọt nhẹ với một chút hương vị hạt phỉ thơm lừng. Là lựa chọn hoàn hảo cho những ai thích cà phê không sữa bò và vị thơm của hạt phỉ. Món nước có thể được tùy chỉnh nóng hoặc lạnh.']","Caffe Latte là sự pha trộn mượt mà giữa espresso và sữa tươi, tạo nên hương vị nhẹ nhàng, béo ngậy. Là sự lựa chọn hoàn hảo cho những ai thích cà phê dịu nhẹ, dễ uống. Món nước có thể được tùy chọn nóng hoặc lạnh."
Món Cappuccino là gì?,"Cappuccino là sự kết hợp cân bằng giữa espresso, sữa tươi và một lớp bọt sữa dày ở trên, tạo nên hương vị đậm đà với kết câu mịn màng, bông xốp. Đây là lựa chọn lý tưởng cho những ai thích cà phê mạnh cùng cảm giác béo ngậy của bọt sữa. Món nước có thể được tùy chọn nóng hoặc lạnh.","['Cappuccino: Caffe Cappuccino là sự kết hợp cân bằng giữa espresso, sữa tươi và một lớp bọt sữa dày ở trên, tạo nên hương vị đậm đà với kết câu mịn màng, bông xốp. Đây là lựa chọn lý tưởng cho những ai thích cà phê mạnh cùng cảm giác béo ngậy của bọt sữa. Món nước có thể được tùy chọn nóng hoặc lạnh.', 'Coffee Frappuccino: Coffee Frappuccino tại Starbucks là món đồ uống đá xay kết hợp giữa cà phê Frappuccino Roast và sữa tạo ra một thức uống mát lạnh, đậm đà với hương vị cà phê nguyên chất, hoàn hảo cho những ai yêu thích cà phê đá xay tươi mát.\nEspresso Frappuccino: Espresso Frappuccino tại Starbucks là món đồ uống đá xay kết hợp giữa espresso đậm đà và sữa, tạo ra một thức uống mát lạnh, mạnh mẽ với hương vị cà phê espresso nguyên chất, lý tưởng cho những ai yêu thích cà phê mạnh và tươi mới.', 'Caramel Frappuccino: Caramel Frappuccino tại Starbucks là món đồ uống đá xay kết hợp giữa cà phê Frappuccino Roast, sữa và syrup caramel ngọt ngào, tạo ra một thức uống mát lạnh, béo ngậy với hương vị caramel thơm lừng, hoàn hảo cho những ai yêu thích sự ngọt ngào và sảng khoái.']","Caffe Cappuccino là sự kết hợp cân bằng giữa espresso, sữa tươi và một lớp bọt sữa dày ở trên, tạo nên hương vị đậm đà với kết câu mịn màng, bông xốp. Đây là lựa chọn lý tưởng cho những ai thích cà phê mạnh cùng cảm giác béo ngậy của bọt sữa. Món nước có thể được tùy chọn nóng hoặc lạnh."
Món Flat White là gì?,"Flat White là sự pha trộn giữa ristretto espresso và sữa tươi, tạo nên hương vị cà phê đậm đà nhưng vẫn nhẹ nhàng với lớp sữa. Là lựa chọn hoàn hảo cho những ai thích Caffe Latte nhưng muốn cà phê của mình mạnh hơn.","['Flat White: Flat White là sự pha trộn giữa ristretto espresso và sữa tươi, tạo nên hương vị cà phê đậm đà nhưng vẫn nhẹ nhàng với lớp sữa. Là lựa chọn hoàn hảo cho những ai thích Caffe Latte nhưng muốn cà phê của mình mạnh hơn. Món nước có thể được tùy chỉnh nóng hoặc lạnh.', 'Các lựa chọn topping:\nBột matcha (thêm 10.000 nghìn đồng)\nChocolate viên (thêm 10.000 nghìn đồng)\nTrong trường hợp món nước của bạn đã có các topping nêu trên thì tùy chỉnh thêm các topping đó sẽ không tính phí.\nCác câu hỏi thường gặp khi đặt món tại Starbucks:\nMón nước nào có nhiều cafeine nhất?\nMón nước có nhiều cafeine nhất là Cold Brew sau đó là Flat White.\nCó ưu đãi gì khi mang bình cá nhân theo không?', 'Cold Foam Iced Espresso: Cold Foam Iced Espresso là sự kết hợp giữa espresso được lắc với syrup đường mía và được phủ lên một lớp bọt sữa được đánh mịn màng, mang lại hương vị cà phê đậm đà kết hợp với sự nhẹ nhàng của lớp bọt sữa. Món nước này chỉ có tùy chỉnh lạnh.']","Flat White là sự pha trộn giữa ristretto espresso và sữa tươi, tạo nên hương vị cà phê đậm đà nhưng vẫn nhẹ nhàng với lớp sữa. Là lựa chọn hoàn hảo cho những ai thích Caffe Latte nhưng muốn cà phê của mình mạnh hơn. Món nước có thể được tùy chỉnh nóng hoặc lạnh. "
Món Almondmilk Hazelnut Latte là gì?,"Almondmilk Hazelnut Latte là sự kết hợp giữa espresso, sữa hạnh nhân và syrup hạt phỉ, tạo ra hương vị cà phê đậm đà, ngọt nhẹ với một chút hương vị hạt phỉ thơm lừng.","['Almondmilk Hazelnut Latte: Almondmilk Hazelnut Latte là sự kết hợp giữa espresso, sữa hạnh nhân và syrup hạt phỉ, tạo ra hương vị cà phê đậm đà, ngọt nhẹ với một chút hương vị hạt phỉ thơm lừng. Là lựa chọn hoàn hảo cho những ai thích cà phê không sữa bò và vị thơm của hạt phỉ. Món nước có thể được tùy chỉnh nóng hoặc lạnh.', 'Almondmilk Hazelnut Frappuccino: Almondmilk Hazelnut Frappuccino tại Starbucks là món đồ uống đá xay kết hợp giữa cà phê Frappuccino Roast, sữa hạnh nhân, syrup hạt phỉ ngọt ngào và đá, tạo ra một thức uống mát lạnh, béo nhẹ với hương vị hạt phỉ đặc trưng, hoàn hảo cho những ai yêu thích sự ngọt ngào và thơm ngon của hạt phỉ.', 'Almondmilk Hazelnut Cream Frappuccino: Almondmilk Hazelnut Cream Frappuccino tại Starbucks là món đồ uống đá xay kết hợp giữa sữa hạnh nhân, syrup hạt phỉ ngọt ngào và đá, tạo ra một thức uống mát lạnh, béo nhẹ với hương vị hạt phỉ thơm ngon, hoàn hảo cho những ai yêu thích sự ngọt ngào và nhẹ nhàng của hạt phỉ.']","Almondmilk Hazelnut Latte là sự kết hợp giữa espresso, sữa hạnh nhân và syrup hạt phỉ, tạo ra hương vị cà phê đậm đà, ngọt nhẹ với một chút hương vị hạt phỉ thơm lừng. Là lựa chọn hoàn hảo cho những ai thích cà phê không sữa bò và vị thơm của hạt phỉ. Món nước có thể được tùy chỉnh nóng hoặc lạnh."
Món Mocha là gì?,"Mocha là sự kết hợp giữa espresso, sữa tươi và syrup chocolate, tạo ra một món cà phê ngọt ngào, đậm đà với hương vị chocolate thơm lừng.","['Mocha: Caffe Mocha là sự kết hợp giữa espresso, sữa tươi và syrup chocolate, tạo ra một món cà phê ngọt ngào, đậm đà với hương vị chocolate thơm lừng. Món này thường được thưởng thức với một lớp kem tươi (whipped cream) ở trên. Món nước này có thể được tùy chỉnh nóng hoặc lạnh.', 'Mocha Frappuccino: Mocha Frappuccino tại Starbucks là món đồ uống đá xay kết hợp giữa cà phê Frappuccino Roast, sữa và syrup chocolate, tạo ra một thức uống ngọt ngào, béo ngậy với hương vị cà phê và chocolate đậm đà, hoàn hảo cho những ai yêu thích sự kết hợp giữa cà phê và chocolate.', 'Các món nước liên quan tới trà xanh tại Starbucks là gì?\nStarbucks phục vụ các món nước có nguyên liệu trà xanh từ: Pure Matcha Latte, Pure Matcha Espresso Fusion, Green Tea Cream \nCác món nước liên quan tới chocolate tại Starbucks là gì?\nStarbucks phục vụ các món nước có nguyên liệu chocolate từ: Signature Chocolate, Mocha, Java Chip Frappuccino, Chocolate Chip Cream Frappuccino.\nMón cà phê đậm đặc nhất tại Starbucks là gì?']","Caffe Mocha là sự kết hợp giữa espresso, sữa tươi và syrup chocolate, tạo ra một món cà phê ngọt ngào, đậm đà với hương vị chocolate thơm lừng. Món này thường được thưởng thức với một lớp kem tươi (whipped cream) ở trên. Món nước này có thể được tùy chỉnh nóng hoặc lạnh."
Món Caramel Macchiato là gì?,"Caramel Macchiato là sự kết hợp giữa espresso, sữa tươi và syrup vanilla hòa quyện cùng với một lớp caramel đặc ở trên, tạo nên một hương vị cà phê cân bằng giữa cà phê mạnh đắng và caramel ngọt ngào.","['Caramel Macchiato: Caramel Macchiato là sự kết hợp giữa espresso, sữa tươi và syrup vanilla hòa quyện cùng với một lớp caramel đặc ở trên, tạo nên một hương vị cà phê cân bằng giữa cà phê mạnh đắng và caramel ngọt ngào. Món nước này có thể được tùy chỉnh nóng hoặc lạnh.', 'Con Panna: Espresso Con Panna là sự kết hợp giữa một shot espresso đậm đà với lớp kem tươi (whipped cream) ở trên. Sự pha trộn này tạo nên một món uống có hương vị mạnh mẽ của cà phê và ngọt dịu của kem tươi. Phù hợp cho những ai muốn một chút ngọt ngào cùng cà phê.   \nMacchiato: Espresso Macchiato là sự kết hợp giữa hương vị cà phê và được đánh dâu bằng một chút bọt sữa mịn ở trên. Mang lại hương vị cân bằng tinh chế.', 'Caramel Frappuccino: Caramel Frappuccino tại Starbucks là món đồ uống đá xay kết hợp giữa cà phê Frappuccino Roast, sữa và syrup caramel ngọt ngào, tạo ra một thức uống mát lạnh, béo ngậy với hương vị caramel thơm lừng, hoàn hảo cho những ai yêu thích sự ngọt ngào và sảng khoái.']","Caramel Macchiato là sự kết hợp giữa espresso, sữa tươi và syrup vanilla hòa quyện cùng với một lớp caramel đặc ở trên, tạo nên một hương vị cà phê cân bằng giữa cà phê mạnh đắng và caramel ngọt ngào. Món nước này có thể được tùy chỉnh nóng hoặc lạnh."
Món Cold Foam Iced Espresso là gì?,"Cold Foam Iced Espresso là sự kết hợp giữa espresso được lắc với syrup đường mía và được phủ lên một lớp bọt sữa được đánh mịn màng, mang lại hương vị cà phê đậm đà kết hợp với sự nhẹ nhàng của lớp bọt sữa.","['Cold Foam Iced Espresso: Cold Foam Iced Espresso là sự kết hợp giữa espresso được lắc với syrup đường mía và được phủ lên một lớp bọt sữa được đánh mịn màng, mang lại hương vị cà phê đậm đà kết hợp với sự nhẹ nhàng của lớp bọt sữa. Món nước này chỉ có tùy chỉnh lạnh.', 'Salted Caramel Cold Foam Dolce Espresso: Salted Caramel Cold Foam Dolce Espresso là sự pha trộn giữa espresso đậm đà, syrup asian dolce ngọt mặn, và lớp cold foam mịn màng vị caramel muối ở trên. Món này mang đến hương vị cân bằng giữa ngọt, mặn, và đắng, tạo cảm giác béo ngậy và tươi mới với lớp bọt lạnh độc đáo. Món nước này chỉ có thể được tùy chỉnh lạnh.', 'Brown Sugar Oatmilk Iced Shaken Espresso: Brown Sugar Oatmilk Iced Shaken Espresso là sự kết hợp giữa espresso đậm đà, syrup đường nâu ngọt ngào cũng với hương vị quế và sữa yến mạch, tất cả được lắc đều với đá. Món này mang đến hương vị cà phê mát lạnh, béo nhẹ, với chút ngọt dịu từ đường nâu và sữa yến mạch. Món nước này chỉ có thể được tùy chỉnh lạnh.']","Cold Foam Iced Espresso là sự kết hợp giữa espresso được lắc với syrup đường mía và được phủ lên một lớp bọt sữa được đánh mịn màng, mang lại hương vị cà phê đậm đà kết hợp với sự nhẹ nhàng của lớp bọt sữa. Món nước này chỉ có tùy chỉnh lạnh. "
Món Americano là gì?,"Americano là món cà phê pha từ espresso và được làm loãng với nước, tạo ra hương vị đậm đà nhưng ít đắng hơn espresso nguyên chất. Đây là lựa chọn lý tưởng cho người thích hương vị cà phê nguyên bản không thêm sữa hoặc đường, có thể tùy chọn món nước nóng hoặc lạnh.","['Americano: Americano là món cà phê pha từ espresso và được làm loãng với nước, tạo ra hương vị đậm đà nhưng ít đắng hơn espresso nguyên chất. Đây là lựa chọn lý tưởng cho người thích hương vị cà phê nguyên bản không thêm sữa hoặc đường, có thể tùy chọn món nước nóng hoặc lạnh.', 'House Blend\nĐây là đặc sản của chúng tôi.\n\nNhấp một ngụm và bạn sẽ ngay lập tức nhận ra những đặc điểm khiến loại cà phê này mang đậm phong cách Starbucks. Lưu ý đến chất lượng khi tìm nguồn cung ứng hạt cà phê Mỹ Latinh ngon nhất. Quá trình rang cẩn thận giúp lưu giữ tất cả hương vị bên trong những hạt cà phê này. Và một nụ cười khi cốc cà phê được đưa cho bạn qua quầy.', 'French Roast\nĐây là cốc cà phê tỏa khói, sản phẩm đậm đặc nhất, sẫm màu nhất của chúng tôi.\n\nĐể đánh giá hương vị thực sự của loại cà phê này, bạn phải có sở thích mạo hiểm. Thực tế thì French Roast là một loại cà phê mà mọi người dường như thích hoặc không thích. Ở đây không có sự nửa vời.']","Americano là món cà phê pha từ espresso và được làm loãng với nước, tạo ra hương vị đậm đà nhưng ít đắng hơn espresso nguyên chất. Đây là lựa chọn lý tưởng cho người thích hương vị cà phê nguyên bản không thêm sữa hoặc đường, có thể tùy chọn món nước nóng hoặc lạnh."
Món Asian Dolce Latte là gì?,"Asian Dolce Latte là sự kết hợp giữa espresso, sữa ít béo và syrup asian dolce, tạo ra một món cà phê quen thuộc tương tự như món cà phê bạc xỉu Việt Nam. Nó có thể được thưởng thức nóng hoặc lạnh với một lớp kem tươi ở trên.","['Asian Dolce Latte: Asian Dolce Latte là sự kết hợp giữa espresso, sữa ít béo và syrup asian dolce (hương vị giống với sữa đặc) tạo ra một món cà phê quen thuộc tương tự như món cà phê bạc xỉu Việt Nam, món Asian Dolce Latte được thưởng thức với một lớp kem tươi ở trên. Món nước này có thể được tùy chỉnh nóng hoặc lạnh.', 'Dolce Espresso: Dolce Espresso là một phiên bản tương tư như món cà phê sữa đá Việt Nam, là sự pha trộn hài hòa giữa epresso và sốt asian dolce tạo nên hương vị đậm đà nhưng cũng không kém phần ngọt ngào. Phù hợp với đa số những ai thích món cà phê sữa đá Việt Nam. Món nước này chỉ có thể được tùy chỉnh lạnh.', 'Starbucks sử dụng loại hạt nào cho các ly cà phê của họ?\nCác cửa hàng Starbucks đều sử dụng loại hạt Espresso Roast cho các ly cà phê mà họ làm ra hằng ngày. Starbucks còn cung cấp các loại hạt Espresso Choice nếu bạn có nhu cầu đổi hạt cà phê cho món nước của mình.\nStarbucks có cà phê bạc xỉu không?\nCó, món Asian Dolce Latte là món nước tương tư với cà phê bạc xỉu Việt Nam nhưng với một lớp kem tươi ở trên.\nStarbucks có cà phê sữa đá không?\nCó, cà phê sữa đá Việt Nam tại Starbucks là món Dolce Espresso.']","Asian Dolce Latte là sự kết hợp giữa espresso, sữa ít béo và syrup asian dolce (hương vị giống với sữa đặc) tạo ra một món cà phê quen thuộc tương tự như món cà phê bạc xỉu Việt Nam, món Asian Dolce Latte được thưởng thức với một lớp kem tươi ở trên. Món nước này có thể được tùy chỉnh nóng hoặc lạnh."
Món Pour Over Coffee là gì?,"Pour Over Coffee là một món cà phê được pha chế thủ công, được chế biến bằng cách rót nước nóng theo hình tròn trên một lớp bột cà phê tươi. Nó tạo ra một ly cà phê tinh khiết, đậm đà và rõ vị, với mỗi phần khách hàng đặt Pour Over Coffee sẽ có hương vị khác nhau do hạt cà phê xoay phiên. Món này có thể được tùy chỉnh nóng hoặc lạnh.","['Pour Over Coffee: Pour Over Coffee là món cà phê được pha chế thủ công, món này được chế biến bằng cách rót nước nóng theo hình tròn trên một lớp bột cà phê tươi, tạo ra một ly cà phê tinh khiết, đậm đà và rõ vị, ở Starbucks hạt cà phê sẽ được xoay phiên nên mỗi phần khách hàng đặt món Pour Over Coffee thì sẽ là một hương vị khác. Món nước này có thể được tùy chỉnh nóng hoặc lạnh.', 'Caffè Verona® là sự pha trộn đầy hấp dẫn giữa các hạt cà phê từ Mỹ Latinh và Indonesia, với một chút đậm đà, hương thơm và vị ngọt vay mượn từ Italian Roast.\n\nVì kết hợp thú vị này rất phù hợp khi dùng với sôcôla nên nó trở thành sản phẩm yêu thích của Ngày lễ Tình nhân – và là loại cà phê chúng tôi kết hợp nhiều nhất với sự lãng mạn. Bella, Bella!', 'French Roast\nĐây là cốc cà phê tỏa khói, sản phẩm đậm đặc nhất, sẫm màu nhất của chúng tôi.\n\nĐể đánh giá hương vị thực sự của loại cà phê này, bạn phải có sở thích mạo hiểm. Thực tế thì French Roast là một loại cà phê mà mọi người dường như thích hoặc không thích. Ở đây không có sự nửa vời.']","Pour Over Coffee là món cà phê được pha chế thủ công, món này được chế biến bằng cách rót nước nóng theo hình tròn trên một lớp bột cà phê tươi, tạo ra một ly cà phê tinh khiết, đậm đà và rõ vị, ở Starbucks hạt cà phê sẽ được xoay phiên nên mỗi phần khách hàng đặt món Pour Over Coffee thì sẽ là một hương vị khác. Món nước này có thể được tùy chỉnh nóng hoặc lạnh."
Món Dolce Espresso là gì?,"Dolce Espresso là một phiên bản tương tư như món cà phê sữa đá Việt Nam, là sự pha trộn hài hòa giữa espresso và sốt asian dolce tạo nên hương vị đậm đà nhưng cũng không kém phần ngọt ngào. Phù hợp với đa số những ai thích món cà phê sữa đá Việt Nam.","['Dolce Espresso: Dolce Espresso là một phiên bản tương tư như món cà phê sữa đá Việt Nam, là sự pha trộn hài hòa giữa epresso và sốt asian dolce tạo nên hương vị đậm đà nhưng cũng không kém phần ngọt ngào. Phù hợp với đa số những ai thích món cà phê sữa đá Việt Nam. Món nước này chỉ có thể được tùy chỉnh lạnh.', 'Salted Caramel Cold Foam Dolce Espresso: Salted Caramel Cold Foam Dolce Espresso là sự pha trộn giữa espresso đậm đà, syrup asian dolce ngọt mặn, và lớp cold foam mịn màng vị caramel muối ở trên. Món này mang đến hương vị cân bằng giữa ngọt, mặn, và đắng, tạo cảm giác béo ngậy và tươi mới với lớp bọt lạnh độc đáo. Món nước này chỉ có thể được tùy chỉnh lạnh.', 'Các món cà phê:\nEspresso: Espresso là loại cà phê đậm đặc với hương vị mạnh mẽ, được chiết suất dưới áp suất cao. Món espresso là nên tảng của nhiều món cà phê khác, thường được thưởng thức nguyên chất trong cốc shot nhỏ thể có thể thưởng thức được hương thơm và mùi vị của cà phê nguyên bản.']","Dolce Espresso là một phiên bản tương tư như món cà phê sữa đá Việt Nam, là sự pha trộn hài hòa giữa epresso và sốt asian dolce tạo nên hương vị đậm đà nhưng cũng không kém phần ngọt ngào. Phù hợp với đa số những ai thích món cà phê sữa đá Việt Nam. Món nước này chỉ có thể được tùy chỉnh lạnh."
Món Brown Sugar Oatmilk Iced Shaken Espresso là gì?,"Brown Sugar Oatmilk Iced Shaken Espresso là sự kết hợp giữa espresso đậm đà, syrup đường nâu ngọt ngào cũng với hương vị quế và sữa yến mạch, tất cả được lắc đều với đá. Nó mang đến hương vị cà phê mát lạnh, béo nhẹ, với chút ngọt dịu từ đường nâu và sữa yến mạch. Món nước này chỉ có thể được tùy chỉnh lạnh.","['Brown Sugar Oatmilk Iced Shaken Espresso: Brown Sugar Oatmilk Iced Shaken Espresso là sự kết hợp giữa espresso đậm đà, syrup đường nâu ngọt ngào cũng với hương vị quế và sữa yến mạch, tất cả được lắc đều với đá. Món này mang đến hương vị cà phê mát lạnh, béo nhẹ, với chút ngọt dịu từ đường nâu và sữa yến mạch. Món nước này chỉ có thể được tùy chỉnh lạnh.', 'Cold Foam Iced Espresso: Cold Foam Iced Espresso là sự kết hợp giữa espresso được lắc với syrup đường mía và được phủ lên một lớp bọt sữa được đánh mịn màng, mang lại hương vị cà phê đậm đà kết hợp với sự nhẹ nhàng của lớp bọt sữa. Món nước này chỉ có tùy chỉnh lạnh.', 'Brown Sugar Cocoa Oatmilk Frappuccino: Brown Sugar Cocoa Oatmilk Frappuccino tại Starbucks là món đồ uống đá xay kết hợp giữa cà phê Frappuccino Roast, sữa yến mạch, syrup đường nâu, bột cacao, chocolate và đá, tạo ra một thức uống ngọt ngào, béo nhẹ với hương vị đường nâu và chocolate, hoàn hảo cho những ai yêu thích sự kết hợp này.']","Brown Sugar Oatmilk Iced Shaken Espresso là sự kết hợp giữa espresso đậm đà, syrup đường nâu ngọt ngào cũng với hương vị quế và sữa yến mạch, tất cả được lắc đều với đá. Món này mang đến hương vị cà phê mát lạnh, béo nhẹ, với chút ngọt dịu từ đường nâu và sữa yến mạch. Món nước này chỉ có thể được tùy chỉnh lạnh."
Món Salted Caramel Cold Foam Dolce Espresso là gì?,"Salted Caramel Cold Foam Dolce Espresso là sự pha trộn giữa espresso đậm đà, syrup asian dolce ngọt mặn, và lớp cold foam mịn màng vị caramel muối ở trên. Nó mang đến hương vị cân bằng giữa ngọt, mặn, và đắng, tạo cảm giác béo ngậy và tươi mới với lớp bọt lạnh độc đáo. Món nước này chỉ có thể được tùy chỉnh lạnh.","['Salted Caramel Cold Foam Dolce Espresso: Salted Caramel Cold Foam Dolce Espresso là sự pha trộn giữa espresso đậm đà, syrup asian dolce ngọt mặn, và lớp cold foam mịn màng vị caramel muối ở trên. Món này mang đến hương vị cân bằng giữa ngọt, mặn, và đắng, tạo cảm giác béo ngậy và tươi mới với lớp bọt lạnh độc đáo. Món nước này chỉ có thể được tùy chỉnh lạnh.', 'Cold Foam Iced Espresso: Cold Foam Iced Espresso là sự kết hợp giữa espresso được lắc với syrup đường mía và được phủ lên một lớp bọt sữa được đánh mịn màng, mang lại hương vị cà phê đậm đà kết hợp với sự nhẹ nhàng của lớp bọt sữa. Món nước này chỉ có tùy chỉnh lạnh.', 'Starbucks có cà phê sữa đá không?\nCó, cà phê sữa đá Việt Nam tại Starbucks là món Dolce Espresso.\nStarbucks có cà phê đen đá không?\nCó, bạn có thể yêu cầu món Americano không nước để thành một ly cà phê đen đá theo kiểu Việt Nam.  \nStarbucks có cà phê muối không?\nCó, cà phê muối Việt Nam tại Starbucks là món Salted Caramel Cold Foam Dolce Espresso.\nStarbucks có trà trái cây không?']","Salted Caramel Cold Foam Dolce Espresso là sự pha trộn giữa espresso đậm đà, syrup asian dolce ngọt mặn, và lớp cold foam mịn màng vị caramel muối ở trên. Món này mang đến hương vị cân bằng giữa ngọt, mặn, và đắng, tạo cảm giác béo ngậy và tươi mới với lớp bọt lạnh độc đáo. Món nước này chỉ có thể được tùy chỉnh lạnh."
Món Cold Brew là gì?,"Cold Brew là loai cà phê ủ lạnh trong nhiều giờ, mang đến hương vị đậm đà, mượt mà với ít độ chua hơn cà phê pha nóng. Nó rất mát lạnh và sảng khoái, hoàn hảo cho những ai yêu thích cà phê nguyên chất. Món nước này chỉ có thể được tùy chỉnh lạnh.","['Cold Brew: Cold Brew là loai cà phê ủ lạnh trong nhiều giờ, mang đến hương vị đậm đà, mượt mà với ít độ chua hơn cà phê pha nóng. Món này rất mát lạnh và sảng khoái, hoàn hảo cho những ai yêu thích cà phê nguyên chất. Món nước này chỉ có thể được tùy chỉnh lạnh.', 'Honey Ruby Grapefruits Cold Brew: Honey Ruby Grapefruit Cold Brew tại Starbucks là món đá xay kết hợp giữa cold brew đậm đà, sốt bưởi tươi mát và mật ong ngọt dịu, tạo ra một thức uống sảng khoái, có vị chua nhẹ, ngọt tự nhiên và hương cà phê tinh tế.\nCác món đá xay không cà phê tại Starbucks:', 'Vanilla Sweet Cream Cold Brew: Vanilla Sweet Cream Cold Brew là cà phê cold brew đậm đà kết hợp với syrup vanilla và lớp kem ngọt mịn ở trên. Món này mang đến hương vị cà phê mát lạnh, ngọt dịu và béo nhẹ, hoàn hảo cho những ai thích cà phê vừa đậm vừa êm dịu. Món nước này chỉ có thể được tùy chỉnh lạnh.\nCác món trà túi lọc:\nStarbucks cung cấp 7 loại trà túi lọc cho bạn lựa chọn:']","Cold Brew là loai cà phê ủ lạnh trong nhiều giờ, mang đến hương vị đậm đà, mượt mà với ít độ chua hơn cà phê pha nóng. Món này rất mát lạnh và sảng khoái, hoàn hảo cho những ai yêu thích cà phê nguyên chất. Món nước này chỉ có thể được tùy chỉnh lạnh."
Món Vanilla Sweet Cream Cold Brew là gì?,"Vanilla Sweet Cream Cold Brew là một loại đồ uống pha chế tại Starbucks kết hợp giữa cà phê cold brew đậm đà với syrup vani và lớp kem ngọt mịn ở trên. Nó mang đến hương vị cà phê mát lạnh, ngọt dịu và béo nhẹ, hoàn hảo cho những ai thích cà phê vừa đậm vừa êm dịu.","['Vanilla Sweet Cream Cold Brew: Vanilla Sweet Cream Cold Brew là cà phê cold brew đậm đà kết hợp với syrup vanilla và lớp kem ngọt mịn ở trên. Món này mang đến hương vị cà phê mát lạnh, ngọt dịu và béo nhẹ, hoàn hảo cho những ai thích cà phê vừa đậm vừa êm dịu. Món nước này chỉ có thể được tùy chỉnh lạnh.\nCác món trà túi lọc:\nStarbucks cung cấp 7 loại trà túi lọc cho bạn lựa chọn:', 'Vanilla Cream Frappuccino: Vanilla Cream Frappuccino tại Starbucks là món đồ uống đá xay kết hợp giữa sữa và syrup vanilla ngọt ngào, tạo ra một thức uống mát lạnh, béo ngậy với hương vị vanilla thơm nhẹ, lý tưởng cho những ai yêu thích sự ngọt ngào và nhẹ nhàng.', 'Cold Brew: Cold Brew là loai cà phê ủ lạnh trong nhiều giờ, mang đến hương vị đậm đà, mượt mà với ít độ chua hơn cà phê pha nóng. Món này rất mát lạnh và sảng khoái, hoàn hảo cho những ai yêu thích cà phê nguyên chất. Món nước này chỉ có thể được tùy chỉnh lạnh.']","Vanilla Sweet Cream Cold Brew là cà phê cold brew đậm đà kết hợp với syrup vanilla và lớp kem ngọt mịn ở trên. Món này mang đến hương vị cà phê mát lạnh, ngọt dịu và béo nhẹ, hoàn hảo cho những ai thích cà phê vừa đậm vừa êm dịu. Món nước này chỉ có thể được tùy chỉnh lạnh."
Trà túi lọc Zen Oolong là gì?,"Trà túi lọc Zen Oolong là một loại trà oolong thanh nhẹ kết hợp với hương thảo mộc dịu mát, mang đến vị trà thơm tinh tế và tạo cảm giác sảng khoái. Nó có thể được tùy chỉnh nóng hoặc lạnh.","['Các món trà túi lọc:\nStarbucks cung cấp 7 loại trà túi lọc cho bạn lựa chọn:\nZen Oolong: Trà túi lọc Zen Oolong tại Starbucks là loại trà oolong thanh nhẹ, kết hợp với hương thảo mộc dịu mát. Món này mang đến vị trà thơm tinh tế, giúp thư giãn và tạo cảm giác sảng khoái. Món nước này có thể được tùy chỉnh nóng hoặc lạnh.', 'Chamomile: Trà túi lọc Chamomile tại Starbucks là loại trà thảo mộc dịu nhẹ, không có cafeine, có hương thơm hoa cúc, mang đến cảm giác thư giãn và dễ ngủ, lý tưởng cho những ai muốn thư giãn sau một ngày dài. Món nước này có thể được tùy chỉnh nóng hoặc lạnh.\nStarbucks Refreshers:', 'Hibiscus: Trà túi lọc Hibiscus tại Starbucks là loại trà thảo mộc có màu đỏ tươi, hương vị chua nhẹ và thơm mát, được làm từ hoa dâm bụt. Đây là lựa chọn sảng khoái và không chứa caffeine, hoàn hảo để giải khát. Món nước này có thể được tùy chỉnh nóng hoặc lạnh.']","Trà túi lọc Zen Oolong tại Starbucks là loại trà oolong thanh nhẹ, kết hợp với hương thảo mộc dịu mát. Món này mang đến vị trà thơm tinh tế, giúp thư giãn và tạo cảm giác sảng khoái. Món nước này có thể được tùy chỉnh nóng hoặc lạnh."
Trà túi lọc Mint Citrus là gì?,"Trà túi lọc Mint Citrus tại Starbucks là sự kết hợp giữa bạc hà mát lạnh và hương cam chanh tươi mát, tạo nên vị trà sảng khoái, dịu nhẹ và thanh mát, lý tưởng để thư giãn. Món nước này có thể được tùy chỉnh nóng hoặc lạnh.","['Mint Citrus: Trà túi lọc Mint Citrus tại Starbucks là sự kết hợp giữa bạc hà mát lạnh và hương cam chanh tươi mát, tạo nên vị trà sảng khoái, dịu nhẹ và thanh mát, lý tưởng để thư giãn. Món nước này có thể được tùy chỉnh nóng hoặc lạnh.\nGolden Monkey: Trà túi lọc Golden Monkey tại Starbucks là loại trà đen cao cấp với hương vị đậm đà, ấm áp, xen lẫn chút ngọt tự nhiên. Đây là lựa chọn hoàn hảo cho những ai thích vị trà mạnh mẽ và giàu hương thơm. Món nước này có thể được tùy chỉnh nóng hoặc lạnh.', 'Chamomile: Trà túi lọc Chamomile tại Starbucks là loại trà thảo mộc dịu nhẹ, không có cafeine, có hương thơm hoa cúc, mang đến cảm giác thư giãn và dễ ngủ, lý tưởng cho những ai muốn thư giãn sau một ngày dài. Món nước này có thể được tùy chỉnh nóng hoặc lạnh.\nStarbucks Refreshers:', 'Hibiscus: Trà túi lọc Hibiscus tại Starbucks là loại trà thảo mộc có màu đỏ tươi, hương vị chua nhẹ và thơm mát, được làm từ hoa dâm bụt. Đây là lựa chọn sảng khoái và không chứa caffeine, hoàn hảo để giải khát. Món nước này có thể được tùy chỉnh nóng hoặc lạnh.']","Trà túi lọc Mint Citrus tại Starbucks là sự kết hợp giữa bạc hà mát lạnh và hương cam chanh tươi mát, tạo nên vị trà sảng khoái, dịu nhẹ và thanh mát, lý tưởng để thư giãn. Món nước này có thể được tùy chỉnh nóng hoặc lạnh."
Trà túi lọc Golden Monkey là gì?,"Trà túi lọc Golden Monkey tại Starbucks là loại trà đen cao cấp với hương vị đậm đà, ấm áp, xen lẫn chút ngọt tự nhiên. Đây là lựa chọn hoàn hảo cho những ai thích vị trà mạnh mẽ và giàu hương thơm. Món nước này có thể được tùy chỉnh nóng hoặc lạnh.","['Mint Citrus: Trà túi lọc Mint Citrus tại Starbucks là sự kết hợp giữa bạc hà mát lạnh và hương cam chanh tươi mát, tạo nên vị trà sảng khoái, dịu nhẹ và thanh mát, lý tưởng để thư giãn. Món nước này có thể được tùy chỉnh nóng hoặc lạnh.\nGolden Monkey: Trà túi lọc Golden Monkey tại Starbucks là loại trà đen cao cấp với hương vị đậm đà, ấm áp, xen lẫn chút ngọt tự nhiên. Đây là lựa chọn hoàn hảo cho những ai thích vị trà mạnh mẽ và giàu hương thơm. Món nước này có thể được tùy chỉnh nóng hoặc lạnh.', 'Các món trà túi lọc:\nStarbucks cung cấp 7 loại trà túi lọc cho bạn lựa chọn:\nZen Oolong: Trà túi lọc Zen Oolong tại Starbucks là loại trà oolong thanh nhẹ, kết hợp với hương thảo mộc dịu mát. Món này mang đến vị trà thơm tinh tế, giúp thư giãn và tạo cảm giác sảng khoái. Món nước này có thể được tùy chỉnh nóng hoặc lạnh.', 'Hibiscus: Trà túi lọc Hibiscus tại Starbucks là loại trà thảo mộc có màu đỏ tươi, hương vị chua nhẹ và thơm mát, được làm từ hoa dâm bụt. Đây là lựa chọn sảng khoái và không chứa caffeine, hoàn hảo để giải khát. Món nước này có thể được tùy chỉnh nóng hoặc lạnh.']","Trà túi lọc Golden Monkey tại Starbucks là loại trà đen cao cấp với hương vị đậm đà, ấm áp, xen lẫn chút ngọt tự nhiên. Đây là lựa chọn hoàn hảo cho những ai thích vị trà mạnh mẽ và giàu hương thơm. Món nước này có thể được tùy chỉnh nóng hoặc lạnh."
Trà túi lọc Early Grey là gì?,"Trà túi lọc Earl Grey tại Starbucks là trà đen hảo hạng, pha với hương tinh dầu cam bergamot, tạo nên vị trà đậm đà, thơm mát và thanh lịch, rất thích hợp để thư giãn và thưởng thức.","['Earl Grey: Trà túi lọc Earl Grey tại Starbucks là trà đen hảo hạng, pha với hương tinh dầu cam bergamot, tạo nên vị trà đậm đà, thơm mát và thanh lịch, rất thích hợp để thư giãn và thưởng thức. Món nước này có thể được tùy chỉnh nóng hoặc lạnh.\nEnglish Breakfast: Trà túi lọc English Breakfast tại Starbucks là loại trà đen truyền thống, có hương vị đậm đà và mạnh mẽ, lý tưởng để thưởng thức vào buổi sáng hoặc kết hợp với sữa để thêm phần béo ngậy. Món nước này có thể được tùy chỉnh nóng hoặc lạnh.', 'Hibiscus: Trà túi lọc Hibiscus tại Starbucks là loại trà thảo mộc có màu đỏ tươi, hương vị chua nhẹ và thơm mát, được làm từ hoa dâm bụt. Đây là lựa chọn sảng khoái và không chứa caffeine, hoàn hảo để giải khát. Món nước này có thể được tùy chỉnh nóng hoặc lạnh.', 'Các món trà túi lọc:\nStarbucks cung cấp 7 loại trà túi lọc cho bạn lựa chọn:\nZen Oolong: Trà túi lọc Zen Oolong tại Starbucks là loại trà oolong thanh nhẹ, kết hợp với hương thảo mộc dịu mát. Món này mang đến vị trà thơm tinh tế, giúp thư giãn và tạo cảm giác sảng khoái. Món nước này có thể được tùy chỉnh nóng hoặc lạnh.']","Trà túi lọc Earl Grey tại Starbucks là trà đen hảo hạng, pha với hương tinh dầu cam bergamot, tạo nên vị trà đậm đà, thơm mát và thanh lịch, rất thích hợp để thư giãn và thưởng thức. Món nước này có thể được tùy chỉnh nóng hoặc lạnh."
Trà túi lọc English Breakfast là gì?,"Trà đen truyền thống với hương vị đậm đà và mạnh mẽ, lý tưởng để thưởng thức vào buổi sáng hoặc kết hợp với sữa để thêm phần béo ngậy.","['Earl Grey: Trà túi lọc Earl Grey tại Starbucks là trà đen hảo hạng, pha với hương tinh dầu cam bergamot, tạo nên vị trà đậm đà, thơm mát và thanh lịch, rất thích hợp để thư giãn và thưởng thức. Món nước này có thể được tùy chỉnh nóng hoặc lạnh.\nEnglish Breakfast: Trà túi lọc English Breakfast tại Starbucks là loại trà đen truyền thống, có hương vị đậm đà và mạnh mẽ, lý tưởng để thưởng thức vào buổi sáng hoặc kết hợp với sữa để thêm phần béo ngậy. Món nước này có thể được tùy chỉnh nóng hoặc lạnh.', 'Các món trà túi lọc:\nStarbucks cung cấp 7 loại trà túi lọc cho bạn lựa chọn:\nZen Oolong: Trà túi lọc Zen Oolong tại Starbucks là loại trà oolong thanh nhẹ, kết hợp với hương thảo mộc dịu mát. Món này mang đến vị trà thơm tinh tế, giúp thư giãn và tạo cảm giác sảng khoái. Món nước này có thể được tùy chỉnh nóng hoặc lạnh.', 'Hibiscus: Trà túi lọc Hibiscus tại Starbucks là loại trà thảo mộc có màu đỏ tươi, hương vị chua nhẹ và thơm mát, được làm từ hoa dâm bụt. Đây là lựa chọn sảng khoái và không chứa caffeine, hoàn hảo để giải khát. Món nước này có thể được tùy chỉnh nóng hoặc lạnh.']","Trà túi lọc English Breakfast tại Starbucks là loại trà đen truyền thống, có hương vị đậm đà và mạnh mẽ, lý tưởng để thưởng thức vào buổi sáng hoặc kết hợp với sữa để thêm phần béo ngậy. Món nước này có thể được tùy chỉnh nóng hoặc lạnh."
Trà túi lọc Hibiscus là gì?,"Trà túi lọc Hibiscus tại Starbucks là loại trà thảo mộc có màu đỏ tươi, hương vị chua nhẹ và thơm mát, được làm từ hoa dâm bụt. Đây là lựa chọn sảng khoái và không chứa caffeine, hoàn hảo để giải khát.","['Hibiscus: Trà túi lọc Hibiscus tại Starbucks là loại trà thảo mộc có màu đỏ tươi, hương vị chua nhẹ và thơm mát, được làm từ hoa dâm bụt. Đây là lựa chọn sảng khoái và không chứa caffeine, hoàn hảo để giải khát. Món nước này có thể được tùy chỉnh nóng hoặc lạnh.', 'Cà món trà lắc:\nStarbucks cung cấp 6 loại trà lắc cho bạn lựa chọn:\nHibiscus Tea Lemonade: Hibiscus Tea Lemonade tại Starbucks là sự kết hợp giữa trà hoa dâm bụt có vị chua nhẹ và nước chanh tươi, tạo ra một thức uống mát lạnh, sảng khoái và đầy hương thơm. Món nước này chỉ có thể được tùy chỉnh lạnh.', 'Chamomile: Trà túi lọc Chamomile tại Starbucks là loại trà thảo mộc dịu nhẹ, không có cafeine, có hương thơm hoa cúc, mang đến cảm giác thư giãn và dễ ngủ, lý tưởng cho những ai muốn thư giãn sau một ngày dài. Món nước này có thể được tùy chỉnh nóng hoặc lạnh.\nStarbucks Refreshers:']","Trà túi lọc Hibiscus tại Starbucks là loại trà thảo mộc có màu đỏ tươi, hương vị chua nhẹ và thơm mát, được làm từ hoa dâm bụt. Đây là lựa chọn sảng khoái và không chứa caffeine, hoàn hảo để giải khát. Món nước này có thể được tùy chỉnh nóng hoặc lạnh."
Trà túi lọc Chamomile là gì?,"Trà túi lọc Chamomile là loại trà thảo mộc dịu nhẹ, không có cafeine, có hương thơm hoa cúc, mang lại cảm giác thư giãn và dễ ngủ.","['Chamomile: Trà túi lọc Chamomile tại Starbucks là loại trà thảo mộc dịu nhẹ, không có cafeine, có hương thơm hoa cúc, mang đến cảm giác thư giãn và dễ ngủ, lý tưởng cho những ai muốn thư giãn sau một ngày dài. Món nước này có thể được tùy chỉnh nóng hoặc lạnh.\nStarbucks Refreshers:', 'Hibiscus: Trà túi lọc Hibiscus tại Starbucks là loại trà thảo mộc có màu đỏ tươi, hương vị chua nhẹ và thơm mát, được làm từ hoa dâm bụt. Đây là lựa chọn sảng khoái và không chứa caffeine, hoàn hảo để giải khát. Món nước này có thể được tùy chỉnh nóng hoặc lạnh.', 'Starbucks có sinh tố không?\nHiện tại Starbucks chưa phục vụ các món sinh tố, nhưng khách hàng vẫn có thể đặt 2 món trái cây đá xay: Xoài chanh dây đá xay (Mango Passion Fruit), Phúc bồn tử đá xay (Raspberry Black Currant)\nCác loại trà túi lọc không có caffeine là gì?\nCác loại trà túi lọc không caffeine mà Starbucks phục vụ có thể kể đến là: Trà Hibiscus, Trà Chamomile\nCác món nước liên quan tới trà xanh tại Starbucks là gì?']","Trà túi lọc Chamomile tại Starbucks là loại trà thảo mộc dịu nhẹ, không có cafeine, có hương thơm hoa cúc, mang đến cảm giác thư giãn và dễ ngủ, lý tưởng cho những ai muốn thư giãn sau một ngày dài. Món nước này có thể được tùy chỉnh nóng hoặc lạnh."
Món Strawberry Acai With Lemonade là gì?,"Món Strawberry Acai With Lemonade tại Starbucks là một thức uống mát lạnh, tươi mới và sảng khoái kết hợp giữa vị chua ngọt của nước chanh và dâu tây với hương acai thơm ngon. Món nước này có thể được tùy chỉnh nóng hoặc lạnh.","['Starbucks Refreshers:\nStrawberry Acai With Lemonade: Refresher Strawberry Acai with Lemonade tại Starbucks là một món đồ uống mát lạnh, kết hợp giữa vị chua ngọt của nước chanh và dâu tây, với hương acai thơm ngon, tạo ra một thức uống tươi mới và sảng khoái. Món nước này có thể được tùy chỉnh nóng hoặc lạnh.', 'Strawberry Green Tea With Lemonade: Strawberry Green Tea with Lemonade tại Starbucks là sự kết hợp giữa trà xanh nhẹ nhàng, nước chanh tươi và dâu tây ngọt ngào, tạo ra một thức uống mát lạnh, tươi mới và sảng khoái. Món nước này chỉ có thể được tùy chỉnh lạnh.\nCác món đá xay có cà phê tại Starbucks:', 'Pink Drink With Strawberry Acai: Refresher Pink Drink with Strawberry Acai tại Starbucks là một món đồ uống mát lạnh, kết hợp giữa nước dâu tây acai, sữa dừa và dâu tươi, tạo ra một thức uống ngọt ngào, tươi mới và đầy màu sắc. Món nước này chỉ có thể được tùy chỉnh lạnh.']","Refresher Strawberry Acai with Lemonade tại Starbucks là một món đồ uống mát lạnh, kết hợp giữa vị chua ngọt của nước chanh và dâu tây, với hương acai thơm ngon, tạo ra một thức uống tươi mới và sảng khoái. Món nước này có thể được tùy chỉnh nóng hoặc lạnh. "
Món Pink Drink With Strawberry Acai là gì?,"Món Pink Drink With Strawberry Acai là một thức uống mát lạnh, tươi mới và đầy màu sắc được làm từ nước dâu tây acai, sữa dừa và dâu tươi. Nó chỉ có thể được tùy chỉnh lạnh.","['Pink Drink With Strawberry Acai: Refresher Pink Drink with Strawberry Acai tại Starbucks là một món đồ uống mát lạnh, kết hợp giữa nước dâu tây acai, sữa dừa và dâu tươi, tạo ra một thức uống ngọt ngào, tươi mới và đầy màu sắc. Món nước này chỉ có thể được tùy chỉnh lạnh.', 'Starbucks Refreshers:\nStrawberry Acai With Lemonade: Refresher Strawberry Acai with Lemonade tại Starbucks là một món đồ uống mát lạnh, kết hợp giữa vị chua ngọt của nước chanh và dâu tây, với hương acai thơm ngon, tạo ra một thức uống tươi mới và sảng khoái. Món nước này có thể được tùy chỉnh nóng hoặc lạnh.', 'Strawberry Green Tea With Lemonade: Strawberry Green Tea with Lemonade tại Starbucks là sự kết hợp giữa trà xanh nhẹ nhàng, nước chanh tươi và dâu tây ngọt ngào, tạo ra một thức uống mát lạnh, tươi mới và sảng khoái. Món nước này chỉ có thể được tùy chỉnh lạnh.\nCác món đá xay có cà phê tại Starbucks:']","Refresher Pink Drink with Strawberry Acai tại Starbucks là một món đồ uống mát lạnh, kết hợp giữa nước dâu tây acai, sữa dừa và dâu tươi, tạo ra một thức uống ngọt ngào, tươi mới và đầy màu sắc. Món nước này chỉ có thể được tùy chỉnh lạnh."
Món Mango Dragonfruit With Lemonade là gì?,"Mango Dragonfruit with Lemonade là một món đồ uống mát lạnh, kết hợp giữa nước chanh tươi và hương vị ngọt ngào của xoài và thanh long, mang lại cảm giác sảng khoái, tươi mới và đầy năng lượng. Chỉ có thể được tùy chỉnh lạnh.","['Mango Dragonfruit With Lemonade: Mango Dragonfruit with Lemonade Refresher tại Starbucks là một món đồ uống mát lạnh, kết hợp giữa nước chanh tươi và hương vị ngọt ngào của xoài và thanh long, mang lại cảm giác sảng khoái, tươi mới và đầy năng lượng. Món nước này chỉ có thể được tùy chỉnh lạnh.', 'Dragon Drink With Mango Dragonfruit: Dragon Drink with Mango Dragonfruit Refresher tại Starbucks là món đồ uống mát lạnh kết hợp giữa hương vị của xoài và thanh long cùng với sữa dừa, tạo ra một thức uống ngọt ngào, tươi mát với hương xoài và thanh long thơm ngon. Món nước này chỉ có thể được tùy chỉnh lạnh.\nCà món trà lắc:\nStarbucks cung cấp 6 loại trà lắc cho bạn lựa chọn:', 'Mango Passion Fruit: Mango Passion Fruit tại Starbucks là một thức uống tươi mát, kết hợp giữa vị ngọt của xoài và hương chua của trái chanh dây, mang đến một trải nghiệm sảng khoái, hoàn hảo cho những ai yêu thích đồ uống trái cây.\nRaspberry Black Currant: Raspberry Black Currant tại Starbucks là một thức uống ngọt ngào, kết hợp giữa vị chua nhẹ của mâm xôi và hương thơm đặc trưng của quả lý chua đen, tạo ra một trải nghiệm tươi mới và sảng khoái.\nCác món khác:']","Mango Dragonfruit with Lemonade Refresher tại Starbucks là một món đồ uống mát lạnh, kết hợp giữa nước chanh tươi và hương vị ngọt ngào của xoài và thanh long, mang lại cảm giác sảng khoái, tươi mới và đầy năng lượng. Món nước này chỉ có thể được tùy chỉnh lạnh."
Món Dragon Drink With Mango Dragonfruit là gì?,"Món Dragon Drink With Mango Dragonfruit là một thức uống mát lạnh kết hợp giữa hương vị của xoài và thanh long cùng với sữa dừa, tạo ra một thức uống ngọt ngào, tươi mát với hương xoài và thanh long thơm ngon. Món nước này chỉ có thể được tùy chỉnh lạnh.","['Dragon Drink With Mango Dragonfruit: Dragon Drink with Mango Dragonfruit Refresher tại Starbucks là món đồ uống mát lạnh kết hợp giữa hương vị của xoài và thanh long cùng với sữa dừa, tạo ra một thức uống ngọt ngào, tươi mát với hương xoài và thanh long thơm ngon. Món nước này chỉ có thể được tùy chỉnh lạnh.\nCà món trà lắc:\nStarbucks cung cấp 6 loại trà lắc cho bạn lựa chọn:', 'Mango Dragonfruit With Lemonade: Mango Dragonfruit with Lemonade Refresher tại Starbucks là một món đồ uống mát lạnh, kết hợp giữa nước chanh tươi và hương vị ngọt ngào của xoài và thanh long, mang lại cảm giác sảng khoái, tươi mới và đầy năng lượng. Món nước này chỉ có thể được tùy chỉnh lạnh.', 'Mango Passion Fruit: Mango Passion Fruit tại Starbucks là một thức uống tươi mát, kết hợp giữa vị ngọt của xoài và hương chua của trái chanh dây, mang đến một trải nghiệm sảng khoái, hoàn hảo cho những ai yêu thích đồ uống trái cây.\nRaspberry Black Currant: Raspberry Black Currant tại Starbucks là một thức uống ngọt ngào, kết hợp giữa vị chua nhẹ của mâm xôi và hương thơm đặc trưng của quả lý chua đen, tạo ra một trải nghiệm tươi mới và sảng khoái.\nCác món khác:']","Dragon Drink with Mango Dragonfruit Refresher tại Starbucks là món đồ uống mát lạnh kết hợp giữa hương vị của xoài và thanh long cùng với sữa dừa, tạo ra một thức uống ngọt ngào, tươi mát với hương xoài và thanh long thơm ngon. Món nước này chỉ có thể được tùy chỉnh lạnh."
Món Hibiscus Tea Lemonade là gì?,"Hibiscus Tea Lemonade tại Starbucks là sự kết hợp giữa trà hoa dâm bụt có vị chua nhẹ và nước chanh tươi, tạo ra một thức uống mát lạnh, sảng khoái và đầy hương thơm. Món nước này chỉ có thể được tùy chỉnh lạnh.","['Cà món trà lắc:\nStarbucks cung cấp 6 loại trà lắc cho bạn lựa chọn:\nHibiscus Tea Lemonade: Hibiscus Tea Lemonade tại Starbucks là sự kết hợp giữa trà hoa dâm bụt có vị chua nhẹ và nước chanh tươi, tạo ra một thức uống mát lạnh, sảng khoái và đầy hương thơm. Món nước này chỉ có thể được tùy chỉnh lạnh.', 'Hibiscus: Trà túi lọc Hibiscus tại Starbucks là loại trà thảo mộc có màu đỏ tươi, hương vị chua nhẹ và thơm mát, được làm từ hoa dâm bụt. Đây là lựa chọn sảng khoái và không chứa caffeine, hoàn hảo để giải khát. Món nước này có thể được tùy chỉnh nóng hoặc lạnh.', 'Iced Pomagranate Pearls Hibiscus: Iced Pomegranate Pearls Hibiscus tại Starbucks là món đồ uống mát lạnh kết hợp giữa trà hoa dâm bụt với những viên lựu chua ngọt, mang lại hương vị tươi mới và sảng khoái, hoàn hảo cho những ai yêu thích sự kết hợp giữa trái cây và trà thảo mộc. Món nước này chỉ có thể được tùy chỉnh lạnh.']","Hibiscus Tea Lemonade tại Starbucks là sự kết hợp giữa trà hoa dâm bụt có vị chua nhẹ và nước chanh tươi, tạo ra một thức uống mát lạnh, sảng khoái và đầy hương thơm. Món nước này chỉ có thể được tùy chỉnh lạnh."
Món Black Tea Lemonade là gì?,"Black Tea Lemonade là sự kết hợp giữa trà đen đậm đà và nước chanh tươi, tạo ra một thức uống mát lạnh, vừa đắng vừa chua, sảng khoái và đầy năng lượng. Chỉ có thể được tùy chỉnh lạnh.","['Black Tea Lemonade: Black Tea Lemonade tại Starbucks là sự kết hợp giữa trà đen đậm đà và nước chanh tươi, tạo ra một thức uống mát lạnh, vừa đắng vừa chua, sảng khoái và đầy năng lượng. Món nước này chỉ có thể được tùy chỉnh lạnh.\nGreen Tea Lemonade: Green Tea Lemonade tại Starbucks là sự kết hợp giữa trà xanh nhẹ nhàng và nước chanh tươi, tạo ra một thức uống mát lạnh, thanh mát và sảng khoái, lý tưởng cho những ai yêu thích vị trà nhẹ và chua ngọt. Món nước này chỉ có thể được tùy chỉnh lạnh.', 'Cà món trà lắc:\nStarbucks cung cấp 6 loại trà lắc cho bạn lựa chọn:\nHibiscus Tea Lemonade: Hibiscus Tea Lemonade tại Starbucks là sự kết hợp giữa trà hoa dâm bụt có vị chua nhẹ và nước chanh tươi, tạo ra một thức uống mát lạnh, sảng khoái và đầy hương thơm. Món nước này chỉ có thể được tùy chỉnh lạnh.', 'Strawberry Green Tea With Lemonade: Strawberry Green Tea with Lemonade tại Starbucks là sự kết hợp giữa trà xanh nhẹ nhàng, nước chanh tươi và dâu tây ngọt ngào, tạo ra một thức uống mát lạnh, tươi mới và sảng khoái. Món nước này chỉ có thể được tùy chỉnh lạnh.\nCác món đá xay có cà phê tại Starbucks:']","Black Tea Lemonade tại Starbucks là sự kết hợp giữa trà đen đậm đà và nước chanh tươi, tạo ra một thức uống mát lạnh, vừa đắng vừa chua, sảng khoái và đầy năng lượng. Món nước này chỉ có thể được tùy chỉnh lạnh."
Món Green Tea Lemonade là gì?,"Green Tea Lemonade tại Starbucks là sự kết hợp giữa trà xanh nhẹ nhàng và nước chanh tươi, tạo ra một thức uống mát lạnh, thanh mát và sảng khoái, lý tưởng cho những ai yêu thích vị trà nhẹ và chua ngọt. Món nước này chỉ có thể được tùy chỉnh lạnh.","['Strawberry Green Tea With Lemonade: Strawberry Green Tea with Lemonade tại Starbucks là sự kết hợp giữa trà xanh nhẹ nhàng, nước chanh tươi và dâu tây ngọt ngào, tạo ra một thức uống mát lạnh, tươi mới và sảng khoái. Món nước này chỉ có thể được tùy chỉnh lạnh.\nCác món đá xay có cà phê tại Starbucks:', 'Black Tea Lemonade: Black Tea Lemonade tại Starbucks là sự kết hợp giữa trà đen đậm đà và nước chanh tươi, tạo ra một thức uống mát lạnh, vừa đắng vừa chua, sảng khoái và đầy năng lượng. Món nước này chỉ có thể được tùy chỉnh lạnh.\nGreen Tea Lemonade: Green Tea Lemonade tại Starbucks là sự kết hợp giữa trà xanh nhẹ nhàng và nước chanh tươi, tạo ra một thức uống mát lạnh, thanh mát và sảng khoái, lý tưởng cho những ai yêu thích vị trà nhẹ và chua ngọt. Món nước này chỉ có thể được tùy chỉnh lạnh.', 'Cà món trà lắc:\nStarbucks cung cấp 6 loại trà lắc cho bạn lựa chọn:\nHibiscus Tea Lemonade: Hibiscus Tea Lemonade tại Starbucks là sự kết hợp giữa trà hoa dâm bụt có vị chua nhẹ và nước chanh tươi, tạo ra một thức uống mát lạnh, sảng khoái và đầy hương thơm. Món nước này chỉ có thể được tùy chỉnh lạnh.']","Green Tea Lemonade tại Starbucks là sự kết hợp giữa trà xanh nhẹ nhàng và nước chanh tươi, tạo ra một thức uống mát lạnh, thanh mát và sảng khoái, lý tưởng cho những ai yêu thích vị trà nhẹ và chua ngọt. Món nước này chỉ có thể được tùy chỉnh lạnh."
Món Iced Pomagranate Pearls Hibiscus là gì?,"Iced Pomegranate Pearls Hibiscus là một món đồ uống mát lạnh kết hợp giữa trà hoa dâm bụt với những viên lựu chua ngọt, mang lại hương vị tươi mới và sảng khoái.","['Iced Pomagranate Pearls Hibiscus: Iced Pomegranate Pearls Hibiscus tại Starbucks là món đồ uống mát lạnh kết hợp giữa trà hoa dâm bụt với những viên lựu chua ngọt, mang lại hương vị tươi mới và sảng khoái, hoàn hảo cho những ai yêu thích sự kết hợp giữa trái cây và trà thảo mộc. Món nước này chỉ có thể được tùy chỉnh lạnh.', 'Hibiscus: Trà túi lọc Hibiscus tại Starbucks là loại trà thảo mộc có màu đỏ tươi, hương vị chua nhẹ và thơm mát, được làm từ hoa dâm bụt. Đây là lựa chọn sảng khoái và không chứa caffeine, hoàn hảo để giải khát. Món nước này có thể được tùy chỉnh nóng hoặc lạnh.', 'Cà món trà lắc:\nStarbucks cung cấp 6 loại trà lắc cho bạn lựa chọn:\nHibiscus Tea Lemonade: Hibiscus Tea Lemonade tại Starbucks là sự kết hợp giữa trà hoa dâm bụt có vị chua nhẹ và nước chanh tươi, tạo ra một thức uống mát lạnh, sảng khoái và đầy hương thơm. Món nước này chỉ có thể được tùy chỉnh lạnh.']","Iced Pomegranate Pearls Hibiscus tại Starbucks là món đồ uống mát lạnh kết hợp giữa trà hoa dâm bụt với những viên lựu chua ngọt, mang lại hương vị tươi mới và sảng khoái, hoàn hảo cho những ai yêu thích sự kết hợp giữa trái cây và trà thảo mộc. Món nước này chỉ có thể được tùy chỉnh lạnh."
Món Ruby Grapefruits And Honey Black Tea là gì?,"Một thức uống pha chế từ trà đen đậm đà, nước bưởi ruby tươi mát và mật ong ngọt dịu, tạo ra một thức uống sảng khoái với vị chua nhẹ và ngọt tự nhiên. Chỉ có thể được tùy chỉnh lạnh.","['Ruby Grapefruits And Honey Black Tea: Ruby Grapefruit and Honey Black Tea tại Starbucks là sự kết hợp giữa trà đen đậm đà, nước bưởi ruby tươi mát và mật ong ngọt dịu, tạo ra một thức uống sảng khoái, với vị chua nhẹ và ngọt tự nhiên. Món nước này chỉ có thể được tùy chỉnh lạnh.', 'Honey Ruby Grapefruits Cold Brew: Honey Ruby Grapefruit Cold Brew tại Starbucks là món đá xay kết hợp giữa cold brew đậm đà, sốt bưởi tươi mát và mật ong ngọt dịu, tạo ra một thức uống sảng khoái, có vị chua nhẹ, ngọt tự nhiên và hương cà phê tinh tế.\nCác món đá xay không cà phê tại Starbucks:', 'Mango Passion Fruit: Mango Passion Fruit tại Starbucks là một thức uống tươi mát, kết hợp giữa vị ngọt của xoài và hương chua của trái chanh dây, mang đến một trải nghiệm sảng khoái, hoàn hảo cho những ai yêu thích đồ uống trái cây.\nRaspberry Black Currant: Raspberry Black Currant tại Starbucks là một thức uống ngọt ngào, kết hợp giữa vị chua nhẹ của mâm xôi và hương thơm đặc trưng của quả lý chua đen, tạo ra một trải nghiệm tươi mới và sảng khoái.\nCác món khác:']","Ruby Grapefruit and Honey Black Tea tại Starbucks là sự kết hợp giữa trà đen đậm đà, nước bưởi ruby tươi mát và mật ong ngọt dịu, tạo ra một thức uống sảng khoái, với vị chua nhẹ và ngọt tự nhiên. Món nước này chỉ có thể được tùy chỉnh lạnh."
Món Strawberry Green Tea With Lemonade là gì?,"Món Strawberry Green Tea With Lemonade là sự kết hợp giữa trà xanh nhẹ nhàng, nước chanh tươi và dâu tây ngọt ngào, tạo ra một thức uống mát lạnh, tươi mới và sảng khoái. Món nước này chỉ có thể được tùy chỉnh lạnh.","['Strawberry Green Tea With Lemonade: Strawberry Green Tea with Lemonade tại Starbucks là sự kết hợp giữa trà xanh nhẹ nhàng, nước chanh tươi và dâu tây ngọt ngào, tạo ra một thức uống mát lạnh, tươi mới và sảng khoái. Món nước này chỉ có thể được tùy chỉnh lạnh.\nCác món đá xay có cà phê tại Starbucks:', 'Starbucks Refreshers:\nStrawberry Acai With Lemonade: Refresher Strawberry Acai with Lemonade tại Starbucks là một món đồ uống mát lạnh, kết hợp giữa vị chua ngọt của nước chanh và dâu tây, với hương acai thơm ngon, tạo ra một thức uống tươi mới và sảng khoái. Món nước này có thể được tùy chỉnh nóng hoặc lạnh.', 'Black Tea Lemonade: Black Tea Lemonade tại Starbucks là sự kết hợp giữa trà đen đậm đà và nước chanh tươi, tạo ra một thức uống mát lạnh, vừa đắng vừa chua, sảng khoái và đầy năng lượng. Món nước này chỉ có thể được tùy chỉnh lạnh.\nGreen Tea Lemonade: Green Tea Lemonade tại Starbucks là sự kết hợp giữa trà xanh nhẹ nhàng và nước chanh tươi, tạo ra một thức uống mát lạnh, thanh mát và sảng khoái, lý tưởng cho những ai yêu thích vị trà nhẹ và chua ngọt. Món nước này chỉ có thể được tùy chỉnh lạnh.']","Strawberry Green Tea with Lemonade tại Starbucks là sự kết hợp giữa trà xanh nhẹ nhàng, nước chanh tươi và dâu tây ngọt ngào, tạo ra một thức uống mát lạnh, tươi mới và sảng khoái. Món nước này chỉ có thể được tùy chỉnh lạnh."
Món Java Chip Frappuccino là gì?,"Java Chip Frappuccino là một món đồ uống đá xay tại Starbucks kết hợp giữa cà phê Frappuccino Roast, chocolate chip và sữa, tạo ra một thức uống ngọt ngào, béo ngậy với hương vị cà phê và chocolate đậm đà.","['Các món đá xay có cà phê tại Starbucks:\nJava Chip Frappuccino: Java Chip Frappuccino tại Starbucks là món đồ uống đá xay kết hợp giữa cà phê Frappuccino Roast, chocolate chip và sữa, tạo ra một thức uống ngọt ngào, béo ngậy với hương vị cà phê và chocolate đậm đà, hoàn hảo cho những ai yêu thích sự kết hợp này.', 'Chocolate Chip Cream Frappuccino: Chocolate Chip Cream Frappuccino tại Starbucks là món đồ uống đá xay kết hợp giữa sữa và chocolate chip, tạo ra một thức uống mát lạnh, ngọt ngào với hương vị chocolate đậm đà và sự giòn tan của chocolate chip, hoàn hảo cho những ai yêu thích sự kết hợp này.', 'Coffee Frappuccino: Coffee Frappuccino tại Starbucks là món đồ uống đá xay kết hợp giữa cà phê Frappuccino Roast và sữa tạo ra một thức uống mát lạnh, đậm đà với hương vị cà phê nguyên chất, hoàn hảo cho những ai yêu thích cà phê đá xay tươi mát.\nEspresso Frappuccino: Espresso Frappuccino tại Starbucks là món đồ uống đá xay kết hợp giữa espresso đậm đà và sữa, tạo ra một thức uống mát lạnh, mạnh mẽ với hương vị cà phê espresso nguyên chất, lý tưởng cho những ai yêu thích cà phê mạnh và tươi mới.']","Java Chip Frappuccino tại Starbucks là món đồ uống đá xay kết hợp giữa cà phê Frappuccino Roast, chocolate chip và sữa, tạo ra một thức uống ngọt ngào, béo ngậy với hương vị cà phê và chocolate đậm đà, hoàn hảo cho những ai yêu thích sự kết hợp này."
Món Caramel Frappuccino là gì?,"Caramel Frappuccino là một món đồ uống đá xay tại Starbucks được làm từ cà phê Frappuccino Roast, sữa và syrup caramel ngọt ngào. Nó tạo ra một thức uống mát lạnh, béo ngậy với hương vị caramel thơm lừng, hoàn hảo cho những ai yêu thích sự ngọt ngào và sảng khoái.","['Caramel Frappuccino: Caramel Frappuccino tại Starbucks là món đồ uống đá xay kết hợp giữa cà phê Frappuccino Roast, sữa và syrup caramel ngọt ngào, tạo ra một thức uống mát lạnh, béo ngậy với hương vị caramel thơm lừng, hoàn hảo cho những ai yêu thích sự ngọt ngào và sảng khoái.', 'Các món đá xay không cà phê tại Starbucks: \nCaramel Cream Frappuccino: Caramel Cream Frappuccino tại Starbucks là món đồ uống đá xay kết hợp giữa sữa và syrup caramel ngọt ngào, tạo ra một thức uống mát lạnh, béo ngậy với hương vị caramel thơm lừng, hoàn hảo cho những ai yêu thích sự ngọt ngào và sảng khoái.', 'Chocolate Chip Cream Frappuccino: Chocolate Chip Cream Frappuccino tại Starbucks là món đồ uống đá xay kết hợp giữa sữa và chocolate chip, tạo ra một thức uống mát lạnh, ngọt ngào với hương vị chocolate đậm đà và sự giòn tan của chocolate chip, hoàn hảo cho những ai yêu thích sự kết hợp này.']","Caramel Frappuccino tại Starbucks là món đồ uống đá xay kết hợp giữa cà phê Frappuccino Roast, sữa và syrup caramel ngọt ngào, tạo ra một thức uống mát lạnh, béo ngậy với hương vị caramel thơm lừng, hoàn hảo cho những ai yêu thích sự ngọt ngào và sảng khoái."
Món Almondmilk Hazelnut Frappuccino là gì?,"Almondmilk Hazelnut Frappuccino là một món đồ uống đá xay tại Starbucks kết hợp giữa cà phê Frappuccino Roast, sữa hạnh nhân, syrup hạt phỉ ngọt ngào và đá, tạo ra một thức uống mát lạnh, béo nhẹ với hương vị hạt phỉ đặc trưng.","['Almondmilk Hazelnut Frappuccino: Almondmilk Hazelnut Frappuccino tại Starbucks là món đồ uống đá xay kết hợp giữa cà phê Frappuccino Roast, sữa hạnh nhân, syrup hạt phỉ ngọt ngào và đá, tạo ra một thức uống mát lạnh, béo nhẹ với hương vị hạt phỉ đặc trưng, hoàn hảo cho những ai yêu thích sự ngọt ngào và thơm ngon của hạt phỉ.', 'Almondmilk Hazelnut Cream Frappuccino: Almondmilk Hazelnut Cream Frappuccino tại Starbucks là món đồ uống đá xay kết hợp giữa sữa hạnh nhân, syrup hạt phỉ ngọt ngào và đá, tạo ra một thức uống mát lạnh, béo nhẹ với hương vị hạt phỉ thơm ngon, hoàn hảo cho những ai yêu thích sự ngọt ngào và nhẹ nhàng của hạt phỉ.', 'Almondmilk Hazelnut Latte: Almondmilk Hazelnut Latte là sự kết hợp giữa espresso, sữa hạnh nhân và syrup hạt phỉ, tạo ra hương vị cà phê đậm đà, ngọt nhẹ với một chút hương vị hạt phỉ thơm lừng. Là lựa chọn hoàn hảo cho những ai thích cà phê không sữa bò và vị thơm của hạt phỉ. Món nước có thể được tùy chỉnh nóng hoặc lạnh.']","Almondmilk Hazelnut Frappuccino tại Starbucks là món đồ uống đá xay kết hợp giữa cà phê Frappuccino Roast, sữa hạnh nhân, syrup hạt phỉ ngọt ngào và đá, tạo ra một thức uống mát lạnh, béo nhẹ với hương vị hạt phỉ đặc trưng, hoàn hảo cho những ai yêu thích sự ngọt ngào và thơm ngon của hạt phỉ."
Món Mocha Frappuccino là gì?,"Mocha Frappuccino là sự kết hợp giữa espresso Frappuccino Roast, sữa và syrup chocolate, tạo ra một thức uống ngọt ngào, béo ngậy với hương vị cà phê và chocolate đậm đà.","['Mocha Frappuccino: Mocha Frappuccino tại Starbucks là món đồ uống đá xay kết hợp giữa cà phê Frappuccino Roast, sữa và syrup chocolate, tạo ra một thức uống ngọt ngào, béo ngậy với hương vị cà phê và chocolate đậm đà, hoàn hảo cho những ai yêu thích sự kết hợp giữa cà phê và chocolate.', 'Mocha: Caffe Mocha là sự kết hợp giữa espresso, sữa tươi và syrup chocolate, tạo ra một món cà phê ngọt ngào, đậm đà với hương vị chocolate thơm lừng. Món này thường được thưởng thức với một lớp kem tươi (whipped cream) ở trên. Món nước này có thể được tùy chỉnh nóng hoặc lạnh.', 'Coffee Frappuccino: Coffee Frappuccino tại Starbucks là món đồ uống đá xay kết hợp giữa cà phê Frappuccino Roast và sữa tạo ra một thức uống mát lạnh, đậm đà với hương vị cà phê nguyên chất, hoàn hảo cho những ai yêu thích cà phê đá xay tươi mát.\nEspresso Frappuccino: Espresso Frappuccino tại Starbucks là món đồ uống đá xay kết hợp giữa espresso đậm đà và sữa, tạo ra một thức uống mát lạnh, mạnh mẽ với hương vị cà phê espresso nguyên chất, lý tưởng cho những ai yêu thích cà phê mạnh và tươi mới.']","Mocha Frappuccino tại Starbucks là món đồ uống đá xay kết hợp giữa cà phê Frappuccino Roast, sữa và syrup chocolate, tạo ra một thức uống ngọt ngào, béo ngậy với hương vị cà phê và chocolate đậm đà, hoàn hảo cho những ai yêu thích sự kết hợp giữa cà phê và chocolate."
Món Coffee Frappuccino là gì?,"Coffee Frappuccino là một món đồ uống đá xay kết hợp giữa cà phê Frappuccino Roast và sữa, tạo ra một thức uống mát lạnh, đậm đà với hương vị cà phê nguyên chất.","['Coffee Frappuccino: Coffee Frappuccino tại Starbucks là món đồ uống đá xay kết hợp giữa cà phê Frappuccino Roast và sữa tạo ra một thức uống mát lạnh, đậm đà với hương vị cà phê nguyên chất, hoàn hảo cho những ai yêu thích cà phê đá xay tươi mát.\nEspresso Frappuccino: Espresso Frappuccino tại Starbucks là món đồ uống đá xay kết hợp giữa espresso đậm đà và sữa, tạo ra một thức uống mát lạnh, mạnh mẽ với hương vị cà phê espresso nguyên chất, lý tưởng cho những ai yêu thích cà phê mạnh và tươi mới.', 'Caramel Frappuccino: Caramel Frappuccino tại Starbucks là món đồ uống đá xay kết hợp giữa cà phê Frappuccino Roast, sữa và syrup caramel ngọt ngào, tạo ra một thức uống mát lạnh, béo ngậy với hương vị caramel thơm lừng, hoàn hảo cho những ai yêu thích sự ngọt ngào và sảng khoái.', 'Brown Sugar Cocoa Oatmilk Frappuccino: Brown Sugar Cocoa Oatmilk Frappuccino tại Starbucks là món đồ uống đá xay kết hợp giữa cà phê Frappuccino Roast, sữa yến mạch, syrup đường nâu, bột cacao, chocolate và đá, tạo ra một thức uống ngọt ngào, béo nhẹ với hương vị đường nâu và chocolate, hoàn hảo cho những ai yêu thích sự kết hợp này.']","Coffee Frappuccino tại Starbucks là món đồ uống đá xay kết hợp giữa cà phê Frappuccino Roast và sữa tạo ra một thức uống mát lạnh, đậm đà với hương vị cà phê nguyên chất, hoàn hảo cho những ai yêu thích cà phê đá xay tươi mát."
Món Espresso Frappuccino là gì?,"Món Espresso Frappuccino là một món đồ uống đá xay tại Starbucks được làm từ espresso đậm đà và sữa, tạo ra một thức uống mát lạnh, mạnh mẽ với hương vị cà phê espresso nguyên chất.","['Coffee Frappuccino: Coffee Frappuccino tại Starbucks là món đồ uống đá xay kết hợp giữa cà phê Frappuccino Roast và sữa tạo ra một thức uống mát lạnh, đậm đà với hương vị cà phê nguyên chất, hoàn hảo cho những ai yêu thích cà phê đá xay tươi mát.\nEspresso Frappuccino: Espresso Frappuccino tại Starbucks là món đồ uống đá xay kết hợp giữa espresso đậm đà và sữa, tạo ra một thức uống mát lạnh, mạnh mẽ với hương vị cà phê espresso nguyên chất, lý tưởng cho những ai yêu thích cà phê mạnh và tươi mới.', 'Mocha Frappuccino: Mocha Frappuccino tại Starbucks là món đồ uống đá xay kết hợp giữa cà phê Frappuccino Roast, sữa và syrup chocolate, tạo ra một thức uống ngọt ngào, béo ngậy với hương vị cà phê và chocolate đậm đà, hoàn hảo cho những ai yêu thích sự kết hợp giữa cà phê và chocolate.', 'Caramel Frappuccino: Caramel Frappuccino tại Starbucks là món đồ uống đá xay kết hợp giữa cà phê Frappuccino Roast, sữa và syrup caramel ngọt ngào, tạo ra một thức uống mát lạnh, béo ngậy với hương vị caramel thơm lừng, hoàn hảo cho những ai yêu thích sự ngọt ngào và sảng khoái.']","Espresso Frappuccino tại Starbucks là món đồ uống đá xay kết hợp giữa espresso đậm đà và sữa, tạo ra một thức uống mát lạnh, mạnh mẽ với hương vị cà phê espresso nguyên chất, lý tưởng cho những ai yêu thích cà phê mạnh và tươi mới."
Món Brown Sugar Cocoa Oatmilk Frappuccino là gì?,"Món Brown Sugar Cocoa Oatmilk Frappuccino là một thức uống đá xay tại Starbucks kết hợp giữa cà phê Frappuccino Roast, sữa yến mạch, syrup đường nâu, bột cacao, chocolate và đá, tạo ra một thức uống ngọt ngào, béo nhẹ với hương vị đường nâu và chocolate.","['Brown Sugar Cocoa Oatmilk Frappuccino: Brown Sugar Cocoa Oatmilk Frappuccino tại Starbucks là món đồ uống đá xay kết hợp giữa cà phê Frappuccino Roast, sữa yến mạch, syrup đường nâu, bột cacao, chocolate và đá, tạo ra một thức uống ngọt ngào, béo nhẹ với hương vị đường nâu và chocolate, hoàn hảo cho những ai yêu thích sự kết hợp này.', 'Brown Sugar Cocoa Oatmilk Cream Frappuccino: Brown Sugar Cocoa Oatmilk Cream Frappuccino tại Starbucks là món đồ uống đá xay kết hợp giữa sữa yến mạch, syrup đường nâu, bột cacao, chocolate và đá, tạo ra một thức uống ngọt ngào, béo nhẹ với hương vị đường nâu và chocolate, hoàn hảo cho những ai yêu thích sự kết hợp giữa ngọt và thơm.', 'Mocha Frappuccino: Mocha Frappuccino tại Starbucks là món đồ uống đá xay kết hợp giữa cà phê Frappuccino Roast, sữa và syrup chocolate, tạo ra một thức uống ngọt ngào, béo ngậy với hương vị cà phê và chocolate đậm đà, hoàn hảo cho những ai yêu thích sự kết hợp giữa cà phê và chocolate.']","Brown Sugar Cocoa Oatmilk Frappuccino tại Starbucks là món đồ uống đá xay kết hợp giữa cà phê Frappuccino Roast, sữa yến mạch, syrup đường nâu, bột cacao, chocolate và đá, tạo ra một thức uống ngọt ngào, béo nhẹ với hương vị đường nâu và chocolate, hoàn hảo cho những ai yêu thích sự kết hợp này."
Món Honey Ruby Grapefruits Cold Brew là gì?,"Honey Ruby Grapefruits Cold Brew là một loại đá xay tại Starbucks kết hợp giữa cold brew đậm đà, sốt bưởi tươi mát và mật ong ngọt dịu để tạo ra một thức uống sảng khoái, có vị chua nhẹ, ngọt tự nhiên và hương cà phê tinh tế.","['Honey Ruby Grapefruits Cold Brew: Honey Ruby Grapefruit Cold Brew tại Starbucks là món đá xay kết hợp giữa cold brew đậm đà, sốt bưởi tươi mát và mật ong ngọt dịu, tạo ra một thức uống sảng khoái, có vị chua nhẹ, ngọt tự nhiên và hương cà phê tinh tế.\nCác món đá xay không cà phê tại Starbucks:', 'Ruby Grapefruits And Honey Black Tea: Ruby Grapefruit and Honey Black Tea tại Starbucks là sự kết hợp giữa trà đen đậm đà, nước bưởi ruby tươi mát và mật ong ngọt dịu, tạo ra một thức uống sảng khoái, với vị chua nhẹ và ngọt tự nhiên. Món nước này chỉ có thể được tùy chỉnh lạnh.', 'Cold Brew: Cold Brew là loai cà phê ủ lạnh trong nhiều giờ, mang đến hương vị đậm đà, mượt mà với ít độ chua hơn cà phê pha nóng. Món này rất mát lạnh và sảng khoái, hoàn hảo cho những ai yêu thích cà phê nguyên chất. Món nước này chỉ có thể được tùy chỉnh lạnh.']","Honey Ruby Grapefruit Cold Brew tại Starbucks là món đá xay kết hợp giữa cold brew đậm đà, sốt bưởi tươi mát và mật ong ngọt dịu, tạo ra một thức uống sảng khoái, có vị chua nhẹ, ngọt tự nhiên và hương cà phê tinh tế."
Món Caramel Cream Frappuccino là gì?,"Caramel Cream Frappuccino là một món đồ uống đá xay tại Starbucks kết hợp giữa sữa và syrup caramel ngọt ngào, tạo ra một thức uống mát lạnh, béo ngậy với hương vị caramel thơm lừng, hoàn hảo cho những ai yêu thích sự ngọt ngào và sảng khoái.","['Caramel Frappuccino: Caramel Frappuccino tại Starbucks là món đồ uống đá xay kết hợp giữa cà phê Frappuccino Roast, sữa và syrup caramel ngọt ngào, tạo ra một thức uống mát lạnh, béo ngậy với hương vị caramel thơm lừng, hoàn hảo cho những ai yêu thích sự ngọt ngào và sảng khoái.', 'Các món đá xay không cà phê tại Starbucks: \nCaramel Cream Frappuccino: Caramel Cream Frappuccino tại Starbucks là món đồ uống đá xay kết hợp giữa sữa và syrup caramel ngọt ngào, tạo ra một thức uống mát lạnh, béo ngậy với hương vị caramel thơm lừng, hoàn hảo cho những ai yêu thích sự ngọt ngào và sảng khoái.', 'Vanilla Cream Frappuccino: Vanilla Cream Frappuccino tại Starbucks là món đồ uống đá xay kết hợp giữa sữa và syrup vanilla ngọt ngào, tạo ra một thức uống mát lạnh, béo ngậy với hương vị vanilla thơm nhẹ, lý tưởng cho những ai yêu thích sự ngọt ngào và nhẹ nhàng.']","Caramel Cream Frappuccino tại Starbucks là món đồ uống đá xay kết hợp giữa sữa và syrup caramel ngọt ngào, tạo ra một thức uống mát lạnh, béo ngậy với hương vị caramel thơm lừng, hoàn hảo cho những ai yêu thích sự ngọt ngào và sảng khoái."
Món Vanilla Cream Frappuccino là gì?,"Vanilla Cream Frappuccino là một món đồ uống đá xay tại Starbucks với sữa, syrup vanilla ngọt ngào, tạo ra một thức uống mát lạnh, béo ngậy với hương vị vanilla thơm nhẹ.","['Vanilla Cream Frappuccino: Vanilla Cream Frappuccino tại Starbucks là món đồ uống đá xay kết hợp giữa sữa và syrup vanilla ngọt ngào, tạo ra một thức uống mát lạnh, béo ngậy với hương vị vanilla thơm nhẹ, lý tưởng cho những ai yêu thích sự ngọt ngào và nhẹ nhàng.', 'Các món đá xay không cà phê tại Starbucks: \nCaramel Cream Frappuccino: Caramel Cream Frappuccino tại Starbucks là món đồ uống đá xay kết hợp giữa sữa và syrup caramel ngọt ngào, tạo ra một thức uống mát lạnh, béo ngậy với hương vị caramel thơm lừng, hoàn hảo cho những ai yêu thích sự ngọt ngào và sảng khoái.', 'Brown Sugar Cocoa Oatmilk Cream Frappuccino: Brown Sugar Cocoa Oatmilk Cream Frappuccino tại Starbucks là món đồ uống đá xay kết hợp giữa sữa yến mạch, syrup đường nâu, bột cacao, chocolate và đá, tạo ra một thức uống ngọt ngào, béo nhẹ với hương vị đường nâu và chocolate, hoàn hảo cho những ai yêu thích sự kết hợp giữa ngọt và thơm.']","Vanilla Cream Frappuccino tại Starbucks là món đồ uống đá xay kết hợp giữa sữa và syrup vanilla ngọt ngào, tạo ra một thức uống mát lạnh, béo ngậy với hương vị vanilla thơm nhẹ, lý tưởng cho những ai yêu thích sự ngọt ngào và nhẹ nhàng."
Món Chocolate Chip Cream Frappuccino là gì?,"Chocolate Chip Cream Frappuccino là một món đồ uống đá xay kết hợp giữa sữa và chocolate chip, tạo ra một thức uống mát lạnh, ngọt ngào với hương vị chocolate đậm đà và sự giòn tan của chocolate chip.","['Chocolate Chip Cream Frappuccino: Chocolate Chip Cream Frappuccino tại Starbucks là món đồ uống đá xay kết hợp giữa sữa và chocolate chip, tạo ra một thức uống mát lạnh, ngọt ngào với hương vị chocolate đậm đà và sự giòn tan của chocolate chip, hoàn hảo cho những ai yêu thích sự kết hợp này.', 'Brown Sugar Cocoa Oatmilk Cream Frappuccino: Brown Sugar Cocoa Oatmilk Cream Frappuccino tại Starbucks là món đồ uống đá xay kết hợp giữa sữa yến mạch, syrup đường nâu, bột cacao, chocolate và đá, tạo ra một thức uống ngọt ngào, béo nhẹ với hương vị đường nâu và chocolate, hoàn hảo cho những ai yêu thích sự kết hợp giữa ngọt và thơm.', 'Các món đá xay không cà phê tại Starbucks: \nCaramel Cream Frappuccino: Caramel Cream Frappuccino tại Starbucks là món đồ uống đá xay kết hợp giữa sữa và syrup caramel ngọt ngào, tạo ra một thức uống mát lạnh, béo ngậy với hương vị caramel thơm lừng, hoàn hảo cho những ai yêu thích sự ngọt ngào và sảng khoái.']","Chocolate Chip Cream Frappuccino tại Starbucks là món đồ uống đá xay kết hợp giữa sữa và chocolate chip, tạo ra một thức uống mát lạnh, ngọt ngào với hương vị chocolate đậm đà và sự giòn tan của chocolate chip, hoàn hảo cho những ai yêu thích sự kết hợp này."
Món Almondmilk Hazelnut Cream Frappuccino là gì?,"Almondmilk Hazelnut Cream Frappuccino là một món đồ uống đá xay tại Starbucks kết hợp giữa sữa hạnh nhân, syrup hạt phỉ ngọt ngào và đá, tạo ra một thức uống mát lạnh, béo nhẹ với hương vị hạt phỉ thơm ngon.","['Almondmilk Hazelnut Cream Frappuccino: Almondmilk Hazelnut Cream Frappuccino tại Starbucks là món đồ uống đá xay kết hợp giữa sữa hạnh nhân, syrup hạt phỉ ngọt ngào và đá, tạo ra một thức uống mát lạnh, béo nhẹ với hương vị hạt phỉ thơm ngon, hoàn hảo cho những ai yêu thích sự ngọt ngào và nhẹ nhàng của hạt phỉ.', 'Almondmilk Hazelnut Frappuccino: Almondmilk Hazelnut Frappuccino tại Starbucks là món đồ uống đá xay kết hợp giữa cà phê Frappuccino Roast, sữa hạnh nhân, syrup hạt phỉ ngọt ngào và đá, tạo ra một thức uống mát lạnh, béo nhẹ với hương vị hạt phỉ đặc trưng, hoàn hảo cho những ai yêu thích sự ngọt ngào và thơm ngon của hạt phỉ.', 'Almondmilk Hazelnut Latte: Almondmilk Hazelnut Latte là sự kết hợp giữa espresso, sữa hạnh nhân và syrup hạt phỉ, tạo ra hương vị cà phê đậm đà, ngọt nhẹ với một chút hương vị hạt phỉ thơm lừng. Là lựa chọn hoàn hảo cho những ai thích cà phê không sữa bò và vị thơm của hạt phỉ. Món nước có thể được tùy chỉnh nóng hoặc lạnh.']","Almondmilk Hazelnut Cream Frappuccino tại Starbucks là món đồ uống đá xay kết hợp giữa sữa hạnh nhân, syrup hạt phỉ ngọt ngào và đá, tạo ra một thức uống mát lạnh, béo nhẹ với hương vị hạt phỉ thơm ngon, hoàn hảo cho những ai yêu thích sự ngọt ngào và nhẹ nhàng của hạt phỉ."
Món Green Tea Cream Frappuccino là gì?,"Green Tea Cream Frappuccino tại Starbucks là món đồ uống đá xay kết hợp giữa trà xanh matcha và sữa, tạo ra một thức uống mát lạnh, ngọt ngào với hương vị trà xanh thanh nhẹ và béo ngậy.","['Green Tea Cream Frappuccino: Green Tea Cream Frappuccino tại Starbucks là món đồ uống đá xay kết hợp giữa trà xanh matcha và sữa, tạo ra một thức uống mát lạnh, ngọt ngào với hương vị trà xanh thanh nhẹ và béo ngậy, lý tưởng cho những ai yêu thích trà xanh.', 'Brown Sugar Cocoa Oatmilk Frappuccino: Brown Sugar Cocoa Oatmilk Frappuccino tại Starbucks là món đồ uống đá xay kết hợp giữa cà phê Frappuccino Roast, sữa yến mạch, syrup đường nâu, bột cacao, chocolate và đá, tạo ra một thức uống ngọt ngào, béo nhẹ với hương vị đường nâu và chocolate, hoàn hảo cho những ai yêu thích sự kết hợp này.', 'Chocolate Chip Cream Frappuccino: Chocolate Chip Cream Frappuccino tại Starbucks là món đồ uống đá xay kết hợp giữa sữa và chocolate chip, tạo ra một thức uống mát lạnh, ngọt ngào với hương vị chocolate đậm đà và sự giòn tan của chocolate chip, hoàn hảo cho những ai yêu thích sự kết hợp này.']","Green Tea Cream Frappuccino tại Starbucks là món đồ uống đá xay kết hợp giữa trà xanh matcha và sữa, tạo ra một thức uống mát lạnh, ngọt ngào với hương vị trà xanh thanh nhẹ và béo ngậy, lý tưởng cho những ai yêu thích trà xanh."
Món Strawberry And Cream Frappuccino là gì?,"Món Strawberry and Cream Frappuccino tại Starbucks là một thức uống đá xay kết hợp giữa dâu tây tươi và sữa, tạo ra một thức uống ngọt ngào, béo ngậy với hương vị dâu tây thơm mát.","['Strawberry And Cream Frappuccino: Strawberry and Cream Frappuccino tại Starbucks là món đồ uống đá xay kết hợp giữa dâu tây tươi và sữa, tạo ra một thức uống ngọt ngào, béo ngậy với hương vị dâu tây thơm mát, hoàn hảo cho những ai yêu thích sự kết hợp trái cây và kem.', 'Vanilla Cream Frappuccino: Vanilla Cream Frappuccino tại Starbucks là món đồ uống đá xay kết hợp giữa sữa và syrup vanilla ngọt ngào, tạo ra một thức uống mát lạnh, béo ngậy với hương vị vanilla thơm nhẹ, lý tưởng cho những ai yêu thích sự ngọt ngào và nhẹ nhàng.', 'Chocolate Chip Cream Frappuccino: Chocolate Chip Cream Frappuccino tại Starbucks là món đồ uống đá xay kết hợp giữa sữa và chocolate chip, tạo ra một thức uống mát lạnh, ngọt ngào với hương vị chocolate đậm đà và sự giòn tan của chocolate chip, hoàn hảo cho những ai yêu thích sự kết hợp này.']","Strawberry and Cream Frappuccino tại Starbucks là món đồ uống đá xay kết hợp giữa dâu tây tươi và sữa, tạo ra một thức uống ngọt ngào, béo ngậy với hương vị dâu tây thơm mát, hoàn hảo cho những ai yêu thích sự kết hợp trái cây và kem."
Món Brown Sugar Cocoa Oatmilk Cream Frappuccino là gì?,"Món Brown Sugar Cocoa Oatmilk Cream Frappuccino là một thức uống đá xay kết hợp giữa sữa yến mạch, syrup đường nâu, bột cacao, chocolate và đá, tạo ra một thức uống ngọt ngào, béo nhẹ với hương vị đường nâu và chocolate.","['Brown Sugar Cocoa Oatmilk Frappuccino: Brown Sugar Cocoa Oatmilk Frappuccino tại Starbucks là món đồ uống đá xay kết hợp giữa cà phê Frappuccino Roast, sữa yến mạch, syrup đường nâu, bột cacao, chocolate và đá, tạo ra một thức uống ngọt ngào, béo nhẹ với hương vị đường nâu và chocolate, hoàn hảo cho những ai yêu thích sự kết hợp này.', 'Brown Sugar Cocoa Oatmilk Cream Frappuccino: Brown Sugar Cocoa Oatmilk Cream Frappuccino tại Starbucks là món đồ uống đá xay kết hợp giữa sữa yến mạch, syrup đường nâu, bột cacao, chocolate và đá, tạo ra một thức uống ngọt ngào, béo nhẹ với hương vị đường nâu và chocolate, hoàn hảo cho những ai yêu thích sự kết hợp giữa ngọt và thơm.', 'Mocha Frappuccino: Mocha Frappuccino tại Starbucks là món đồ uống đá xay kết hợp giữa cà phê Frappuccino Roast, sữa và syrup chocolate, tạo ra một thức uống ngọt ngào, béo ngậy với hương vị cà phê và chocolate đậm đà, hoàn hảo cho những ai yêu thích sự kết hợp giữa cà phê và chocolate.']","Brown Sugar Cocoa Oatmilk Cream Frappuccino tại Starbucks là món đồ uống đá xay kết hợp giữa sữa yến mạch, syrup đường nâu, bột cacao, chocolate và đá, tạo ra một thức uống ngọt ngào, béo nhẹ với hương vị đường nâu và chocolate, hoàn hảo cho những ai yêu thích sự kết hợp giữa ngọt và thơm."
Món Mango Passion Fruit là gì?,"Mango Passion Fruit là một thức uống tươi mát, kết hợp giữa vị ngọt của xoài và hương chua của trái chanh dây tại Starbucks.","['Mango Passion Fruit: Mango Passion Fruit tại Starbucks là một thức uống tươi mát, kết hợp giữa vị ngọt của xoài và hương chua của trái chanh dây, mang đến một trải nghiệm sảng khoái, hoàn hảo cho những ai yêu thích đồ uống trái cây.\nRaspberry Black Currant: Raspberry Black Currant tại Starbucks là một thức uống ngọt ngào, kết hợp giữa vị chua nhẹ của mâm xôi và hương thơm đặc trưng của quả lý chua đen, tạo ra một trải nghiệm tươi mới và sảng khoái.\nCác món khác:', 'Mango Dragonfruit With Lemonade: Mango Dragonfruit with Lemonade Refresher tại Starbucks là một món đồ uống mát lạnh, kết hợp giữa nước chanh tươi và hương vị ngọt ngào của xoài và thanh long, mang lại cảm giác sảng khoái, tươi mới và đầy năng lượng. Món nước này chỉ có thể được tùy chỉnh lạnh.', 'Dragon Drink With Mango Dragonfruit: Dragon Drink with Mango Dragonfruit Refresher tại Starbucks là món đồ uống mát lạnh kết hợp giữa hương vị của xoài và thanh long cùng với sữa dừa, tạo ra một thức uống ngọt ngào, tươi mát với hương xoài và thanh long thơm ngon. Món nước này chỉ có thể được tùy chỉnh lạnh.\nCà món trà lắc:\nStarbucks cung cấp 6 loại trà lắc cho bạn lựa chọn:']","Mango Passion Fruit tại Starbucks là một thức uống tươi mát, kết hợp giữa vị ngọt của xoài và hương chua của trái chanh dây, mang đến một trải nghiệm sảng khoái, hoàn hảo cho những ai yêu thích đồ uống trái cây."
Món Raspberry Black Currant là gì?,"Raspberry Black Currant là một thức uống ngọt ngào, kết hợp giữa vị chua nhẹ của mâm xôi và hương thơm đặc trưng của quả lý đen, tạo ra một trải nghiệm tươi mới và sảng khoái.","['Mango Passion Fruit: Mango Passion Fruit tại Starbucks là một thức uống tươi mát, kết hợp giữa vị ngọt của xoài và hương chua của trái chanh dây, mang đến một trải nghiệm sảng khoái, hoàn hảo cho những ai yêu thích đồ uống trái cây.\nRaspberry Black Currant: Raspberry Black Currant tại Starbucks là một thức uống ngọt ngào, kết hợp giữa vị chua nhẹ của mâm xôi và hương thơm đặc trưng của quả lý chua đen, tạo ra một trải nghiệm tươi mới và sảng khoái.\nCác món khác:', 'Ruby Grapefruits And Honey Black Tea: Ruby Grapefruit and Honey Black Tea tại Starbucks là sự kết hợp giữa trà đen đậm đà, nước bưởi ruby tươi mát và mật ong ngọt dịu, tạo ra một thức uống sảng khoái, với vị chua nhẹ và ngọt tự nhiên. Món nước này chỉ có thể được tùy chỉnh lạnh.', 'Earl Grey: Trà túi lọc Earl Grey tại Starbucks là trà đen hảo hạng, pha với hương tinh dầu cam bergamot, tạo nên vị trà đậm đà, thơm mát và thanh lịch, rất thích hợp để thư giãn và thưởng thức. Món nước này có thể được tùy chỉnh nóng hoặc lạnh.\nEnglish Breakfast: Trà túi lọc English Breakfast tại Starbucks là loại trà đen truyền thống, có hương vị đậm đà và mạnh mẽ, lý tưởng để thưởng thức vào buổi sáng hoặc kết hợp với sữa để thêm phần béo ngậy. Món nước này có thể được tùy chỉnh nóng hoặc lạnh.']","Raspberry Black Currant tại Starbucks là một thức uống ngọt ngào, kết hợp giữa vị chua nhẹ của mâm xôi và hương thơm đặc trưng của quả lý chua đen, tạo ra một trải nghiệm tươi mới và sảng khoái."
Món Signature Chocolate là gì?,"Signature Chocolate tại Starbucks là một món đồ uống ngọt ngào, kết hợp giữa chocolate độc quyền đậm đà và kem mịn, mang đến một trải nghiệm béo ngậy, thơm lừng và hoàn hảo cho những ai yêu thích hương vị chocolate. Món nước này có thể được tùy chỉnh nóng hoặc lạnh.","['Các món khác: \nSignature Chocolate: Signature Chocolate tại Starbucks là một món đồ uống ngọt ngào, kết hợp giữa chocolate độc quyền đậm đà và kem mịn, mang đến một trải nghiệm béo ngậy, thơm lừng và hoàn hảo cho những ai yêu thích hương vị chocolate. Món nước này có thể được tùy chỉnh nóng hoặc lạnh.', 'Các món nước liên quan tới trà xanh tại Starbucks là gì?\nStarbucks phục vụ các món nước có nguyên liệu trà xanh từ: Pure Matcha Latte, Pure Matcha Espresso Fusion, Green Tea Cream \nCác món nước liên quan tới chocolate tại Starbucks là gì?\nStarbucks phục vụ các món nước có nguyên liệu chocolate từ: Signature Chocolate, Mocha, Java Chip Frappuccino, Chocolate Chip Cream Frappuccino.\nMón cà phê đậm đặc nhất tại Starbucks là gì?', 'Thẻ Starbucks eGift\nThẻ Starbucks eGift là một thẻ Starbucks ảo ẩn danh có giá trị trả trước và chức năng tương tự như Thẻ Starbucks vật lý, và được tặng cho người mà bạn yêu thương thông qua trang web hoặc Ứng Dụng Di Động một lần để họ sử dụng theo Điều khoản Sử Dụng này. Mỗi Thẻ Starbucks eGift được nhận dạng bằng số thẻ, mã bảo mật (CSC) và mã vạch của thẻ.']","Signature Chocolate tại Starbucks là một món đồ uống ngọt ngào, kết hợp giữa chocolate độc quyền đậm đà và kem mịn, mang đến một trải nghiệm béo ngậy, thơm lừng và hoàn hảo cho những ai yêu thích hương vị chocolate. Món nước này có thể được tùy chỉnh nóng hoặc lạnh."
Món Pure Matcha Latte là gì?,"Pure Matcha Latte là một món đồ uống kết hợp giữa bột matcha xanh mịn và sữa, tạo ra một thức uống nhẹ nhàng, thanh mát với hương vị trà xanh đậm đà và béo ngậy. Món nước này có thể được tùy chỉnh nóng hoặc lạnh.","['Pure Matcha Latte: Pure Matcha Latte tại Starbucks là món đồ uống kết hợp giữa bột matcha xanh mịn và sữa, tạo ra một thức uống nhẹ nhàng, thanh mát với hương vị trà xanh đậm đà và béo ngậy. Món nước này có thể được tùy chỉnh nóng hoặc lạnh.\nChai Latte: Chai Latte tại Starbucks là món đồ uống kết hợp giữa trà chai gia vị ấm áp và sữa, tạo ra một thức uống ngọt ngào, đậm đà với hương vị cay nhẹ và mùi thơm của các loại gia vị như quế, gừng và đinh hương. Món nước này có thể được tùy chỉnh nóng hoặc lạnh.', 'Matcha Espresso Fusion: Matcha Espresso Fusion tại Starbucks là món đồ uống kết hợp giữa bột matcha xanh mịn, sữa tươi và espresso đậm đà, tạo ra một thức uống độc đáo với sự hòa quyện giữa vị trà xanh nhẹ nhàng và cà phê mạnh mẽ, mang đến trải nghiệm mới mẻ và sảng khoái. Món nước này có thể được tùy chỉnh nóng hoặc lạnh.', 'Các món nước liên quan tới trà xanh tại Starbucks là gì?\nStarbucks phục vụ các món nước có nguyên liệu trà xanh từ: Pure Matcha Latte, Pure Matcha Espresso Fusion, Green Tea Cream \nCác món nước liên quan tới chocolate tại Starbucks là gì?\nStarbucks phục vụ các món nước có nguyên liệu chocolate từ: Signature Chocolate, Mocha, Java Chip Frappuccino, Chocolate Chip Cream Frappuccino.\nMón cà phê đậm đặc nhất tại Starbucks là gì?']","Pure Matcha Latte tại Starbucks là món đồ uống kết hợp giữa bột matcha xanh mịn và sữa, tạo ra một thức uống nhẹ nhàng, thanh mát với hương vị trà xanh đậm đà và béo ngậy. Món nước này có thể được tùy chỉnh nóng hoặc lạnh."
Món Chai Latte là gì?,"Chai Latte là sự kết hợp giữa trà chai gia vị ấm áp và sữa, tạo ra một thức uống ngọt ngào, đậm đà với hương vị cay nhẹ và mùi thơm của các loại gia vị như quế, gừng và đinh hương. Món nước này có thể được tùy chỉnh nóng hoặc lạnh.","['Latte: Caffe Latte là sự pha trộn mượt mà giữa espresso và sữa tươi, tạo nên hương vị nhẹ nhàng, béo ngậy. Là sự lựa chọn hoàn hảo cho những ai thích cà phê dịu nhẹ, dễ uống. Món nước có thể được tùy chọn nóng hoặc lạnh.', 'Pure Matcha Latte: Pure Matcha Latte tại Starbucks là món đồ uống kết hợp giữa bột matcha xanh mịn và sữa, tạo ra một thức uống nhẹ nhàng, thanh mát với hương vị trà xanh đậm đà và béo ngậy. Món nước này có thể được tùy chỉnh nóng hoặc lạnh.\nChai Latte: Chai Latte tại Starbucks là món đồ uống kết hợp giữa trà chai gia vị ấm áp và sữa, tạo ra một thức uống ngọt ngào, đậm đà với hương vị cay nhẹ và mùi thơm của các loại gia vị như quế, gừng và đinh hương. Món nước này có thể được tùy chỉnh nóng hoặc lạnh.', 'Asian Dolce Latte: Asian Dolce Latte là sự kết hợp giữa espresso, sữa ít béo và syrup asian dolce (hương vị giống với sữa đặc) tạo ra một món cà phê quen thuộc tương tự như món cà phê bạc xỉu Việt Nam, món Asian Dolce Latte được thưởng thức với một lớp kem tươi ở trên. Món nước này có thể được tùy chỉnh nóng hoặc lạnh.']","Chai Latte tại Starbucks là món đồ uống kết hợp giữa trà chai gia vị ấm áp và sữa, tạo ra một thức uống ngọt ngào, đậm đà với hương vị cay nhẹ và mùi thơm của các loại gia vị như quế, gừng và đinh hương. Món nước này có thể được tùy chỉnh nóng hoặc lạnh."
Món Matcha Espresso Fusion là gì?,"Matcha Espresso Fusion là một thức uống độc đáo với sự hòa quyện giữa vị trà xanh nhẹ nhàng và cà phê mạnh mẽ, kết hợp bột matcha xanh mịn, sữa tươi và espresso đậm đà. Nó có thể được tùy chỉnh nóng hoặc lạnh.","['Matcha Espresso Fusion: Matcha Espresso Fusion tại Starbucks là món đồ uống kết hợp giữa bột matcha xanh mịn, sữa tươi và espresso đậm đà, tạo ra một thức uống độc đáo với sự hòa quyện giữa vị trà xanh nhẹ nhàng và cà phê mạnh mẽ, mang đến trải nghiệm mới mẻ và sảng khoái. Món nước này có thể được tùy chỉnh nóng hoặc lạnh.', 'Pure Matcha Latte: Pure Matcha Latte tại Starbucks là món đồ uống kết hợp giữa bột matcha xanh mịn và sữa, tạo ra một thức uống nhẹ nhàng, thanh mát với hương vị trà xanh đậm đà và béo ngậy. Món nước này có thể được tùy chỉnh nóng hoặc lạnh.\nChai Latte: Chai Latte tại Starbucks là món đồ uống kết hợp giữa trà chai gia vị ấm áp và sữa, tạo ra một thức uống ngọt ngào, đậm đà với hương vị cay nhẹ và mùi thơm của các loại gia vị như quế, gừng và đinh hương. Món nước này có thể được tùy chỉnh nóng hoặc lạnh.', 'Mocha Frappuccino: Mocha Frappuccino tại Starbucks là món đồ uống đá xay kết hợp giữa cà phê Frappuccino Roast, sữa và syrup chocolate, tạo ra một thức uống ngọt ngào, béo ngậy với hương vị cà phê và chocolate đậm đà, hoàn hảo cho những ai yêu thích sự kết hợp giữa cà phê và chocolate.']","Matcha Espresso Fusion tại Starbucks là món đồ uống kết hợp giữa bột matcha xanh mịn, sữa tươi và espresso đậm đà, tạo ra một thức uống độc đáo với sự hòa quyện giữa vị trà xanh nhẹ nhàng và cà phê mạnh mẽ, mang đến trải nghiệm mới mẻ và sảng khoái. Món nước này có thể được tùy chỉnh nóng hoặc lạnh."
Món Steamed Milk là gì?,"Steamed Milk tại Starbucks là sữa được hấp nóng, tạo ra một kết cấu mịn màng và béo ngậy, thường được dùng làm cơ sở cho các món cà phê như latte và cappuccino.","['Steamed Milk: Steamed Milk tại Starbucks là sữa được hấp nóng, tạo ra một kết cấu mịn màng và béo ngậy, thường được dùng làm cơ sở cho các món cà phê như latte và cappuccino. Món nước này có thể được tùy chỉnh nóng hoặc lạnh.\nCác lựa chọn tùy chỉnh khi đặt món tại Starbucks: \nThay đổi kích cỡ:\nHiện tại ở Starbucks cung cấp 4 kích cỡ ly cho bạn lựa chọn: \nShort (dung tích 8oz hay 236ml) \nTall (dung tích 12oz hay 354ml)\nGrande (dung tích 16oz hay 473ml) \nVenti (dung tích 20oz hay 591ml)', 'Các món đá xay không cà phê tại Starbucks: \nCaramel Cream Frappuccino: Caramel Cream Frappuccino tại Starbucks là món đồ uống đá xay kết hợp giữa sữa và syrup caramel ngọt ngào, tạo ra một thức uống mát lạnh, béo ngậy với hương vị caramel thơm lừng, hoàn hảo cho những ai yêu thích sự ngọt ngào và sảng khoái.', 'Pure Matcha Latte: Pure Matcha Latte tại Starbucks là món đồ uống kết hợp giữa bột matcha xanh mịn và sữa, tạo ra một thức uống nhẹ nhàng, thanh mát với hương vị trà xanh đậm đà và béo ngậy. Món nước này có thể được tùy chỉnh nóng hoặc lạnh.\nChai Latte: Chai Latte tại Starbucks là món đồ uống kết hợp giữa trà chai gia vị ấm áp và sữa, tạo ra một thức uống ngọt ngào, đậm đà với hương vị cay nhẹ và mùi thơm của các loại gia vị như quế, gừng và đinh hương. Món nước này có thể được tùy chỉnh nóng hoặc lạnh.']"," Steamed Milk tại Starbucks là sữa được hấp nóng, tạo ra một kết cấu mịn màng và béo ngậy, thường được dùng làm cơ sở cho các món cà phê như latte và cappuccino. Món nước này có thể được tùy chỉnh nóng hoặc lạnh."
Starbucks có bao nhiêu loại sữa?,"Starbucks cung cấp 6 loại sữa mà bạn có thể tùy chỉnh cho món nước của mình, bao gồm: Sữa tươi nguyên chất, Sữa half & half, Sữa ít béo, Sữa đậu nành, Sữa hạnh nhân, Sữa yến mạch.","['Các shot espresso của Starbucks được chiết suất từ 18 tới 21 giây. Là tiêu chuẩn của tất cả các cửa hàng Starbucks.\nStarbucks có bao nhiêu loại sữa?\nHiện tại Starbucks cung cấp 6 loại sữa mà bạn có thể tùy chỉnh cho món nước của mình, bao gồm: Sữa tươi nguyên chất, Sữa half & half, Sữa ít béo, Sữa đậu nành, Sữa hạnh nhân, Sữa yến mạch.  \nStarbucks có bao nhiêu loại syrup?\nHiện tại Starbucks cung cấp 6 loại syrup: Vanilla syrup, Caramel syrup, Hazelnut syrup, Brown Sugar syrup, sốt Asian Dolce, sốt Mocha', 'Thêm giảm cà phê:\nBạn có thể yêu cầu thêm một hoặc nhiều shot espresso hoặc decaf espresso với giá 15.000 đồng/shot    \nThay đổi loại sữa:\nStarbucks cung cấp 6 loại sữa mà bạn có thể tùy chỉnh cho món nước của mình, bao gồm: Sữa tươi nguyên chất, Sữa half & half, Sữa ít béo, Sữa đậu nành, Sữa hạnh nhân, Sữa yến mạch. \nĐối với sữa hạnh nhân và sữa yến mạch thì bạn cần phải trả thêm 5.000 đồng khi thay đổi các loại sữa này cho món nước của mình.\nĐiều chỉnh độ ngọt:', 'Có, cà phê muối Việt Nam tại Starbucks là món Salted Caramel Cold Foam Dolce Espresso.\nStarbucks có trà trái cây không?\nCó, Starbucks cung cấp 3 loại trà trái cây: Trà bưởi (Ruby Grapefruits And Honey Black Tea), Trà dâu (Strawberry Green Tea With Lemonade), Trà lựu (Iced Pomagranate Pearls Hibiscus) \nStarbucks có sinh tố không?']","Hiện tại Starbucks cung cấp 6 loại sữa mà bạn có thể tùy chỉnh cho món nước của mình, bao gồm: Sữa tươi nguyên chất, Sữa half & half, Sữa ít béo, Sữa đậu nành, Sữa hạnh nhân, Sữa yến mạch.  "
Starbucks có bao nhiêu loại syrup?,"Starbucks cung cấp 6 loại syrup: Vanilla syrup, Caramel syrup, Hazelnut syrup, Brown Sugar syrup, sốt Asian Dolce, và sốt Mocha.","['Các shot espresso của Starbucks được chiết suất từ 18 tới 21 giây. Là tiêu chuẩn của tất cả các cửa hàng Starbucks.\nStarbucks có bao nhiêu loại sữa?\nHiện tại Starbucks cung cấp 6 loại sữa mà bạn có thể tùy chỉnh cho món nước của mình, bao gồm: Sữa tươi nguyên chất, Sữa half & half, Sữa ít béo, Sữa đậu nành, Sữa hạnh nhân, Sữa yến mạch.  \nStarbucks có bao nhiêu loại syrup?\nHiện tại Starbucks cung cấp 6 loại syrup: Vanilla syrup, Caramel syrup, Hazelnut syrup, Brown Sugar syrup, sốt Asian Dolce, sốt Mocha', 'Thêm giảm cà phê:\nBạn có thể yêu cầu thêm một hoặc nhiều shot espresso hoặc decaf espresso với giá 15.000 đồng/shot    \nThay đổi loại sữa:\nStarbucks cung cấp 6 loại sữa mà bạn có thể tùy chỉnh cho món nước của mình, bao gồm: Sữa tươi nguyên chất, Sữa half & half, Sữa ít béo, Sữa đậu nành, Sữa hạnh nhân, Sữa yến mạch. \nĐối với sữa hạnh nhân và sữa yến mạch thì bạn cần phải trả thêm 5.000 đồng khi thay đổi các loại sữa này cho món nước của mình.\nĐiều chỉnh độ ngọt:', 'Cà món trà lắc:\nStarbucks cung cấp 6 loại trà lắc cho bạn lựa chọn:\nHibiscus Tea Lemonade: Hibiscus Tea Lemonade tại Starbucks là sự kết hợp giữa trà hoa dâm bụt có vị chua nhẹ và nước chanh tươi, tạo ra một thức uống mát lạnh, sảng khoái và đầy hương thơm. Món nước này chỉ có thể được tùy chỉnh lạnh.']","Hiện tại Starbucks cung cấp 6 loại syrup: Vanilla syrup, Caramel syrup, Hazelnut syrup, Brown Sugar syrup, sốt Asian Dolce, sốt Mocha "
Starbucks có bao nhiêu kích cỡ ly?,"Starbucks cung cấp 4 kích cỡ ly cho bạn lựa chọn: Short (dung tích 8oz), Tall (dung tích 12oz), Grande (dung tích 16oz), và Venti (dung tích 20oz).","['Starbucks có bao nhiêu cỡ ly?\nHiện tại Starbucks cung cấp 4 kích cỡ ly cho bạn lựa chọn: Short (dung tích 8oz hay 236ml), Tall (dung tích 12oz hay 354ml), Grande (dung tích 16oz hay 473ml), Venti (dung tích 20oz hay 591ml)', 'Steamed Milk: Steamed Milk tại Starbucks là sữa được hấp nóng, tạo ra một kết cấu mịn màng và béo ngậy, thường được dùng làm cơ sở cho các món cà phê như latte và cappuccino. Món nước này có thể được tùy chỉnh nóng hoặc lạnh.\nCác lựa chọn tùy chỉnh khi đặt món tại Starbucks: \nThay đổi kích cỡ:\nHiện tại ở Starbucks cung cấp 4 kích cỡ ly cho bạn lựa chọn: \nShort (dung tích 8oz hay 236ml) \nTall (dung tích 12oz hay 354ml)\nGrande (dung tích 16oz hay 473ml) \nVenti (dung tích 20oz hay 591ml)', 'Tall (dung tích 12oz hay 354ml)\nGrande (dung tích 16oz hay 473ml) \nVenti (dung tích 20oz hay 591ml) \nTuy nhiên kích cỡ Short chỉ dành cho các món nước nóng\nĐiều chỉnh mức độ cafeine:\nNếu bạn có nhu cầu giảm lượng cafeine nhưng vẫn muốn thưởng thức hương vị cà phê thì bạn có thể yêu cầu các bạn nhân viên thay đổi thành hạt cà phê decaf (là loại cà phê không cafeine) cho món nước của mình.\nThêm giảm cà phê:\nBạn có thể yêu cầu thêm một hoặc nhiều shot espresso hoặc decaf espresso với giá 15.000 đồng/shot']","Hiện tại Starbucks cung cấp 4 kích cỡ ly cho bạn lựa chọn: Short (dung tích 8oz hay 236ml), Tall (dung tích 12oz hay 354ml), Grande (dung tích 16oz hay 473ml), Venti (dung tích 20oz hay 591ml) "
